run_date,run_id,run_timestamp,regime,raw_score,normalized_score,final_score,strength_label,supporting_signals,interpretation
2026-05-27,20260527-230207-4be4208e,2026-05-27 23:02:07,Selective Capital Re-entry,134,89,89,Very Strong,Institutional Flow articles: 27; Deal Size Signal articles: 12; Institutional player mentions: 17,"Institutional flow, deal-size, or major-player activity suggests capital-market re-engagement."
2026-05-27,20260527-230207-4be4208e,2026-05-27 23:02:07,Financing Stress,121,81,81,Very Strong,Financing Risk articles: 25; Financing/cap-rate market signals: 6; Financing matched-keyword articles: 27,"Debt, rates, refinancing, or cap-rate pressure is visible enough to affect underwriting attention."
2026-05-27,20260527-230207-4be4208e,2026-05-27 23:02:07,Supply Pressure,122,81,81,Very Strong,Supply Pressure articles: 4; Supply/vacancy/concession signals: 6; Supply matched-keyword articles: 5,"Supply, starts, deliveries, lease-up, vacancy, or concession signals are visible."
2026-05-27,20260527-230207-4be4208e,2026-05-27 23:02:07,Policy / Entitlement Watch,100,67,67,Strong,Regulation Risk articles: 7; Policy matched-keyword articles: 10; California / Los Angeles focus count: 17,"Policy, zoning, permitting, entitlement, rent-control, or housing-production signals require monitoring."
2026-05-27,20260527-230207-4be4208e,2026-05-27 23:02:07,Developer Strategy Shift,88,59,59,Moderate,Developer Strategy articles: 34; Developer matched-keyword articles: 9; Must Read articles: 37,"Developer behavior, product strategy, adaptive reuse, BTR, modular, or operating-model signals are visible."
2026-05-27,20260527-230207-4be4208e,2026-05-27 23:02:07,Construction Cost Pressure,4,3,3,Not Detected,Cost Control articles: 0; Construction Cost Signal articles: 0; Cost matched-keyword articles: 1,Construction Cost Pressure is not a meaningful signal in this run.
2026-05-27,20260527-230207-4be4208e,2026-05-27 23:02:07,Stable Monitoring Environment,0,0,0,Not Detected,Highest active regime score before stable adjustment: 134; Monitor articles: 9,Stable Monitoring Environment is not a meaningful signal in this run.
