run_date,run_id,run_timestamp,deal_fingerprint_id,duplicate_cluster_id,fingerprint_confidence,canonical_project_name,canonical_deal_name,canonical_event_name,deal_type,market,residential_sector,canonical_gp_or_developer,canonical_lender_or_debt_provider,unit_count,dollar_amount,loan_amount,source_count,article_count,duplicate_count,sources,article_titles,markets_detected,highest_deal_signal_score
2026-07-24,20260724-000218-f61364aa,2026-07-24 00:02:18,DFP-8276543F02,DCL-20260724-043,55,Disposition / Exit - Other / Unknown - Workforce housing for Metro employees could rise at 4421 S. Crenshaw Blvd.,Disposition / Exit - Disposition / Exit - Other / Unknown - Workforce housing for Metro employees could rise at 4421 S. Crenshaw Blvd.,Disposition / Exit - Unknown - Other / Unknown,Disposition / Exit,Other / Unknown,Workforce Housing,Unknown,Unknown,,$25,$25,1,1,1,Urbanize LA,Workforce housing for Metro employees could rise at 4421 S. Crenshaw Blvd.,Other / Unknown,51
2026-07-24,20260724-000218-f61364aa,2026-07-24 00:02:18,DFP-0564988C4F,DCL-20260724-031,55,Entitlement / Permitting - California - Meeting Today to Discuss 161 Rancho Drive in San Jose,Entitlement / Permitting - Entitlement / Permitting - California - Meeting Today to Discuss 161 Rancho Drive in San Jose,Entitlement / Permitting - Unknown - California,Entitlement / Permitting,California,Apartment,Unknown,Unknown,,,,1,1,1,SF YIMBY,Meeting Today to Discuss 161 Rancho Drive in San Jose,California,57
2026-07-24,20260724-000218-f61364aa,2026-07-24 00:02:18,DFP-558F38E1D1,DCL-20260724-050,55,Entitlement / Permitting - Other / Unknown - Permits Filed for Affordable Housing at 430 Broadway in Oakland,Entitlement / Permitting - Entitlement / Permitting - Other / Unknown - Permits Filed for Affordable Housing at 430 Broadway in Oakland,Entitlement / Permitting - Unknown - Other / Unknown,Entitlement / Permitting,Other / Unknown,Affordable Housing,Unknown,Unknown,66 units,,,1,1,1,SF YIMBY,Permits Filed for Affordable Housing at 430 Broadway in Oakland,Other / Unknown,39
2026-07-24,20260724-000218-f61364aa,2026-07-24 00:02:18,DFP-DB73D96CFC,DCL-20260724-046,55,Entitlement / Permitting - Miami / Florida - West Palm Beach Eyeing Waterfront Rezoning Moratorium,Entitlement / Permitting - Entitlement / Permitting - Miami / Florida - West Palm Beach Eyeing Waterfront Rezoning Moratorium,Entitlement / Permitting - Unknown - Sun Belt,Entitlement / Permitting,Miami / Florida,Apartment,Unknown,Unknown,,,,1,1,1,Connect CRE South Florida,West Palm Beach Eyeing Waterfront Rezoning Moratorium,Miami / Florida,48
2026-07-24,20260724-000218-f61364aa,2026-07-24 00:02:18,DFP-3ACCB4F19B,DCL-20260724-041,55,JV / Partnership - Riverside / California - C&C Development Opens Affordable Housing in Irvine,JV / Partnership - JV / Partnership - Riverside / California - C&C Development Opens Affordable Housing in Irvine,JV / Partnership - Unknown - California,JV / Partnership,Riverside / California,Affordable Housing,Unknown,Unknown,,,,1,1,1,Connect CRE Orange County,C&C Development Opens Affordable Housing in Irvine,Riverside / California,52
2026-07-24,20260724-000218-f61364aa,2026-07-24 00:02:18,DFP-808A33B669,DCL-20260724-037,55,JV / Partnership - Los Angeles / California - Leading Multifamily Developer Joint Venture to Build Luxury Affordable Housing Community i...,JV / Partnership - JV / Partnership - Los Angeles / California - Leading Multifamily Developer Joint Venture to Build Luxury Affordable Housing Community i...,JV / Partnership - Unknown - Los Angeles,JV / Partnership,Los Angeles / California,Affordable Housing,Unknown,Unknown,,,,1,1,1,Yield PRO,Leading Multifamily Developer Joint Venture to Build Luxury Affordable Housing Community in the San Fernando Valley,Los Angeles / California,55
2026-07-24,20260724-000218-f61364aa,2026-07-24 00:02:18,DFP-2F6D8F65F6,DCL-20260724-048,45,Development Start - Other / Unknown - Missing Middle Weakness,Development Start - Development Start - Other / Unknown - Missing Middle Weakness,Development Start - Unknown - Other / Unknown,Development Start,Other / Unknown,Apartment,Unknown,Unknown,,,,1,1,1,NAHB Eye on Housing - Multifamily,Missing Middle Weakness,Other / Unknown,41
2026-07-24,20260724-000218-f61364aa,2026-07-24 00:02:18,DFP-166BBDA9A8,DCL-20260724-051,45,Development Start - Other / Unknown - Riverfront Community will Deliver 320 Luxury Residences with Private Marina Exclusively fo...,Development Start - Development Start - Other / Unknown - Riverfront Community will Deliver 320 Luxury Residences with Private Marina Exclusively fo...,Development Start - Unknown - Other / Unknown,Development Start,Other / Unknown,Apartment,Unknown,Unknown,,,,1,1,1,Yield PRO,Riverfront Community will Deliver 320 Luxury Residences with Private Marina Exclusively for Residents,Other / Unknown,37
2026-07-24,20260724-000218-f61364aa,2026-07-24 00:02:18,DFP-53DEBBEA0C,DCL-20260724-055,45,Development Start - Other / Unknown - First Quarter 2026 Multifamily Construction Data,Development Start - Development Start - Other / Unknown - First Quarter 2026 Multifamily Construction Data,Development Start - Unknown - Other / Unknown,Development Start,Other / Unknown,Multifamily,Unknown,Unknown,,,,1,1,1,NAHB Eye on Housing - Multifamily,First Quarter 2026 Multifamily Construction Data,Other / Unknown,32
2026-07-24,20260724-000218-f61364aa,2026-07-24 00:02:18,DFP-B90543DC0D,DCL-20260724-056,45,Development Start - Other / Unknown - Fourth Quarter 2025 Multifamily Construction Data,Development Start - Development Start - Other / Unknown - Fourth Quarter 2025 Multifamily Construction Data,Development Start - Unknown - Other / Unknown,Development Start,Other / Unknown,Multifamily,Unknown,Unknown,,,,1,1,1,NAHB Eye on Housing - Multifamily,Fourth Quarter 2025 Multifamily Construction Data,Other / Unknown,32
2026-07-24,20260724-000218-f61364aa,2026-07-24 00:02:18,DFP-929C698B57,DCL-20260724-057,45,Development Start - Other / Unknown - Overall Housing Starts Inch Lower in 2025,Development Start - Development Start - Other / Unknown - Overall Housing Starts Inch Lower in 2025,Development Start - Unknown - Other / Unknown,Development Start,Other / Unknown,Multifamily,Unknown,Unknown,,,,1,1,1,NAHB Eye on Housing - Multifamily,Overall Housing Starts Inch Lower in 2025,Other / Unknown,32
2026-07-24,20260724-000218-f61364aa,2026-07-24 00:02:18,DFP-9635218EA1,DCL-20260724-058,45,Development Start - Other / Unknown - Third Quarter 2025 Multifamily Construction Data,Development Start - Development Start - Other / Unknown - Third Quarter 2025 Multifamily Construction Data,Development Start - Unknown - Other / Unknown,Development Start,Other / Unknown,Multifamily,Unknown,Unknown,,,,1,1,1,NAHB Eye on Housing - Multifamily,Third Quarter 2025 Multifamily Construction Data,Other / Unknown,32
2026-07-24,20260724-000218-f61364aa,2026-07-24 00:02:18,DFP-1563B53CA0,DCL-20260724-060,45,Disposition / Exit - Other / Unknown - NAHB HBGI: Micro Markets Lone Bright Spot for Single-Family Building in Fourth Quarter,Disposition / Exit - Disposition / Exit - Other / Unknown - NAHB HBGI: Micro Markets Lone Bright Spot for Single-Family Building in Fourth Quarter,Disposition / Exit - Unknown - Other / Unknown,Disposition / Exit,Other / Unknown,Multifamily,Unknown,Unknown,,,,1,1,1,NAHB Eye on Housing - Multifamily,NAHB HBGI: Micro Markets Lone Bright Spot for Single-Family Building in Fourth Quarter,Other / Unknown,26
2026-07-24,20260724-000218-f61364aa,2026-07-24 00:02:18,DFP-54AFB6B57E,DCL-20260724-052,45,"Entitlement / Permitting - Other / Unknown - Signal Hill plans new zoning rules for ""oil patch"" district","Entitlement / Permitting - Entitlement / Permitting - Other / Unknown - Signal Hill plans new zoning rules for ""oil patch"" district",Entitlement / Permitting - Unknown - Other / Unknown,Entitlement / Permitting,Other / Unknown,Multifamily,Unknown,Unknown,,,,1,1,1,Urbanize LA,"Signal Hill plans new zoning rules for ""oil patch"" district",Other / Unknown,37
2026-07-24,20260724-000218-f61364aa,2026-07-24 00:02:18,DFP-AE0C2C64AA,DCL-20260724-059,45,General Project Signal - Other / Unknown - Multifamily Absorption Rate Remains Below 50%,General Project Signal - General Project Signal - Other / Unknown - Multifamily Absorption Rate Remains Below 50%,General Project Signal - Unknown - Other / Unknown,General Project Signal,Other / Unknown,Apartment,Unknown,Unknown,,,,1,1,1,NAHB Eye on Housing - Multifamily,Multifamily Absorption Rate Remains Below 50%,Other / Unknown,27
2026-07-24,20260724-000218-f61364aa,2026-07-24 00:02:18,DFP-DF3E9B776F,DCL-20260724-053,45,Office-to-Residential Conversion - Other / Unknown - River North Office-to-Apartment Conversion Reaches Leasing Milestone,Office-to-Residential Conversion - Office-to-Residential Conversion - Other / Unknown - River North Office-to-Apartment Conversion Reaches Leasing Milestone,Office-to-Residential Conversion - Unknown - Other / Unknown,Office-to-Residential Conversion,Other / Unknown,Apartment,Unknown,Unknown,,,,1,1,1,Connect CRE Apartments,River North Office-to-Apartment Conversion Reaches Leasing Milestone,Other / Unknown,35
