run_date,run_id,run_timestamp,deal_fingerprint_id,duplicate_cluster_id,fingerprint_confidence,canonical_project_name,canonical_deal_name,canonical_event_name,deal_type,market,residential_sector,canonical_gp_or_developer,canonical_lender_or_debt_provider,unit_count,dollar_amount,loan_amount,source_count,article_count,duplicate_count,sources,article_titles,markets_detected,highest_deal_signal_score
2026-07-24,20260724-000218-f61364aa,2026-07-24 00:02:18,DFP-DD3A4D52E5,DCL-20260724-001,100,Acquisition - California - Original Developer Trades Castro Valley Multifamily Duo,Acquisition - Acquisition - California - Original Developer Trades Castro Valley Multifamily Duo,Acquisition - Berkadia - California,Acquisition,California,Apartment,Berkadia,Berkadia,135 units,$21.45 million; $21.45 million; $14.1 million,$21.45 million,1,1,1,Connect CRE California,Original Developer Trades Castro Valley Multifamily Duo,California,100
2026-07-24,20260724-000218-f61364aa,2026-07-24 00:02:18,DFP-09C4751D78,DCL-20260724-002,100,Acquisition - San Francisco / California - Berkadia Facilitates Sale and Acquisition Financing of Multifamily Property Portfolio in t...,Acquisition - Acquisition - San Francisco / California - Berkadia Facilitates Sale and Acquisition Financing of Multifamily Property Portfolio in t...,Acquisition - Berkadia - California,Acquisition,San Francisco / California,Multifamily,Berkadia,Berkadia,135 units,$21.45 million; $14.1 million; $21.45 million,$21.45 million,1,1,1,Yield PRO,Berkadia Facilitates Sale and Acquisition Financing of Multifamily Property Portfolio in the Bay Area of California,San Francisco / California,95
2026-07-24,20260724-000218-f61364aa,2026-07-24 00:02:18,DFP-DB5E52C77E,DCL-20260724-004,90,"Acquisition - Miami / Florida - Avalon Bay Planning Apartments, Retail in South Miami","Acquisition - Acquisition - Miami / Florida - Avalon Bay Planning Apartments, Retail in South Miami",Acquisition - AvalonBay - Sun Belt,Acquisition,Miami / Florida,Mixed-Use Residential,AvalonBay,cushman,,$22 m; $22 million; $22,,1,1,1,Connect CRE South Florida,"Avalon Bay Planning Apartments, Retail in South Miami",Miami / Florida,85
2026-07-24,20260724-000218-f61364aa,2026-07-24 00:02:18,DFP-0F1C93180E,DCL-20260724-010,90,"Acquisition - California - CBRE Arranges $30M Sale of Six-Building Retail Portfolio in Long Beach, California","Acquisition - Acquisition - California - CBRE Arranges $30M Sale of Six-Building Retail Portfolio in Long Beach, California",Acquisition - CBRE - California,Acquisition,California,General Residential,CBRE,CBRE,,$30M; $30 million; $30M,,1,1,1,REBusiness Online,"CBRE Arranges $30M Sale of Six-Building Retail Portfolio in Long Beach, California",California,77
2026-07-24,20260724-000218-f61364aa,2026-07-24 00:02:18,DFP-0429255F69,DCL-20260724-005,90,Construction Financing - Miami / Florida - S3 Originates $111M Construction Loan for Edgewater Rental Community,Construction Financing - Construction Financing - Miami / Florida - S3 Originates $111M Construction Loan for Edgewater Rental Community,Construction Financing - JLL - JLL - Sun Belt,Construction Financing,Miami / Florida,Mixed-Use Residential,JLL,JLL,,$111M; $111M; $111 million,$111M,1,1,1,Connect CRE South Florida,S3 Originates $111M Construction Loan for Edgewater Rental Community,Miami / Florida,85
2026-07-24,20260724-000218-f61364aa,2026-07-24 00:02:18,DFP-BB7B16FB5F,DCL-20260724-003,90,Development Start - Atlanta / Georgia - Financing Secured for Centennial Yards Mixed-Use Project,Development Start - Development Start - Atlanta / Georgia - Financing Secured for Centennial Yards Mixed-Use Project,Development Start - CIM Group - Los Angeles,Development Start,Atlanta / Georgia,Mixed-Use Residential,CIM Group,Unknown,280 apartments,$5 billion,$5 billion,1,1,1,Connect CRE Atlanta,Financing Secured for Centennial Yards Mixed-Use Project,Atlanta / Georgia,87
2026-07-24,20260724-000218-f61364aa,2026-07-24 00:02:18,DFP-59538BF800,DCL-20260724-014,90,General Project Signal - Dallas / Texas - Dallas Apartment Builder Inks $78.7M Refi,General Project Signal - General Project Signal - Dallas / Texas - Dallas Apartment Builder Inks $78.7M Refi,General Project Signal - JLL - Los Angeles,General Project Signal,Dallas / Texas,Apartment,JLL,JLL,,$78.7M; $78.7M; $78.7 million,$78.7M,1,1,1,Connect CRE Texas,Dallas Apartment Builder Inks $78.7M Refi,Dallas / Texas,75
2026-07-24,20260724-000218-f61364aa,2026-07-24 00:02:18,DFP-6776EE5E57,DCL-20260724-007,80,Acquisition - California - Bascom Acquires Buena Park Apartments as Value-Add Deal,Acquisition - Acquisition - California - Bascom Acquires Buena Park Apartments as Value-Add Deal,Acquisition - Bascom Group - California,Acquisition,California,Apartment,Bascom Group,Unknown,,$53; $290; $53,$53,1,1,1,Connect CRE Orange County,Bascom Acquires Buena Park Apartments as Value-Add Deal,California,82
2026-07-24,20260724-000218-f61364aa,2026-07-24 00:02:18,DFP-B5B23632AD,DCL-20260724-013,80,Acquisition - Atlanta / Georgia - Walton Communities Offloads Two Atlanta Rental Properties,Acquisition - Acquisition - Atlanta / Georgia - Walton Communities Offloads Two Atlanta Rental Properties,Acquisition - JLL - Los Angeles,Acquisition,Atlanta / Georgia,Affordable Housing,JLL,JLL,,,,1,1,1,Connect CRE Apartments,Walton Communities Offloads Two Atlanta Rental Properties,Atlanta / Georgia,75
2026-07-24,20260724-000218-f61364aa,2026-07-24 00:02:18,DFP-02BAF3D804,DCL-20260724-011,80,"Construction Financing - Miami / Florida - Fort Lauderdale Developer Inks Financing for Condos, Apartments, Retail","Construction Financing - Construction Financing - Miami / Florida - Fort Lauderdale Developer Inks Financing for Condos, Apartments, Retail",Construction Financing - IPA - Sun Belt,Construction Financing,Miami / Florida,Apartment,IPA,Unknown,,$54 million; $54 million,$54 million,1,1,1,Connect CRE South Florida,"Fort Lauderdale Developer Inks Financing for Condos, Apartments, Retail",Miami / Florida,76
2026-07-24,20260724-000218-f61364aa,2026-07-24 00:02:18,DFP-AB59CDFC18,DCL-20260724-018,80,Construction Financing - Phoenix / Arizona - PCCP Provides $51.8M Refi of Gilbert 236-Unit Multifamily Community,Construction Financing - Construction Financing - Phoenix / Arizona - PCCP Provides $51.8M Refi of Gilbert 236-Unit Multifamily Community,Construction Financing - PCCP - Sun Belt,Construction Financing,Phoenix / Arizona,Apartment,PCCP,Unknown,,$51.8M; $51.8M; $51.8 million,$51.8M,1,1,1,Connect CRE Phoenix,PCCP Provides $51.8M Refi of Gilbert 236-Unit Multifamily Community,Phoenix / Arizona,73
2026-07-24,20260724-000218-f61364aa,2026-07-24 00:02:18,DFP-6C09F5459B,DCL-20260724-009,80,Disposition / Exit - California - Marcus & Millichap Closes NorCal Seniors Housing Sale,Disposition / Exit - Disposition / Exit - California - Marcus & Millichap Closes NorCal Seniors Housing Sale,Disposition / Exit - Marcus & Millichap - California,Disposition / Exit,California,Senior Housing,Marcus & Millichap,Unknown,,$10.8 million; $106; $10.8 million,$10.8 million,1,1,1,Connect CRE California,Marcus & Millichap Closes NorCal Seniors Housing Sale,California,79
2026-07-24,20260724-000218-f61364aa,2026-07-24 00:02:18,DFP-52562C0572,DCL-20260724-019,80,Disposition / Exit - Los Angeles / California - 1929-Vintage Los Feliz Apartments Sell to Dream Street Capital,Disposition / Exit - Disposition / Exit - Los Angeles / California - 1929-Vintage Los Feliz Apartments Sell to Dream Street Capital,Disposition / Exit - Marcus & Millichap - Los Angeles,Disposition / Exit,Los Angeles / California,Apartment,Marcus & Millichap,Unknown,,$5.28 million; $5.28 million,,1,1,1,Connect CRE,1929-Vintage Los Feliz Apartments Sell to Dream Street Capital,Los Angeles / California,72
2026-07-24,20260724-000218-f61364aa,2026-07-24 00:02:18,DFP-B8B704AB2A,DCL-20260724-012,80,"JV / Partnership - Los Angeles / California - CIM Group, Hulic Acquire West Hollywood Apartment Property","JV / Partnership - JV / Partnership - Los Angeles / California - CIM Group, Hulic Acquire West Hollywood Apartment Property",JV / Partnership - CIM Group - Los Angeles,JV / Partnership,Los Angeles / California,Apartment,CIM Group,Unknown,,$103 million,,1,1,1,Connect CRE California,"CIM Group, Hulic Acquire West Hollywood Apartment Property",Los Angeles / California,76
2026-07-24,20260724-000218-f61364aa,2026-07-24 00:02:18,DFP-8FB3B0CBC8,DCL-20260724-015,80,JV / Partnership - Los Angeles / California - CIM Group and Hulic Joint Venture Acquire West Hollywood Multifamily Apartment Property,JV / Partnership - JV / Partnership - Los Angeles / California - CIM Group and Hulic Joint Venture Acquire West Hollywood Multifamily Apartment Property,JV / Partnership - CIM Group - Los Angeles,JV / Partnership,Los Angeles / California,Apartment,CIM Group,Unknown,,$103 million; $103 million,,1,1,1,Yield PRO,CIM Group and Hulic Joint Venture Acquire West Hollywood Multifamily Apartment Property,Los Angeles / California,75
2026-07-24,20260724-000218-f61364aa,2026-07-24 00:02:18,DFP-38731CC7DB,DCL-20260724-016,80,JV / Partnership - Dallas / Texas - JLL Nabs Listing for 345-Unit Uptown Dallas Apartment Tower,JV / Partnership - JV / Partnership - Dallas / Texas - JLL Nabs Listing for 345-Unit Uptown Dallas Apartment Tower,JV / Partnership - Hines - Los Angeles,JV / Partnership,Dallas / Texas,Mixed-Use Residential,Hines,JLL,,,,1,1,1,Connect CRE Apartments,JLL Nabs Listing for 345-Unit Uptown Dallas Apartment Tower,Dallas / Texas,75
2026-07-24,20260724-000218-f61364aa,2026-07-24 00:02:18,DFP-B8B52BB23B,DCL-20260724-006,80,JV / Partnership - California - Mixed-use building rises at 450 The Promenade N. in Downtown Long Beach,JV / Partnership - JV / Partnership - California - Mixed-use building rises at 450 The Promenade N. in Downtown Long Beach,JV / Partnership - JPI - California,JV / Partnership,California,Affordable Housing,JPI,Unknown,580 homes,,,1,1,1,Urbanize LA,Mixed-use building rises at 450 The Promenade N. in Downtown Long Beach,California,85
2026-07-24,20260724-000218-f61364aa,2026-07-24 00:02:18,DFP-53BBEE9D89,DCL-20260724-008,80,Office-to-Residential Conversion - Santa Monica / California - Kennedy Wilson plans 133 apartments at 700 Colorado Ave. in Santa Monica,Office-to-Residential Conversion - Office-to-Residential Conversion - Santa Monica / California - Kennedy Wilson plans 133 apartments at 700 Colorado Ave. in Santa Monica,Office-to-Residential Conversion - Kennedy Wilson - California,Office-to-Residential Conversion,Santa Monica / California,Office-to-Residential Conversion,Kennedy Wilson,Unknown,133 apartments,,,1,1,1,Urbanize LA,Kennedy Wilson plans 133 apartments at 700 Colorado Ave. in Santa Monica,Santa Monica / California,81
2026-07-24,20260724-000218-f61364aa,2026-07-24 00:02:18,DFP-98CF3E5C03,DCL-20260724-017,80,Refinancing - Other / Unknown - Greystone Lends $47M for Long Island Section 8 Housing Complex,Refinancing - Refinancing - Other / Unknown - Greystone Lends $47M for Long Island Section 8 Housing Complex,Refinancing - Greystone - Fannie Mae - Other / Unknown,Refinancing,Other / Unknown,Affordable Housing,Greystone,Fannie Mae,,$47M; $47M; $91.9 million,$47m,1,1,1,Commercial Observer,Greystone Lends $47M for Long Island Section 8 Housing Complex,Other / Unknown,75
2026-07-24,20260724-000218-f61364aa,2026-07-24 00:02:18,DFP-38D0B83B42,DCL-20260724-024,75,General Project Signal - California - Interstate Equities Closes Institutional Fund at $215M,General Project Signal - General Project Signal - California - Interstate Equities Closes Institutional Fund at $215M,General Project Signal - Unknown - California,General Project Signal,California,Apartment,Unknown,Unknown,400 units,$215M; $215M; $215 million,,1,1,1,Connect CRE,Interstate Equities Closes Institutional Fund at $215M,California,65
2026-07-24,20260724-000218-f61364aa,2026-07-24 00:02:18,DFP-AC5A687A1A,DCL-20260724-027,70,Disposition / Exit - Other / Unknown - JLL Arranges Sale of 1000 Jefferson a 217-Unit Multifamily Community in One of New Jersey’...,Disposition / Exit - Disposition / Exit - Other / Unknown - JLL Arranges Sale of 1000 Jefferson a 217-Unit Multifamily Community in One of New Jersey’...,Disposition / Exit - JLL - Other / Unknown,Disposition / Exit,Other / Unknown,Apartment,JLL,JLL,,,,1,1,1,Yield PRO,JLL Arranges Sale of 1000 Jefferson a 217-Unit Multifamily Community in One of New Jersey’s Most Resilient Submarkets,Other / Unknown,61
2026-07-24,20260724-000218-f61364aa,2026-07-24 00:02:18,DFP-2F38F14A5F,DCL-20260724-032,70,General Project Signal - Other / Unknown - Greystar Receives State Funding Award to Redevelop Taunton’s Whittenton Mills,General Project Signal - General Project Signal - Other / Unknown - Greystar Receives State Funding Award to Redevelop Taunton’s Whittenton Mills,General Project Signal - Greystar - Other / Unknown,General Project Signal,Other / Unknown,Apartment,Greystar,Unknown,,$3.8; $3.8,,1,1,1,Connect CRE,Greystar Receives State Funding Award to Redevelop Taunton’s Whittenton Mills,Other / Unknown,56
2026-07-24,20260724-000218-f61364aa,2026-07-24 00:02:18,DFP-C2B2A108EA,DCL-20260724-040,65,Acquisition - Atlanta / Georgia - Lion Real Estate Picks Up Atlanta Apartments for $51M,Acquisition - Acquisition - Atlanta / Georgia - Lion Real Estate Picks Up Atlanta Apartments for $51M,Acquisition - Unknown - Los Angeles,Acquisition,Atlanta / Georgia,Apartment,Unknown,Unknown,,$51M; $51M; $51m,,1,1,1,Connect CRE Atlanta,Lion Real Estate Picks Up Atlanta Apartments for $51M,Atlanta / Georgia,52
2026-07-24,20260724-000218-f61364aa,2026-07-24 00:02:18,DFP-EFFEDEE295,DCL-20260724-021,65,Construction Financing - New York City / New York - Dwight Capital Provides $66M HUD-Insured Construction Loan for Abilene Multifamily Project,Construction Financing - Construction Financing - New York City / New York - Dwight Capital Provides $66M HUD-Insured Construction Loan for Abilene Multifamily Project,Construction Financing - Unknown - New York,Construction Financing,New York City / New York,Multifamily,Unknown,Unknown,,$66M; $66M; $66 million,$66M,1,1,1,REBusiness Online,Dwight Capital Provides $66M HUD-Insured Construction Loan for Abilene Multifamily Project,New York City / New York,65
2026-07-24,20260724-000218-f61364aa,2026-07-24 00:02:18,DFP-95F4EE8D4B,DCL-20260724-020,65,Disposition / Exit - California - Fresno Apartments Fetch $44M in First-Ever Sale,Disposition / Exit - Disposition / Exit - California - Fresno Apartments Fetch $44M in First-Ever Sale,Disposition / Exit - Unknown - California,Disposition / Exit,California,Apartment,Unknown,Unknown,,$44M; $44M; $44 million,,1,1,1,Connect CRE California,Fresno Apartments Fetch $44M in First-Ever Sale,California,66
2026-07-24,20260724-000218-f61364aa,2026-07-24 00:02:18,DFP-0F521F932F,DCL-20260724-028,65,Disposition / Exit - Other / Unknown - Northmarq Brokers $70M Sale of 381-Unit Multifamily Community in Wentzville Missouri,Disposition / Exit - Disposition / Exit - Other / Unknown - Northmarq Brokers $70M Sale of 381-Unit Multifamily Community in Wentzville Missouri,Disposition / Exit - Unknown - Other / Unknown,Disposition / Exit,Other / Unknown,Apartment,Unknown,northmarq,,$70M; $70 million; $70m,,1,1,1,Yield PRO,Northmarq Brokers $70M Sale of 381-Unit Multifamily Community in Wentzville Missouri,Other / Unknown,59
2026-07-24,20260724-000218-f61364aa,2026-07-24 00:02:18,DFP-2AA862F21F,DCL-20260724-029,65,Disposition / Exit - Seattle - Kidder Mathews Arranges Sale of Mixed-Use Apartments in Wenatchee Washington,Disposition / Exit - Disposition / Exit - Seattle - Kidder Mathews Arranges Sale of Mixed-Use Apartments in Wenatchee Washington,Disposition / Exit - Unknown - Seattle,Disposition / Exit,Seattle,Mixed-Use Residential,Unknown,Unknown,,$1; $1,,1,1,1,Yield PRO,Kidder Mathews Arranges Sale of Mixed-Use Apartments in Wenatchee Washington,Seattle,58
2026-07-24,20260724-000218-f61364aa,2026-07-24 00:02:18,DFP-60C16F9A4E,DCL-20260724-022,65,Entitlement / Permitting - Beverly Hills / California - Beverly Hills upholds approval of Builder's Remedy project at 232 S. Tower Dr.,Entitlement / Permitting - Entitlement / Permitting - Beverly Hills / California - Beverly Hills upholds approval of Builder's Remedy project at 232 S. Tower Dr.,Entitlement / Permitting - Unknown - California,Entitlement / Permitting,Beverly Hills / California,Apartment,Unknown,Unknown,55 apartments,,,1,1,1,Urbanize LA,Beverly Hills upholds approval of Builder's Remedy project at 232 S. Tower Dr.,Beverly Hills / California,65
2026-07-24,20260724-000218-f61364aa,2026-07-24 00:02:18,DFP-DB653AE903,DCL-20260724-023,65,Entitlement / Permitting - Los Angeles / California - Mixed-use project planned at 1134 N. La Brea Ave. in West Hollywood,Entitlement / Permitting - Entitlement / Permitting - Los Angeles / California - Mixed-use project planned at 1134 N. La Brea Ave. in West Hollywood,Entitlement / Permitting - Unknown - Los Angeles,Entitlement / Permitting,Los Angeles / California,Mixed-Use Residential,Unknown,Unknown,49 apartments,,,1,1,1,Urbanize LA,Mixed-use project planned at 1134 N. La Brea Ave. in West Hollywood,Los Angeles / California,65
2026-07-24,20260724-000218-f61364aa,2026-07-24 00:02:18,DFP-81F6DCC3C8,DCL-20260724-035,65,General Project Signal - Colorado - Mixed-use building proposed at 305 E. Colorado St. in Glendale,General Project Signal - General Project Signal - Colorado - Mixed-use building proposed at 305 E. Colorado St. in Glendale,General Project Signal - Unknown - Colorado,General Project Signal,Colorado,Mixed-Use Residential,Unknown,Unknown,314 apartments,,,1,1,1,Urbanize LA,Mixed-use building proposed at 305 E. Colorado St. in Glendale,Colorado,55
2026-07-24,20260724-000218-f61364aa,2026-07-24 00:02:18,DFP-3AA3DCF928,DCL-20260724-036,65,General Project Signal - Houston / Texas - Systima Closes $153M Tax-Exempt CMBS Affordable Housing Deal,General Project Signal - General Project Signal - Houston / Texas - Systima Closes $153M Tax-Exempt CMBS Affordable Housing Deal,General Project Signal - Unknown - Houston / Texas,General Project Signal,Houston / Texas,Affordable Housing,Unknown,Unknown,,$153M; $153M; $153m,$153m,1,1,1,Commercial Observer,Systima Closes $153M Tax-Exempt CMBS Affordable Housing Deal,Houston / Texas,55
2026-07-24,20260724-000218-f61364aa,2026-07-24 00:02:18,DFP-B3D024A1D8,DCL-20260724-033,65,General Project Signal - Los Angeles / California - Developer nabs financing for affordable housing at 14th & Wilshire in Santa Monica,General Project Signal - General Project Signal - Los Angeles / California - Developer nabs financing for affordable housing at 14th & Wilshire in Santa Monica,General Project Signal - Unknown - Los Angeles,General Project Signal,Los Angeles / California,Affordable Housing,Unknown,Unknown,82 apartments,,,1,1,1,Urbanize LA,Developer nabs financing for affordable housing at 14th & Wilshire in Santa Monica,Los Angeles / California,55
2026-07-24,20260724-000218-f61364aa,2026-07-24 00:02:18,DFP-5F98FB3565,DCL-20260724-044,65,General Project Signal - Atlanta / Georgia - Developer Duo Adding 350 Apartments to Dunwoody Mixed-Use Project,General Project Signal - General Project Signal - Atlanta / Georgia - Developer Duo Adding 350 Apartments to Dunwoody Mixed-Use Project,General Project Signal - Unknown - Los Angeles,General Project Signal,Atlanta / Georgia,Mixed-Use Residential,Unknown,Unknown,350 Apartments,,,1,1,1,Connect CRE Atlanta,Developer Duo Adding 350 Apartments to Dunwoody Mixed-Use Project,Atlanta / Georgia,51
2026-07-24,20260724-000218-f61364aa,2026-07-24 00:02:18,DFP-EE96DFB3FA,DCL-20260724-047,65,General Project Signal - Dallas / Texas - Oldham Goodwin Eyeing $71M Fort Worth Affordable Housing Project,General Project Signal - General Project Signal - Dallas / Texas - Oldham Goodwin Eyeing $71M Fort Worth Affordable Housing Project,General Project Signal - Unknown - Los Angeles,General Project Signal,Dallas / Texas,Affordable Housing,Unknown,Unknown,,$71M; $71M; $71 million,,1,1,1,Connect CRE Texas,Oldham Goodwin Eyeing $71M Fort Worth Affordable Housing Project,Dallas / Texas,48
2026-07-24,20260724-000218-f61364aa,2026-07-24 00:02:18,DFP-C5ECF41FDA,DCL-20260724-034,65,General Project Signal - New York City / New York - M&T RCC Provides $141M Bridge Loan to Newly Built Turtle Bay Apartments,General Project Signal - General Project Signal - New York City / New York - M&T RCC Provides $141M Bridge Loan to Newly Built Turtle Bay Apartments,General Project Signal - Unknown - New York,General Project Signal,New York City / New York,Apartment,Unknown,Unknown,,$141M; $141M; $141.4,$141M,1,1,1,Connect CRE,M&T RCC Provides $141M Bridge Loan to Newly Built Turtle Bay Apartments,New York City / New York,55
2026-07-24,20260724-000218-f61364aa,2026-07-24 00:02:18,DFP-1CC92B04D8,DCL-20260724-049,65,General Project Signal - Other / Unknown - 2026 Resident Experience Management Report,General Project Signal - General Project Signal - Other / Unknown - 2026 Resident Experience Management Report,General Project Signal - Unknown - Other / Unknown,General Project Signal,Other / Unknown,Multifamily,Unknown,Unknown,250 units,$4; $4; $90,,1,1,1,Multifamily Executive,2026 Resident Experience Management Report,Other / Unknown,40
2026-07-24,20260724-000218-f61364aa,2026-07-24 00:02:18,DFP-C4A991BFB0,DCL-20260724-038,65,General Project Signal - Virginia - Bonaventure Breaks Ground on $85.3M Multifamily Development in Norfolk,General Project Signal - General Project Signal - Virginia - Bonaventure Breaks Ground on $85.3M Multifamily Development in Norfolk,General Project Signal - Unknown - Virginia,General Project Signal,Virginia,Multifamily,Unknown,Unknown,,$85.3M; $85.3M; $85.3 million,$85.3m,1,1,1,REBusiness Online,Bonaventure Breaks Ground on $85.3M Multifamily Development in Norfolk,Virginia,53
2026-07-24,20260724-000218-f61364aa,2026-07-24 00:02:18,DFP-30C00C6EAD,DCL-20260724-039,65,General Project Signal - Washington DC - RIPCO Real Estate Arranges $28M Bridge Loan for College Park Multifamily,General Project Signal - General Project Signal - Washington DC - RIPCO Real Estate Arranges $28M Bridge Loan for College Park Multifamily,General Project Signal - Unknown - Washington DC,General Project Signal,Washington DC,Apartment,Unknown,Unknown,,$28M; $28M; $28.3 million,$28M,1,1,1,Connect CRE Apartments,RIPCO Real Estate Arranges $28M Bridge Loan for College Park Multifamily,Washington DC,53
2026-07-24,20260724-000218-f61364aa,2026-07-24 00:02:18,DFP-32F434EF47,DCL-20260724-030,65,JV / Partnership - Los Angeles / California - Bankruptcy court clears the way for Oceanwide Plaza sale,JV / Partnership - JV / Partnership - Los Angeles / California - Bankruptcy court clears the way for Oceanwide Plaza sale,JV / Partnership - Unknown - Los Angeles,JV / Partnership,Los Angeles / California,Mixed-Use Residential,Unknown,Unknown,,$517 million; $8 ; $517 million,,1,1,1,Urbanize LA,Bankruptcy court clears the way for Oceanwide Plaza sale,Los Angeles / California,58
2026-07-24,20260724-000218-f61364aa,2026-07-24 00:02:18,DFP-B9E092D5C8,DCL-20260724-026,65,Recapitalization - New York City / New York - Grubb Properties Merges Funds To Create $1.9B Apartment REIT,Recapitalization - Recapitalization - New York City / New York - Grubb Properties Merges Funds To Create $1.9B Apartment REIT,Recapitalization - Unknown - New York,Recapitalization,New York City / New York,Apartment,Unknown,Unknown,,$1.9B; $1.9B; $617M,,1,1,1,Bisnow,Grubb Properties Merges Funds To Create $1.9B Apartment REIT,New York City / New York,64
2026-07-24,20260724-000218-f61364aa,2026-07-24 00:02:18,DFP-A027CD1C9C,DCL-20260724-025,65,Refinancing - Phoenix / Arizona - JV Snags Refi on Tempe Student Housing Community,Refinancing - Refinancing - Phoenix / Arizona - JV Snags Refi on Tempe Student Housing Community,Refinancing - Unknown - Sun Belt,Refinancing,Phoenix / Arizona,Student Housing,Unknown,Unknown,,$63.5 million,$63.5 million,1,1,1,Connect CRE Phoenix,JV Snags Refi on Tempe Student Housing Community,Phoenix / Arizona,65
2026-07-24,20260724-000218-f61364aa,2026-07-24 00:02:18,DFP-A2B6787312,DCL-20260724-042,55,"Acquisition - New York - ACP Negotiates Sale of 98-Unit Apartment Building in Slingerlands, New York","Acquisition - Acquisition - New York - ACP Negotiates Sale of 98-Unit Apartment Building in Slingerlands, New York",Acquisition - Unknown - New York,Acquisition,New York,Apartment,Unknown,Unknown,,,,1,1,1,REBusiness Online,"ACP Negotiates Sale of 98-Unit Apartment Building in Slingerlands, New York",New York,51
2026-07-24,20260724-000218-f61364aa,2026-07-24 00:02:18,DFP-75C403076E,DCL-20260724-045,55,Disposition / Exit - Los Angeles / California - Sale of Oceanwide Plaza in DTLA Clears Hurdle with Bankruptcy Court Approval,Disposition / Exit - Disposition / Exit - Los Angeles / California - Sale of Oceanwide Plaza in DTLA Clears Hurdle with Bankruptcy Court Approval,Disposition / Exit - Unknown - Los Angeles,Disposition / Exit,Los Angeles / California,Apartment,Unknown,Unknown,,,,1,1,1,Connect CRE California,Sale of Oceanwide Plaza in DTLA Clears Hurdle with Bankruptcy Court Approval,Los Angeles / California,50
2026-07-24,20260724-000218-f61364aa,2026-07-24 00:02:18,DFP-739F6DA360,DCL-20260724-054,55,Disposition / Exit - Los Angeles / California - Sony Pictures and Alamo Drafthouse to revive Hollywood's iconic Cinerama Dome,Disposition / Exit - Disposition / Exit - Los Angeles / California - Sony Pictures and Alamo Drafthouse to revive Hollywood's iconic Cinerama Dome,Disposition / Exit - Unknown - Los Angeles,Disposition / Exit,Los Angeles / California,General Residential,Unknown,Unknown,,,,1,1,1,Urbanize LA,Sony Pictures and Alamo Drafthouse to revive Hollywood's iconic Cinerama Dome,Los Angeles / California,34
