run_date,run_id,canonical_project_id,canonical_project_name,project_identity_confidence,run_timestamp,project_or_deal_name,deal_type,asset_type,residential_sector,market,city_or_submarket,state_or_region,gp_or_developer,canonical_gp_or_developer,institutional_partner,lender_or_debt_provider,canonical_lender_or_debt_provider,capital_partner,canonical_capital_partner,canonical_market,unit_count,dollar_amount,loan_amount,acquisition_price,development_cost,cap_rate,rent_growth,vacancy_rate,concession_signal,construction_start_or_delivery_timing,entitlement_or_permitting_stage,deal_signal_score,deal_priority_label,potential_woomi_use,source_article_title,source,url,relevance_score,deal_fingerprint_id,fingerprint_confidence,canonical_deal_name,canonical_event_name,duplicate_cluster_id,duplicate_count
2026-05-19,20260519-101015-3b20d522,PRJ-20260519-0089,"Entitlement / Permitting - California - Formal Application Filed For Outer Richmond Safeway Redevelopment, San Francisco",80,2026-05-19 10:10:15,"Entitlement / Permitting - California - Formal Application Filed For Outer Richmond Safeway Redevelopment, San Francisco",Entitlement / Permitting,Affordable Housing,Affordable Housing,California,San Francisco,California,Unknown,Unknown,Unknown,Unknown,Unknown,Unknown,Unknown,California,,,,,,,,,,,permits,47,Monitor,Entitlement / zoning watch,"Formal Application Filed For Outer Richmond Safeway Redevelopment, San Francisco",SF YIMBY,https://sfyimby.com/2026/05/formal-application-filed-for-outer-richmond-safeway-redevelopment-san-francisco.html,55,DFP-7A232CDB3F,55,"Entitlement / Permitting - Entitlement / Permitting - California - Formal Application Filed For Outer Richmond Safeway Redevelopment, San Francisco",Entitlement / Permitting - Unknown - California,DCL-20260519-027,1
2026-05-19,20260519-101015-3b20d522,PRJ-20260519-0056,Disposition / Exit - Los Angeles - Walker & Dunlop Offer High-Profile Ground-Up Mixed-Use Development Opportunity Adjacent to...,80,2026-05-19 10:10:15,General Project Signal - Los Angeles - Soaring above the 17-acre One Beverly Hills site,General Project Signal,Unknown Residential,General Residential,Los Angeles,Los Angeles,California,Unknown,Unknown,Unknown,Unknown,Unknown,Unknown,Unknown,Los Angeles,,$10; $10,,,,,,,,,,46,Monitor,Entitlement / zoning watch,Soaring above the 17-acre One Beverly Hills site,Urbanize LA,https://la.urbanize.city/post/soaring-above-17-acre-one-beverly-hills-site,50,DFP-F1AB7E0BEA,65,General Project Signal - General Project Signal - Los Angeles - Soaring above the 17-acre One Beverly Hills site,General Project Signal - Unknown - Los Angeles,DCL-20260519-028,1
2026-05-19,20260519-101015-3b20d522,PRJ-20260519-0087,Disposition / Exit - California - Southern Land Company Launches Mortgage Division,80,2026-05-19 10:10:15,Disposition / Exit - California - Southern Land Company Launches Mortgage Division,Disposition / Exit,Unknown Residential,General Residential,California,San Diego,California,Unknown,Unknown,Unknown,Unknown,Unknown,Unknown,Unknown,California,,,,,,,,,,,,45,Monitor,Entitlement / zoning watch,Southern Land Company Launches Mortgage Division,Commercial Observer,https://commercialobserver.com/2026/05/southern-land-company-mortgage-division/,61,DFP-881AC4FB21,55,Disposition / Exit - Disposition / Exit - California - Southern Land Company Launches Mortgage Division,Disposition / Exit - Unknown - California,DCL-20260519-029,1
2026-05-19,20260519-101015-3b20d522,PRJ-20260519-0085,General Project Signal - Other / Unknown - Walker & Dunlop Arranges Equity Syndication for Colorado Affordable Multifamily Community...,80,2026-05-19 10:10:15,Development Start - Other / Unknown - Missing Middle Weakness,Development Start,Apartment,Apartment,Other / Unknown,Unknown,Unknown,Unknown,Unknown,Unknown,Unknown,Unknown,Unknown,Unknown,Other / Unknown,,,,,,,,,,,,41,Monitor,Pipeline / supply signal,Missing Middle Weakness,NAHB Eye on Housing - Multifamily,https://eyeonhousing.org/2026/01/missing-middle-weakness/,88,DFP-2F6D8F65F6,45,Development Start - Development Start - Other / Unknown - Missing Middle Weakness,Development Start - Unknown - Other / Unknown,DCL-20260519-030,1
2026-05-19,20260519-101015-3b20d522,PRJ-20260519-0085,General Project Signal - Other / Unknown - Walker & Dunlop Arranges Equity Syndication for Colorado Affordable Multifamily Community...,80,2026-05-19 10:10:15,Entitlement / Permitting - Other / Unknown - Shorter Apartment Construction Time in 2024,Entitlement / Permitting,Apartment,Apartment,Other / Unknown,Unknown,Unknown,Unknown,Unknown,Unknown,Unknown,Unknown,Unknown,Unknown,Other / Unknown,,,,,,,,,,,permit,37,Low Detail Signal,Entitlement / zoning watch,Shorter Apartment Construction Time in 2024,NAHB Eye on Housing - Multifamily,https://eyeonhousing.org/2025/10/shorter-apartment-construction-time-in-2024/,76,DFP-57A3A9A4F0,45,Entitlement / Permitting - Entitlement / Permitting - Other / Unknown - Shorter Apartment Construction Time in 2024,Entitlement / Permitting - Unknown - Other / Unknown,DCL-20260519-031,1
2026-05-19,20260519-101015-3b20d522,PRJ-20260519-0085,General Project Signal - Other / Unknown - Walker & Dunlop Arranges Equity Syndication for Colorado Affordable Multifamily Community...,80,2026-05-19 10:10:15,General Project Signal - Other / Unknown - Walker & Dunlop Arranges Equity Syndication for Colorado Affordable Multifamily Community...,General Project Signal,Affordable Housing,Affordable Housing,Other / Unknown,Unknown,Unknown,Unknown,Unknown,Unknown,walker & dunlop,walker & dunlop,Unknown,Unknown,Other / Unknown,,,,,,,,,,,,36,Low Detail Signal,Monitor only,Walker & Dunlop Arranges Equity Syndication for Colorado Affordable Multifamily Community Verrbena in Denver,Yield PRO,https://yieldpro.com/2026/05/verrbena/,80,DFP-9BE950B8DB,55,General Project Signal - General Project Signal - Other / Unknown - Walker & Dunlop Arranges Equity Syndication for Colorado Affordable Multifamily Community...,General Project Signal - Unknown - Other / Unknown,DCL-20260519-032,1
2026-05-19,20260519-101015-3b20d522,PRJ-20260519-0085,General Project Signal - Other / Unknown - Walker & Dunlop Arranges Equity Syndication for Colorado Affordable Multifamily Community...,80,2026-05-19 10:10:15,Entitlement / Permitting - Other / Unknown - Builders Stay Cautious as Single-Family Permits Weaken,Entitlement / Permitting,Multifamily,Multifamily,Other / Unknown,Unknown,Unknown,Unknown,Unknown,Unknown,Unknown,Unknown,Unknown,Unknown,Other / Unknown,,,,,,,,,,,permitting,33,Low Detail Signal,Entitlement / zoning watch,Builders Stay Cautious as Single-Family Permits Weaken,NAHB Eye on Housing - Multifamily,https://eyeonhousing.org/2025/10/builders-stay-cautious-as-single-family-permits-weaken/,66,DFP-C96F67339E,45,Entitlement / Permitting - Entitlement / Permitting - Other / Unknown - Builders Stay Cautious as Single-Family Permits Weaken,Entitlement / Permitting - Unknown - Other / Unknown,DCL-20260519-033,1
2026-05-19,20260519-101015-3b20d522,PRJ-20260519-0085,General Project Signal - Other / Unknown - Walker & Dunlop Arranges Equity Syndication for Colorado Affordable Multifamily Community...,80,2026-05-19 10:10:15,Development Start - Other / Unknown - Fourth Quarter 2025 Multifamily Construction Data,Development Start,Multifamily,Multifamily,Other / Unknown,Unknown,Unknown,Unknown,Unknown,Unknown,Unknown,Unknown,Unknown,Unknown,Other / Unknown,,,,,,,,,,,,32,Low Detail Signal,Pipeline / supply signal,Fourth Quarter 2025 Multifamily Construction Data,NAHB Eye on Housing - Multifamily,https://eyeonhousing.org/2026/03/fourth-quarter-2025-multifamily-construction-data/,63,DFP-B90543DC0D,45,Development Start - Development Start - Other / Unknown - Fourth Quarter 2025 Multifamily Construction Data,Development Start - Unknown - Other / Unknown,DCL-20260519-034,1
2026-05-19,20260519-101015-3b20d522,PRJ-20260519-0085,General Project Signal - Other / Unknown - Walker & Dunlop Arranges Equity Syndication for Colorado Affordable Multifamily Community...,80,2026-05-19 10:10:15,Development Start - Other / Unknown - Major Development Groundbreaking on Landmark Multifamily Mixed-Use Community The Piazza at...,Development Start,Mixed-Use Residential,Mixed-Use Residential,Other / Unknown,Unknown,Unknown,Unknown,Unknown,Unknown,Unknown,Unknown,Unknown,Unknown,Other / Unknown,,,,,,,,,,,,32,Low Detail Signal,Pipeline / supply signal,Major Development Groundbreaking on Landmark Multifamily Mixed-Use Community The Piazza at Ardmore in Philadelphia,Yield PRO,https://yieldpro.com/2026/05/the-piazza-at-ardmore/,64,DFP-6508E5D9F9,45,Development Start - Development Start - Other / Unknown - Major Development Groundbreaking on Landmark Multifamily Mixed-Use Community The Piazza at...,Development Start - Unknown - Other / Unknown,DCL-20260519-035,1
2026-05-19,20260519-101015-3b20d522,PRJ-20260519-0085,General Project Signal - Other / Unknown - Walker & Dunlop Arranges Equity Syndication for Colorado Affordable Multifamily Community...,80,2026-05-19 10:10:15,Development Start - Other / Unknown - Overall Housing Starts Inch Lower in 2025,Development Start,Multifamily,Multifamily,Other / Unknown,Unknown,Unknown,Unknown,Unknown,Unknown,Unknown,Unknown,Unknown,Unknown,Other / Unknown,,,,,,,,,,,,32,Low Detail Signal,Pipeline / supply signal,Overall Housing Starts Inch Lower in 2025,NAHB Eye on Housing - Multifamily,https://eyeonhousing.org/2026/02/overall-housing-starts-inch-lower-in-2025/,63,DFP-929C698B57,45,Development Start - Development Start - Other / Unknown - Overall Housing Starts Inch Lower in 2025,Development Start - Unknown - Other / Unknown,DCL-20260519-036,1
2026-05-19,20260519-101015-3b20d522,PRJ-20260519-0085,General Project Signal - Other / Unknown - Walker & Dunlop Arranges Equity Syndication for Colorado Affordable Multifamily Community...,80,2026-05-19 10:10:15,Development Start - Other / Unknown - Third Quarter 2025 Multifamily Construction Data,Development Start,Multifamily,Multifamily,Other / Unknown,Unknown,Unknown,Unknown,Unknown,Unknown,Unknown,Unknown,Unknown,Unknown,Other / Unknown,,,,,,,,,,,,32,Low Detail Signal,Pipeline / supply signal,Third Quarter 2025 Multifamily Construction Data,NAHB Eye on Housing - Multifamily,https://eyeonhousing.org/2026/01/third-quarter-2025-multifamily-construction-data/,63,DFP-9635218EA1,45,Development Start - Development Start - Other / Unknown - Third Quarter 2025 Multifamily Construction Data,Development Start - Unknown - Other / Unknown,DCL-20260519-037,1
2026-05-19,20260519-101015-3b20d522,PRJ-20260519-0085,General Project Signal - Other / Unknown - Walker & Dunlop Arranges Equity Syndication for Colorado Affordable Multifamily Community...,80,2026-05-19 10:10:15,"Entitlement / Permitting - Other / Unknown - Preliminary Permits Filed For 3350 West Bayshore Road, Palo Alto",Entitlement / Permitting,Apartment,Apartment,Other / Unknown,Unknown,Unknown,Unknown,Unknown,Unknown,Unknown,Unknown,Unknown,Unknown,Other / Unknown,,,,,,,,,,,Permits,32,Low Detail Signal,Entitlement / zoning watch,"Preliminary Permits Filed For 3350 West Bayshore Road, Palo Alto",SF YIMBY,https://sfyimby.com/2026/05/preliminary-permits-filed-for-3350-west-bayshore-road-palo-alto.html,64,DFP-BE4F6DEBA7,45,"Entitlement / Permitting - Entitlement / Permitting - Other / Unknown - Preliminary Permits Filed For 3350 West Bayshore Road, Palo Alto",Entitlement / Permitting - Unknown - Other / Unknown,DCL-20260519-038,1
2026-05-19,20260519-101015-3b20d522,PRJ-20260519-0085,General Project Signal - Other / Unknown - Walker & Dunlop Arranges Equity Syndication for Colorado Affordable Multifamily Community...,80,2026-05-19 10:10:15,General Project Signal - Other / Unknown - Multifamily Absorption Rate Remains Below 50%,General Project Signal,Apartment,Apartment,Other / Unknown,Unknown,Unknown,Unknown,Unknown,Unknown,Unknown,Unknown,Unknown,Unknown,Other / Unknown,,,,,,,,,,completed,,27,Low Detail Signal,Monitor only,Multifamily Absorption Rate Remains Below 50%,NAHB Eye on Housing - Multifamily,https://eyeonhousing.org/2026/03/multifamily-absorption-rate-remains-below-50/,78,DFP-AE0C2C64AA,45,General Project Signal - General Project Signal - Other / Unknown - Multifamily Absorption Rate Remains Below 50%,General Project Signal - Unknown - Other / Unknown,DCL-20260519-039,1
2026-05-19,20260519-101015-3b20d522,PRJ-20260519-0085,General Project Signal - Other / Unknown - Walker & Dunlop Arranges Equity Syndication for Colorado Affordable Multifamily Community...,80,2026-05-19 10:10:15,Disposition / Exit - Other / Unknown - NAHB HBGI: Micro Markets Lone Bright Spot for Single-Family Building in Fourth Quarter,Disposition / Exit,Multifamily,Multifamily,Other / Unknown,Unknown,Unknown,Unknown,Unknown,Unknown,Unknown,Unknown,Unknown,Unknown,Other / Unknown,,,,,,,,,,,,26,Low Detail Signal,Monitor only,NAHB HBGI: Micro Markets Lone Bright Spot for Single-Family Building in Fourth Quarter,NAHB Eye on Housing - Multifamily,https://eyeonhousing.org/2026/03/nahb-hbgi-micro-markets-lone-bright-spot-for-single-family-building-in-fourth-quarter/,57,DFP-1563B53CA0,45,Disposition / Exit - Disposition / Exit - Other / Unknown - NAHB HBGI: Micro Markets Lone Bright Spot for Single-Family Building in Fourth Quarter,Disposition / Exit - Unknown - Other / Unknown,DCL-20260519-040,1
2026-05-19,20260519-101015-3b20d522,PRJ-20260519-0085,General Project Signal - Other / Unknown - Walker & Dunlop Arranges Equity Syndication for Colorado Affordable Multifamily Community...,80,2026-05-19 10:10:15,BTR / Build-to-Rent - Other / Unknown - Build-to-rent sale mandate cut from House’s ROAD to Housing bill,BTR / Build-to-Rent,BTR / Single-Family Rental,BTR / Single-Family Rental,Other / Unknown,Unknown,Unknown,Unknown,Unknown,Unknown,Unknown,Unknown,Unknown,Unknown,Other / Unknown,,,,,,,,,,,,24,Low Detail Signal,Pipeline / supply signal,Build-to-rent sale mandate cut from House’s ROAD to Housing bill,Multifamily Dive,https://www.multifamilydive.com/news/build-to-rent-house-road-to-housing-bill/820391/,50,DFP-428AB2DAAB,45,BTR / Build-to-Rent - BTR / Build-to-Rent - Other / Unknown - Build-to-rent sale mandate cut from House’s ROAD to Housing bill,BTR / Build-to-Rent - Unknown - Other / Unknown,DCL-20260519-041,1
