run_date,run_id,canonical_project_id,canonical_project_name,project_identity_confidence,run_timestamp,canonical_article_id,article_integrity_status,primary_display_section,secondary_display_sections,repeat_exposure_status,freshness_score,access_status,project_or_deal_name,deal_type,asset_type,residential_sector,market,city_or_submarket,state_or_region,gp_or_developer,canonical_gp_or_developer,institutional_partner,lender_or_debt_provider,canonical_lender_or_debt_provider,capital_partner,canonical_capital_partner,canonical_market,unit_count,dollar_amount,loan_amount,acquisition_price,development_cost,cap_rate,rent_growth,vacancy_rate,concession_signal,construction_start_or_delivery_timing,entitlement_or_permitting_stage,deal_signal_score,deal_priority_label,potential_woomi_use,source_article_title,source,url,relevance_score,deal_fingerprint_id,fingerprint_confidence,canonical_deal_name,canonical_event_name,duplicate_cluster_id,duplicate_count
2026-07-06,20260706-000644-f35b7e56,PRJ-20260706-0049,Disposition / Exit - California - Former Bank Branch Positioned as Development Opportunity in Garden Grove Sale,100,2026-07-06 00:06:44,art_6e05306f1e52dc16,valid,Development Activity,GP / Capital Activity,repeat_penalized,5,open,Disposition / Exit - California - Yorba Linda Parking Lot Sells for Townhome Redevelopment,Disposition / Exit,Apartment,Apartment,California,California,California,CBRE,CBRE,Unknown,cbre,CBRE,Unknown,Unknown,California,,$8.12; $8.12,,,,,,,,,,89,High Deal Intelligence,Entitlement / zoning watch,Yorba Linda Parking Lot Sells for Townhome Redevelopment,Connect CRE Orange County,https://www.connectcre.com/stories/yorba-linda-parking-lot-sells-for-townhome-redevelopment/,100,DFP-BB73BB97D4,90,Disposition / Exit - Disposition / Exit - California - Yorba Linda Parking Lot Sells for Townhome Redevelopment,Disposition / Exit - CBRE - California,DCL-20260706-001,1
2026-07-06,20260706-000644-f35b7e56,PRJ-20260706-0139,Acquisition - Phoenix / Arizona - Inland Real Estate Group Offloads Lakewood Apartment Community for $71.5M,100,2026-07-06 00:06:44,art_c1f20094cd618c10,valid,Development Activity,GP / Capital Activity,acceptable_repeat,74,open,Acquisition - Phoenix / Arizona - Inland Real Estate Group Offloads Lakewood Apartment Community for $71.5M,Acquisition,Apartment,Apartment,Phoenix / Arizona,Phoenix,Unknown,CBRE,CBRE,Unknown,cbre,CBRE,Unknown,Unknown,Sun Belt,,$71.5M; $71.5M; $71.5 million,,$63 million,,,,,,,,85,High Deal Intelligence,Pricing benchmark,Inland Real Estate Group Offloads Lakewood Apartment Community for $71.5M,Connect CRE,https://www.connectcre.com/stories/inland-real-estate-offloads-lakewood-apartment-community-for-71-5m/,100,DFP-B933C89C02,90,Acquisition - Acquisition - Phoenix / Arizona - Inland Real Estate Group Offloads Lakewood Apartment Community for $71.5M,Acquisition - CBRE - Sun Belt,DCL-20260706-002,1
2026-07-06,20260706-000644-f35b7e56,PRJ-20260706-0069,Acquisition - Denver / Colorado - Inland Real Estate Group Sells Lakewood Colorado Multifamily Apartment Community for $71.5...,100,2026-07-06 00:06:44,art_902f5b067a1b52ab,valid,Development Activity,GP / Capital Activity,new_or_fresh,100,open,Acquisition - Denver / Colorado - Inland Real Estate Group Sells Lakewood Colorado Multifamily Apartment Community for $71.5...,Acquisition,Apartment,Apartment,Denver / Colorado,Denver,Unknown,CBRE,CBRE,Unknown,cbre,CBRE,Unknown,Unknown,Denver / Colorado,,$71.5M; $71.5 million; $63 million,$71.5m,$63 million,,,,,,,,85,High Deal Intelligence,Pricing benchmark,Inland Real Estate Group Sells Lakewood Colorado Multifamily Apartment Community for $71.5M,Yield PRO,https://yieldpro.com/2026/07/westlink-at-oak-station-2/,100,DFP-A1FA6710AA,90,Acquisition - Acquisition - Denver / Colorado - Inland Real Estate Group Sells Lakewood Colorado Multifamily Apartment Community for $71.5...,Acquisition - CBRE - Denver / Colorado,DCL-20260706-003,1
2026-07-06,20260706-000644-f35b7e56,PRJ-20260706-0070,Refinancing - Denver / Colorado - Prime Finance Refis Denver-Area Apartments With $46M Loan,100,2026-07-06 00:06:44,art_77f86da2028d85fa,valid,Development Activity,GP / Capital Activity,repeat_penalized,40,open,Refinancing - Denver / Colorado - Prime Finance Refis Denver-Area Apartments With $46M Loan,Refinancing,Apartment,Apartment,Denver / Colorado,Denver,Unknown,Walker & Dunlop,Walker & Dunlop,Unknown,walker & dunlop,walker & dunlop,Unknown,Unknown,Denver / Colorado,,$46M; $46M; $46.25 million,$46M,,,,,,,,,84,High Deal Intelligence,Capital market signal,Prime Finance Refis Denver-Area Apartments With $46M Loan,Commercial Observer,https://commercialobserver.com/2026/07/prime-finance-denver-colorado-apartments/,98,DFP-C885BE5A6B,90,Refinancing - Refinancing - Denver / Colorado - Prime Finance Refis Denver-Area Apartments With $46M Loan,Refinancing - Walker & Dunlop - walker & dunlop - Denver / Colorado,DCL-20260706-004,1
2026-07-06,20260706-000644-f35b7e56,PRJ-20260706-0051,General Project Signal - California - Northmarq Secures Fannie Mae DUS Financing for National City Apartments,100,2026-07-06 00:06:44,art_f49d2c3332c96bda,valid,Development Activity,GP / Capital Activity,acceptable_repeat,70,open,General Project Signal - California - Northmarq Secures Fannie Mae DUS Financing for National City Apartments,General Project Signal,Apartment,Apartment,California,California,California,Fannie Mae,Fannie Mae,Unknown,fannie mae,Fannie Mae,Unknown,Unknown,California,,$13.275 million; $13.275 million,$13.275 million,,,,,,,,,83,High Deal Intelligence,Capital market signal,Northmarq Secures Fannie Mae DUS Financing for National City Apartments,Connect CRE,https://www.connectcre.com/stories/northmarq-secures-fannie-mae-dus-financing-for-national-city-apartments/,100,DFP-C9AF8EBD2C,90,General Project Signal - General Project Signal - California - Northmarq Secures Fannie Mae DUS Financing for National City Apartments,General Project Signal - Fannie Mae - California,DCL-20260706-005,1
2026-07-06,20260706-000644-f35b7e56,PRJ-20260706-0159,Disposition / Exit - Seattle - CBRE Arranges $24M Sale of 87-Unit Apartment Property in Seattle,100,2026-07-06 00:06:44,art_0183a668419fe455,valid,Development Activity,GP / Capital Activity,acceptable_repeat,70,open,Disposition / Exit - Seattle - CBRE Arranges $24M Sale of 87-Unit Apartment Property in Seattle,Disposition / Exit,Apartment,Apartment,Seattle,Seattle,Seattle,CBRE,CBRE,Unknown,cbre,CBRE,Unknown,Unknown,Seattle,,$24M; $24M; $24.1 million,,,,,,,,,,81,High Deal Intelligence,Underwriting benchmark,CBRE Arranges $24M Sale of 87-Unit Apartment Property in Seattle,Connect CRE,https://www.connectcre.com/stories/cbre-arranges-24m-sale-of-87-unit-apartment-property-in-seattle/,100,DFP-6C2F8FC137,90,Disposition / Exit - Disposition / Exit - Seattle - CBRE Arranges $24M Sale of 87-Unit Apartment Property in Seattle,Disposition / Exit - CBRE - Seattle,DCL-20260706-006,1
2026-07-06,20260706-000644-f35b7e56,PRJ-20260706-0079,Office-to-Residential Conversion - Los Angeles / California - New details for plans to convert L.A. World Trade center into affordable housing,100,2026-07-06 00:06:44,art_cab5c5931d48e294,suspicious_duplicate,Development Activity,GP / Capital Activity; Market Intelligence,repeat_penalized,38,access_limited,Office-to-Residential Conversion - Los Angeles / California - New details for plans to convert L.A. World Trade center into affordable housing,Office-to-Residential Conversion,Office-to-Residential,Affordable Housing,Los Angeles / California,L.A.,Unknown,Kennedy Wilson,Kennedy Wilson,kennedy wilson,Unknown,Unknown,kennedy wilson,Kennedy Wilson,Los Angeles,"4,000 homes",,,,,,,,,,,81,High Deal Intelligence,Construction strategy reference,New details for plans to convert L.A. World Trade center into affordable housing,Urbanize LA,https://la.urbanize.city/post/new-details-plans-convert-la-world-trade-center-affordable-housing,100,DFP-90985C0644,80,Office-to-Residential Conversion - Office-to-Residential Conversion - Los Angeles / California - New details for plans to convert L.A. World Trade center into affordable housing,Office-to-Residential Conversion - Kennedy Wilson - Los Angeles,DCL-20260706-007,1
2026-07-06,20260706-000644-f35b7e56,PRJ-20260706-0056,Refinancing - California - Gantry Arranges $15.4M in Financing for Two Retail Properties in Monterey Bay Region,80,2026-07-06 00:06:44,art_84ba675c9948273f,valid,Development Activity,GP / Capital Activity,acceptable_repeat,70,open,Refinancing - California - Gantry Arranges $15.4M in Financing for Two Retail Properties in Monterey Bay Region,Refinancing,Apartment,Apartment,California,California,California,Unknown,Unknown,Unknown,Unknown,Unknown,Unknown,Unknown,California,17 apartments,$15.4M; $15.4M; $15.4 million,$15.4M,,,,,,,,,78,Useful Deal Signal,Capital market signal,Gantry Arranges $15.4M in Financing for Two Retail Properties in Monterey Bay Region,REBusiness Online,https://rebusinessonline.com/gantry-arranges-15-4m-in-financing-for-two-retail-properties-in-monterey-bay-region/,85,DFP-C5BA70E4BC,75,Refinancing - Refinancing - California - Gantry Arranges $15.4M in Financing for Two Retail Properties in Monterey Bay Region,Refinancing - Unknown - California,DCL-20260706-008,1
2026-07-06,20260706-000644-f35b7e56,PRJ-20260706-0174,"Refinancing - Riverside / California - PCCP Provides $61.3M Loan to Refinance 287-Unit Apartment Community in Washington, D.C.",100,2026-07-06 00:06:44,art_38229ae2d89d76f6,valid,Development Activity,GP / Capital Activity,acceptable_repeat,70,open,"Refinancing - Riverside / California - PCCP Provides $61.3M Loan to Refinance 287-Unit Apartment Community in Washington, D.C.",Refinancing,Apartment,Apartment,Riverside / California,"Washington, D.C.",Unknown,Kennedy Wilson,Kennedy Wilson,kennedy wilson,pgim,pgim,kennedy wilson,Kennedy Wilson,California,,$61.3M; $61.3M; $61.3 million,$61.3M,,,,,,,,,78,Useful Deal Signal,Capital market signal,"PCCP Provides $61.3M Loan to Refinance 287-Unit Apartment Community in Washington, D.C.",REBusiness Online,https://rebusinessonline.com/pccp-provides-61-3m-loan-to-refinance-287-unit-apartment-community-in-washington-d-c/,81,DFP-98908F7EB6,90,"Refinancing - Refinancing - Riverside / California - PCCP Provides $61.3M Loan to Refinance 287-Unit Apartment Community in Washington, D.C.",Refinancing - Kennedy Wilson - pgim - California,DCL-20260706-009,1
2026-07-06,20260706-000644-f35b7e56,PRJ-20260706-0116,Construction Financing - New York - Transit-Oriented Fair Lawn Multifamily Scores $67M Construction Loan,100,2026-07-06 00:06:44,art_4879cede32a47294,valid,Development Activity,GP / Capital Activity,acceptable_repeat,70,open,Construction Financing - New York - Transit-Oriented Fair Lawn Multifamily Scores $67M Construction Loan,Construction Financing,Apartment,Apartment,New York,New York,New York,PCCP,PCCP,Unknown,Unknown,Unknown,Unknown,Unknown,New York,,$67M; $67M; $66.85,$67M,,,,,,,,,77,Useful Deal Signal,Capital market signal,Transit-Oriented Fair Lawn Multifamily Scores $67M Construction Loan,Connect CRE,https://www.connectcre.com/stories/transit-oriented-fair-lawn-multifamily-scores-67m-construction-loan/,100,DFP-70CA5A796C,80,Construction Financing - Construction Financing - New York - Transit-Oriented Fair Lawn Multifamily Scores $67M Construction Loan,Construction Financing - PCCP - New York,DCL-20260706-010,1
2026-07-06,20260706-000644-f35b7e56,PRJ-20260706-0039,Construction Financing - National - Azorim Lands $69M Construction Financing for Upscale Mid-Town Residential Project,100,2026-07-06 00:06:44,art_b455a46be5eae15e,valid,Development Activity,GP / Capital Activity,acceptable_repeat,70,open,Construction Financing - National - Azorim Secures $69M Construction Loan for Yonkers Development,Construction Financing,Apartment,Apartment,National,America,Unknown,Walker & Dunlop,Walker & Dunlop,Unknown,walker & dunlop,walker & dunlop,Unknown,Unknown,National,,$69M; $69M; $69m,$69M,,,,,,,,,75,Useful Deal Signal,Capital market signal,Azorim Secures $69M Construction Loan for Yonkers Development,Commercial Observer,https://commercialobserver.com/2026/07/azorim-construction-loan-yonkers-development/,100,DFP-D7B80A847D,90,Construction Financing - Construction Financing - National - Azorim Secures $69M Construction Loan for Yonkers Development,Construction Financing - Walker & Dunlop - walker & dunlop - National,DCL-20260706-011,1
2026-07-06,20260706-000644-f35b7e56,PRJ-20260706-0157,Construction Financing - Santa Monica / California - Construction commences for mixed-use project at 2025 and 2051 Wilshire in Santa Monica,80,2026-07-06 00:06:44,art_1dcf67861f55438c,valid,Development Activity,GP / Capital Activity; Market Intelligence,repeat_penalized,50,access_limited,Construction Financing - Santa Monica / California - Construction commences for mixed-use project at 2025 and 2051 Wilshire in Santa Monica,Construction Financing,Mixed-Use Residential,Affordable Housing,Santa Monica / California,Santa Monica,Unknown,Unknown,Unknown,Unknown,Unknown,Unknown,Unknown,Unknown,California,600 apartments,$170; $170,$170,,,,,,,,permit,75,Useful Deal Signal,Capital market signal,Construction commences for mixed-use project at 2025 and 2051 Wilshire in Santa Monica,Urbanize LA,https://la.urbanize.city/post/construction-commences-mixed-use-project-2025-and-2051-wilshire-santa-monica,100,DFP-5315A5459E,75,Construction Financing - Construction Financing - Santa Monica / California - Construction commences for mixed-use project at 2025 and 2051 Wilshire in Santa Monica,Construction Financing - Unknown - California,DCL-20260706-012,1
2026-07-06,20260706-000644-f35b7e56,PRJ-20260706-0049,Disposition / Exit - California - Former Bank Branch Positioned as Development Opportunity in Garden Grove Sale,100,2026-07-06 00:06:44,art_86bc6f4162c00691,valid,Development Activity,GP / Capital Activity,repeat_penalized,5,open,Disposition / Exit - California - Former Bank Branch Positioned as Development Opportunity in Garden Grove Sale,Disposition / Exit,Unknown Residential,General Residential,California,California,California,CBRE,CBRE,Unknown,cbre,CBRE,Unknown,Unknown,California,,$11 million; $1; $11 million,,,,,,,,,,74,Useful Deal Signal,Entitlement / zoning watch,Former Bank Branch Positioned as Development Opportunity in Garden Grove Sale,Connect CRE Orange County,https://www.connectcre.com/stories/former-bank-branch-positioned-as-development-opportunity-in-garden-grove-sale/,57,DFP-5508FCE9F0,90,Disposition / Exit - Disposition / Exit - California - Former Bank Branch Positioned as Development Opportunity in Garden Grove Sale,Disposition / Exit - CBRE - California,DCL-20260706-013,1
2026-07-06,20260706-000644-f35b7e56,PRJ-20260706-0076,Refinancing - Houston / Texas - DLP Real Estate Capital Refinances Two Property Houston Multifamily Portfolio with $118M N...,80,2026-07-06 00:06:44,art_5f2ed4d83584e59d,valid,Development Activity,GP / Capital Activity,acceptable_repeat,78,open,Refinancing - Houston / Texas - DLP Real Estate Capital Refinances Two Property Houston Multifamily Portfolio with $118M N...,Refinancing,Apartment,Apartment,Houston / Texas,Houston,Unknown,Unknown,Unknown,Unknown,Unknown,Unknown,Unknown,Unknown,Houston / Texas,605 units,$118M; $118 million; $118m,$118 million,,,,,,,,,74,Useful Deal Signal,Capital market signal,DLP Real Estate Capital Refinances Two Property Houston Multifamily Portfolio with $118M Note,Yield PRO,https://yieldpro.com/2026/07/elan-memorial-park/,98,DFP-67D56239F6,75,Refinancing - Refinancing - Houston / Texas - DLP Real Estate Capital Refinances Two Property Houston Multifamily Portfolio with $118M N...,Refinancing - Unknown - Houston / Texas,DCL-20260706-014,1
2026-07-06,20260706-000644-f35b7e56,PRJ-20260706-0161,Construction Financing - Miami / Florida - LCOR Inks $192.5M Construction Loan for Biscayne Bay Apartments,80,2026-07-06 00:06:44,art_e2b7f114160040f1,valid,Development Activity,,repeat_penalized,55,open,Development Start - Miami / Florida - Developer Begins Work on 476-Unit Delray Beach Rental Community,Development Start,Apartment,Apartment,Miami / Florida,South Florida,Unknown,Unknown,Unknown,Unknown,wells fargo,wells fargo,Unknown,Unknown,Sun Belt,,$120 million; $41.84 million,$120 million,,,,,,,broke ground,,73,Useful Deal Signal,Capital market signal,Developer Begins Work on 476-Unit Delray Beach Rental Community,Connect CRE South Florida,https://www.connectcre.com/stories/developer-begins-work-on-476-unit-delray-beach-rental-community/,100,DFP-FCF9676ECA,75,Development Start - Development Start - Miami / Florida - Developer Begins Work on 476-Unit Delray Beach Rental Community,Development Start - Unknown - Sun Belt,DCL-20260706-015,1
2026-07-06,20260706-000644-f35b7e56,PRJ-20260706-0168,Construction Financing - Tampa / Florida - Joint Venture Between Focus and Bradford Allen Secures $135M for Metro Tampa Multifamily P...,100,2026-07-06 00:06:44,art_009e14830a152c33,valid,Development Activity,GP / Capital Activity,new_or_fresh,100,open,Construction Financing - Tampa / Florida - Joint Venture Between Focus and Bradford Allen Secures $135M for Metro Tampa Multifamily P...,Construction Financing,Multifamily,Multifamily,Tampa / Florida,Tampa,Unknown,Affinius Capital,Affinius Capital,Unknown,Unknown,Unknown,Unknown,Unknown,Sun Belt,,$135M; $135 million; $20.2 million,$135M,$20.2 million,,,,,,,,72,Useful Deal Signal,Pricing benchmark,Joint Venture Between Focus and Bradford Allen Secures $135M for Metro Tampa Multifamily Project,Yield PRO,https://yieldpro.com/2026/07/275-and-fifth/,87,DFP-52525019E7,80,Construction Financing - Construction Financing - Tampa / Florida - Joint Venture Between Focus and Bradford Allen Secures $135M for Metro Tampa Multifamily P...,Construction Financing - Affinius Capital - Sun Belt,DCL-20260706-016,1
2026-07-06,20260706-000644-f35b7e56,PRJ-20260706-0119,Construction Financing - Sun Belt - S3 Provides $101M Construction Financing for Orlando Multifamily Mixed-Use Residences Proj...,80,2026-07-06 00:06:44,art_c576e1927858e347,valid,Development Activity,GP / Capital Activity,new_or_fresh,100,open,Construction Financing - Sun Belt - S3 Provides $101M Construction Financing for Orlando Multifamily Mixed-Use Residences Proj...,Construction Financing,Mixed-Use Residential,Mixed-Use Residential,Sun Belt,Orlando,Sun Belt,Unknown,Unknown,Unknown,Unknown,Unknown,Unknown,Unknown,Sun Belt,460 units,$101M; $101 million; $101m,$101M,,,,,,,,,72,Useful Deal Signal,Capital market signal,S3 Provides $101M Construction Financing for Orlando Multifamily Mixed-Use Residences Project,Yield PRO,https://yieldpro.com/2026/07/visions-orlando-resort-spa/,92,DFP-913FDF9A87,75,Construction Financing - Construction Financing - Sun Belt - S3 Provides $101M Construction Financing for Orlando Multifamily Mixed-Use Residences Proj...,Construction Financing - Unknown - Sun Belt,DCL-20260706-017,1
2026-07-06,20260706-000644-f35b7e56,PRJ-20260706-0109,Construction Financing - Miami / Florida - LCOR Lands $193M for Miami Rental Tower,80,2026-07-06 00:06:44,art_b3a6dc5605f858f7,valid,Development Activity,GP / Capital Activity,acceptable_repeat,70,open,Construction Financing - Miami / Florida - LCOR Lands $193M for Miami Rental Tower,Construction Financing,Multifamily,Multifamily,Miami / Florida,Miami,Unknown,Unknown,Unknown,Unknown,Unknown,Unknown,Unknown,Unknown,Sun Belt,544 units,$193M; $193M; $192.5 million,$193M,,,,,,,,,71,Useful Deal Signal,Capital market signal,LCOR Lands $193M for Miami Rental Tower,Commercial Observer,https://commercialobserver.com/2026/07/lcor-miami-1775-biscayne-natixis/,89,DFP-3F38F4D04A,75,Construction Financing - Construction Financing - Miami / Florida - LCOR Lands $193M for Miami Rental Tower,Construction Financing - Unknown - Sun Belt,DCL-20260706-018,1
2026-07-06,20260706-000644-f35b7e56,PRJ-20260706-0093,"Office-to-Residential Conversion - Los Angeles / California - Kennedy Wilson, Jamison To Convert LA World Trade Center In 4,000-Unit Affordable Housing...",100,2026-07-06 00:06:44,art_9eaa80f4446f9c69,valid,Development Activity,GP / Capital Activity,repeat_penalized,32,open,"Office-to-Residential Conversion - Los Angeles / California - Kennedy Wilson, Jamison Partner to Deliver 4,000 Affordable Units Across LA",Office-to-Residential Conversion,Office-to-Residential,Affordable Housing,Los Angeles / California,Los Angeles,California,Kennedy Wilson,Kennedy Wilson,kennedy wilson,Unknown,Unknown,kennedy wilson,Kennedy Wilson,Los Angeles,,,,,,,,,,,,71,Useful Deal Signal,Construction strategy reference,"Kennedy Wilson, Jamison Partner to Deliver 4,000 Affordable Units Across LA",Connect CRE California,https://www.connectcre.com/stories/kennedy-wilson-jamison-partner-to-deliver-4000-affordable-units-across-la/,100,DFP-75D0408706,70,"Office-to-Residential Conversion - Office-to-Residential Conversion - Los Angeles / California - Kennedy Wilson, Jamison Partner to Deliver 4,000 Affordable Units Across LA",Office-to-Residential Conversion - Kennedy Wilson - Los Angeles,DCL-20260706-019,1
2026-07-06,20260706-000644-f35b7e56,PRJ-20260706-0130,General Project Signal - Other / Unknown - Gantry Arranges $32.5M Permanent Loan for Kansas City Multifamily Property,100,2026-07-06 00:06:44,art_bab645f81b1922a3,valid,Development Activity,GP / Capital Activity,acceptable_repeat,70,open,General Project Signal - Other / Unknown - Gantry Arranges $32.5M Permanent Loan for Kansas City Multifamily Property,General Project Signal,Multifamily,Multifamily,Other / Unknown,Unknown,Unknown,Freddie Mac,Freddie Mac,Unknown,freddie mac,Freddie Mac,Unknown,Unknown,Other / Unknown,243 units,$32.5M; $32.5M; $32.5 million,$32.5M,,,,,,,,,69,Useful Deal Signal,Capital market signal,Gantry Arranges $32.5M Permanent Loan for Kansas City Multifamily Property,REBusiness Online,https://rebusinessonline.com/gantry-arranges-32-5m-permanent-loan-for-kansas-city-multifamily-property/,84,DFP-EF4887D353,90,General Project Signal - General Project Signal - Other / Unknown - Gantry Arranges $32.5M Permanent Loan for Kansas City Multifamily Property,General Project Signal - Freddie Mac - Other / Unknown,DCL-20260706-020,1
2026-07-06,20260706-000644-f35b7e56,PRJ-20260706-0054,"Recapitalization - California - PEF Advisors, Freestone Capital Form JV to Recapitalize Affordable Properties",100,2026-07-06 00:06:44,art_f0e5befbb21a23aa,valid,Development Activity,GP / Capital Activity,repeat_penalized,5,open,"Recapitalization - California - PEF Advisors, Freestone Capital Form JV to Recapitalize Affordable Properties",Recapitalization,Affordable Housing,Affordable Housing,California,California,California,PEF Advisors,PEF Advisors,Unknown,Unknown,Unknown,Unknown,Unknown,California,,,,,,,,,,,,69,Useful Deal Signal,Capital market signal,"PEF Advisors, Freestone Capital Form JV to Recapitalize Affordable Properties",Connect CRE Orange County,https://www.connectcre.com/stories/pef-advisors-freestone-capital-form-jv-to-recapitalize-affordable-properties/,84,DFP-920342F693,70,"Recapitalization - Recapitalization - California - PEF Advisors, Freestone Capital Form JV to Recapitalize Affordable Properties",Recapitalization - PEF Advisors - California,DCL-20260706-021,1
2026-07-06,20260706-000644-f35b7e56,PRJ-20260706-0101,JV / Partnership - New York City / New York - Sterling Joint Venture Secures $67M for New Jersey Age-Restricted Multifamily Community 20...,100,2026-07-06 00:06:44,art_18d0d558db4b601d,valid,Development Activity,GP / Capital Activity,repeat_penalized,48,open,JV / Partnership - New York City / New York - Sterling Joint Venture Secures $67M for New Jersey Age-Restricted Multifamily Community 20...,JV / Partnership,Multifamily,Multifamily,New York City / New York,Manhattan,Unknown,PCCP,PCCP,Unknown,Unknown,Unknown,Unknown,Unknown,New York,,$67M; $66.9 million; $67m,$67M,,,,,,,,,68,Useful Deal Signal,Capital market signal,Sterling Joint Venture Secures $67M for New Jersey Age-Restricted Multifamily Community 20 Minutes from Manhattan,Yield PRO,https://yieldpro.com/2026/07/plaza-greene/,75,DFP-FE5452E7B0,80,JV / Partnership - JV / Partnership - New York City / New York - Sterling Joint Venture Secures $67M for New Jersey Age-Restricted Multifamily Community 20...,JV / Partnership - PCCP - New York,DCL-20260706-022,1
2026-07-06,20260706-000644-f35b7e56,PRJ-20260706-0097,Entitlement / Permitting - Los Angeles / California - City Council upholds approval of mixed-use project at 1410 Main St. in Venice,80,2026-07-06 00:06:44,art_25d7d57fb034eaa9,valid,Development Activity,,repeat_penalized,58,access_limited,Entitlement / Permitting - Los Angeles / California - 62 apartments underway at 11103 Hartsook Ave. in North Hollywood,Entitlement / Permitting,BTR / Single-Family Rental,Apartment,Los Angeles / California,Los Angeles,California,Unknown,Unknown,Unknown,Unknown,Unknown,Unknown,Unknown,Los Angeles,62 apartments,,,,,,,,,,permits,65,Useful Deal Signal,Entitlement / zoning watch,62 apartments underway at 11103 Hartsook Ave. in North Hollywood,Urbanize LA,https://la.urbanize.city/post/62-apartments-underway-11103-hartsook-ave-north-hollywood,100,DFP-0B5A6FA875,65,Entitlement / Permitting - Entitlement / Permitting - Los Angeles / California - 62 apartments underway at 11103 Hartsook Ave. in North Hollywood,Entitlement / Permitting - Unknown - Los Angeles,DCL-20260706-023,1
