run_date,run_id,canonical_project_id,canonical_project_name,project_identity_confidence,run_timestamp,canonical_article_id,article_integrity_status,primary_display_section,secondary_display_sections,repeat_exposure_status,freshness_score,access_status,project_or_deal_name,deal_type,asset_type,residential_sector,market,city_or_submarket,state_or_region,gp_or_developer,canonical_gp_or_developer,institutional_partner,lender_or_debt_provider,canonical_lender_or_debt_provider,capital_partner,canonical_capital_partner,canonical_market,unit_count,dollar_amount,loan_amount,acquisition_price,development_cost,cap_rate,rent_growth,vacancy_rate,concession_signal,construction_start_or_delivery_timing,entitlement_or_permitting_stage,deal_signal_score,deal_priority_label,potential_woomi_use,source_article_title,source,url,relevance_score,deal_fingerprint_id,fingerprint_confidence,canonical_deal_name,canonical_event_name,duplicate_cluster_id,duplicate_count
2026-07-06,20260706-000644-f35b7e56,PRJ-20260706-0145,JV / Partnership - Riverside / California - C&C Development Opens Affordable Housing in Irvine,80,2026-07-06 00:06:44,art_8440ae3933180497,valid,Development Activity,GP / Capital Activity,acceptable_repeat,70,open,JV / Partnership - Riverside / California - C&C Development Opens Affordable Housing in Irvine,JV / Partnership,Affordable Housing,Affordable Housing,Riverside / California,Riverside,California,Unknown,Unknown,Unknown,Unknown,Unknown,Unknown,Unknown,California,,,,,,,,,,,,52,Monitor,GP partnership reference,C&C Development Opens Affordable Housing in Irvine,Connect CRE Orange County,https://www.connectcre.com/stories/cc-development-opens-affordable-housing-in-irvine/,92,DFP-3ACCB4F19B,55,JV / Partnership - JV / Partnership - Riverside / California - C&C Development Opens Affordable Housing in Irvine,JV / Partnership - Unknown - California,DCL-20260706-048,1
2026-07-06,20260706-000644-f35b7e56,PRJ-20260706-0043,General Project Signal - Atlanta / Georgia - Developer Duo Adding 350 Apartments to Dunwoody Mixed-Use Project,80,2026-07-06 00:06:44,art_57f6dfd71fe6e77c,valid,Development Activity,,repeat_penalized,58,open,General Project Signal - Atlanta / Georgia - Developer Duo Adding 350 Apartments to Dunwoody Mixed-Use Project,General Project Signal,Mixed-Use Residential,Mixed-Use Residential,Atlanta / Georgia,Atlanta,Unknown,Unknown,Unknown,Unknown,Unknown,Unknown,Unknown,Unknown,Los Angeles,350 Apartments,,,,,,,,,,,51,Monitor,Underwriting benchmark,Developer Duo Adding 350 Apartments to Dunwoody Mixed-Use Project,Connect CRE Atlanta,https://www.connectcre.com/stories/developer-duo-adding-350-apartments-to-dunwoody-mixed-use-project/,88,DFP-5F98FB3565,65,General Project Signal - General Project Signal - Atlanta / Georgia - Developer Duo Adding 350 Apartments to Dunwoody Mixed-Use Project,General Project Signal - Unknown - Los Angeles,DCL-20260706-049,1
2026-07-06,20260706-000644-f35b7e56,PRJ-20260706-0134,Operational / Property Management Tech - Other / Unknown - Beyond efficiency: How leading multifamily operators are putting AI to work,80,2026-07-06 00:06:44,art_eb781e8a038279c7,valid,Development Activity,,repeat_penalized,48,open,Entitlement / Permitting - Other / Unknown - Madison Capital Launching $60M St. Johns County Multifamily Rental Project,Entitlement / Permitting,Apartment,Workforce Housing,Other / Unknown,Unknown,Unknown,Unknown,Unknown,Unknown,Unknown,Unknown,Unknown,Unknown,Other / Unknown,,$60M; $26.5 million; $60 million,,,,,,,,,permits,50,Monitor,Entitlement / zoning watch,Madison Capital Launching $60M St. Johns County Multifamily Rental Project,Yield PRO,https://yieldpro.com/2026/07/875-state-road-16/,87,DFP-D73975CCDE,55,Entitlement / Permitting - Entitlement / Permitting - Other / Unknown - Madison Capital Launching $60M St. Johns County Multifamily Rental Project,Entitlement / Permitting - Unknown - Other / Unknown,DCL-20260706-050,1
2026-07-06,20260706-000644-f35b7e56,PRJ-20260706-0161,Construction Financing - Miami / Florida - LCOR Inks $192.5M Construction Loan for Biscayne Bay Apartments,80,2026-07-06 00:06:44,art_297515b4cfa33344,valid,Development Activity,,repeat_penalized,58,open,General Project Signal - Miami / Florida - Dezer Advancing Plan for 600 N. Miami Apartment Units,General Project Signal,Apartment,Apartment,Miami / Florida,South Florida,Unknown,Unknown,Unknown,Unknown,Unknown,Unknown,Unknown,Unknown,Sun Belt,269 apartments,,,,,,,,,,,49,Monitor,Underwriting benchmark,Dezer Advancing Plan for 600 N. Miami Apartment Units,Connect CRE South Florida,https://www.connectcre.com/stories/dezer-advancing-plan-for-600-n-miami-apartment-units/,83,DFP-C771F888AB,65,General Project Signal - General Project Signal - Miami / Florida - Dezer Advancing Plan for 600 N. Miami Apartment Units,General Project Signal - Unknown - Sun Belt,DCL-20260706-051,1
2026-07-06,20260706-000644-f35b7e56,PRJ-20260706-0134,Operational / Property Management Tech - Other / Unknown - Beyond efficiency: How leading multifamily operators are putting AI to work,80,2026-07-06 00:06:44,art_381f2ea06c473cb1,valid,Development Activity,,repeat_penalized,58,access_limited,Entitlement / Permitting - Other / Unknown - Affordable housing completed at 3300 Washington Blvd. in Arlington Heights,Entitlement / Permitting,Affordable Housing,Affordable Housing,Other / Unknown,Unknown,Unknown,Unknown,Unknown,Unknown,Unknown,Unknown,Unknown,Unknown,Other / Unknown,,,,,,,,,,completed,permit,44,Monitor,Entitlement / zoning watch,Affordable housing completed at 3300 Washington Blvd. in Arlington Heights,Urbanize LA,https://la.urbanize.city/post/affordable-housing-completed-3300-washington-blvd-arlington-heights,97,DFP-559B1A585C,45,Entitlement / Permitting - Entitlement / Permitting - Other / Unknown - Affordable housing completed at 3300 Washington Blvd. in Arlington Heights,Entitlement / Permitting - Unknown - Other / Unknown,DCL-20260706-052,1
2026-07-06,20260706-000644-f35b7e56,PRJ-20260706-0134,Operational / Property Management Tech - Other / Unknown - Beyond efficiency: How leading multifamily operators are putting AI to work,80,2026-07-06 00:06:44,art_c49101dd4881b591,valid,Development Activity,Market Intelligence,repeat_penalized,5,open,Development Start - Other / Unknown - Missing Middle Weakness,Development Start,Apartment,Apartment,Other / Unknown,Unknown,Unknown,Unknown,Unknown,Unknown,Unknown,Unknown,Unknown,Unknown,Other / Unknown,,,,,,,,,,,,41,Monitor,Pipeline / supply signal,Missing Middle Weakness,NAHB Eye on Housing - Multifamily,https://eyeonhousing.org/2026/01/missing-middle-weakness/,88,DFP-2F6D8F65F6,45,Development Start - Development Start - Other / Unknown - Missing Middle Weakness,Development Start - Unknown - Other / Unknown,DCL-20260706-053,1
2026-07-06,20260706-000644-f35b7e56,PRJ-20260706-0161,Construction Financing - Miami / Florida - LCOR Inks $192.5M Construction Loan for Biscayne Bay Apartments,80,2026-07-06 00:06:44,art_58d2f3c5cddb4ea3,valid,Development Activity,GP / Capital Activity,repeat_penalized,55,open,General Project Signal - Miami / Florida - Miami-Dade County Sells Apartment Site for $10,General Project Signal,Affordable Housing,Affordable Housing,Miami / Florida,South Florida,Unknown,Unknown,Unknown,Unknown,Unknown,Unknown,Unknown,Unknown,Sun Belt,,$10 ; $10 ; $10 ,,,,,,,,,,41,Monitor,Underwriting benchmark,Miami-Dade County Sells Apartment Site for $10,Connect CRE South Florida,https://www.connectcre.com/stories/miami-dade-county-sells-apartment-site-for-10/,61,DFP-C6A3BF1355,65,General Project Signal - General Project Signal - Miami / Florida - Miami-Dade County Sells Apartment Site for $10,General Project Signal - Unknown - Sun Belt,DCL-20260706-054,1
2026-07-06,20260706-000644-f35b7e56,PRJ-20260706-0171,"Development Start - Texas - Core Spaces Advancing 2,201-Bed Texas A&M Student Housing Venture",80,2026-07-06 00:06:44,art_50f3ed864e73b44a,valid,Development Activity,,acceptable_repeat,70,open,"Development Start - Texas - Core Spaces Advancing 2,201-Bed Texas A&M Student Housing Venture",Development Start,Student Housing,Student Housing,Texas,Texas,Texas,Unknown,Unknown,Unknown,Unknown,Unknown,Unknown,Unknown,Texas,,,,,,,,,,broke ground,,40,Monitor,Pipeline / supply signal,"Core Spaces Advancing 2,201-Bed Texas A&M Student Housing Venture",Connect CRE Texas,https://www.connectcre.com/stories/core-spaces-advancing-2201-bed-texas-am-student-housing-venture/,57,DFP-CC7AC3449E,55,"Development Start - Development Start - Texas - Core Spaces Advancing 2,201-Bed Texas A&M Student Housing Venture",Development Start - Unknown - Texas,DCL-20260706-055,1
2026-07-06,20260706-000644-f35b7e56,PRJ-20260706-0134,Operational / Property Management Tech - Other / Unknown - Beyond efficiency: How leading multifamily operators are putting AI to work,80,2026-07-06 00:06:44,art_266f44ae4fd99ed0,low_value_promotional,Excluded,,repeat_penalized,46,open,General Project Signal - Other / Unknown - 2026 Resident Experience Management Report,General Project Signal,Multifamily,Multifamily,Other / Unknown,Unknown,Unknown,Unknown,Unknown,Unknown,Unknown,Unknown,Unknown,Unknown,Other / Unknown,250 units,$4; $4; $90,,,,,,,,,,40,Monitor,Underwriting benchmark,2026 Resident Experience Management Report,Multifamily Executive,https://www.multifamilyexecutive.com/premium/whitepaper/753766,58,DFP-1CC92B04D8,65,General Project Signal - General Project Signal - Other / Unknown - 2026 Resident Experience Management Report,General Project Signal - Unknown - Other / Unknown,DCL-20260706-056,1
2026-07-06,20260706-000644-f35b7e56,PRJ-20260706-0097,Entitlement / Permitting - Los Angeles / California - City Council upholds approval of mixed-use project at 1410 Main St. in Venice,80,2026-07-06 00:06:44,art_1ea8396827d596f1,valid,Development Activity,GP / Capital Activity; Market Intelligence,new_or_fresh,88,access_limited,Disposition / Exit - Los Angeles / California - Affordable for-sale housing proposed at 9019 Long Beach Blvd. in South Gate,Disposition / Exit,Affordable Housing,Affordable Housing,Los Angeles / California,Los Angeles,California,Unknown,Unknown,Unknown,Unknown,Unknown,Unknown,Unknown,Los Angeles,,,,,,,,,,,permit,36,Low Detail Signal,Monitor only,Affordable for-sale housing proposed at 9019 Long Beach Blvd. in South Gate,Urbanize LA,https://la.urbanize.city/post/affordable-sale-housing-proposed-9019-long-beach-blvd-south-gate,56,DFP-A7878F2700,55,Disposition / Exit - Disposition / Exit - Los Angeles / California - Affordable for-sale housing proposed at 9019 Long Beach Blvd. in South Gate,Disposition / Exit - Unknown - Los Angeles,DCL-20260706-057,1
2026-07-06,20260706-000644-f35b7e56,PRJ-20260706-0134,Operational / Property Management Tech - Other / Unknown - Beyond efficiency: How leading multifamily operators are putting AI to work,80,2026-07-06 00:06:44,art_bbf68370d5e8064d,valid,Market Intelligence,,repeat_penalized,5,open,Development Start - Other / Unknown - First Quarter 2026 Multifamily Construction Data,Development Start,Multifamily,Multifamily,Other / Unknown,Unknown,Unknown,Unknown,Unknown,Unknown,Unknown,Unknown,Unknown,Unknown,Other / Unknown,,,,,,,,,,,,32,Low Detail Signal,Pipeline / supply signal,First Quarter 2026 Multifamily Construction Data,NAHB Eye on Housing - Multifamily,https://eyeonhousing.org/2026/05/first-quarter-2026-multifamily-construction-data/,63,DFP-53DEBBEA0C,45,Development Start - Development Start - Other / Unknown - First Quarter 2026 Multifamily Construction Data,Development Start - Unknown - Other / Unknown,DCL-20260706-058,1
2026-07-06,20260706-000644-f35b7e56,PRJ-20260706-0134,Operational / Property Management Tech - Other / Unknown - Beyond efficiency: How leading multifamily operators are putting AI to work,80,2026-07-06 00:06:44,art_695932dbcd227470,valid,Market Intelligence,,repeat_penalized,5,open,Development Start - Other / Unknown - Fourth Quarter 2025 Multifamily Construction Data,Development Start,Multifamily,Multifamily,Other / Unknown,Unknown,Unknown,Unknown,Unknown,Unknown,Unknown,Unknown,Unknown,Unknown,Other / Unknown,,,,,,,,,,,,32,Low Detail Signal,Pipeline / supply signal,Fourth Quarter 2025 Multifamily Construction Data,NAHB Eye on Housing - Multifamily,https://eyeonhousing.org/2026/03/fourth-quarter-2025-multifamily-construction-data/,63,DFP-B90543DC0D,45,Development Start - Development Start - Other / Unknown - Fourth Quarter 2025 Multifamily Construction Data,Development Start - Unknown - Other / Unknown,DCL-20260706-059,1
2026-07-06,20260706-000644-f35b7e56,PRJ-20260706-0134,Operational / Property Management Tech - Other / Unknown - Beyond efficiency: How leading multifamily operators are putting AI to work,80,2026-07-06 00:06:44,art_a18108b1d53a8afa,valid,Market Intelligence,,repeat_penalized,5,open,Development Start - Other / Unknown - Overall Housing Starts Inch Lower in 2025,Development Start,Multifamily,Multifamily,Other / Unknown,Unknown,Unknown,Unknown,Unknown,Unknown,Unknown,Unknown,Unknown,Unknown,Other / Unknown,,,,,,,,,,,,32,Low Detail Signal,Pipeline / supply signal,Overall Housing Starts Inch Lower in 2025,NAHB Eye on Housing - Multifamily,https://eyeonhousing.org/2026/02/overall-housing-starts-inch-lower-in-2025/,63,DFP-929C698B57,45,Development Start - Development Start - Other / Unknown - Overall Housing Starts Inch Lower in 2025,Development Start - Unknown - Other / Unknown,DCL-20260706-060,1
2026-07-06,20260706-000644-f35b7e56,PRJ-20260706-0134,Operational / Property Management Tech - Other / Unknown - Beyond efficiency: How leading multifamily operators are putting AI to work,80,2026-07-06 00:06:44,art_7836a522c6b8b1a5,valid,Market Intelligence,,repeat_penalized,5,open,Development Start - Other / Unknown - Third Quarter 2025 Multifamily Construction Data,Development Start,Multifamily,Multifamily,Other / Unknown,Unknown,Unknown,Unknown,Unknown,Unknown,Unknown,Unknown,Unknown,Unknown,Other / Unknown,,,,,,,,,,,,32,Low Detail Signal,Pipeline / supply signal,Third Quarter 2025 Multifamily Construction Data,NAHB Eye on Housing - Multifamily,https://eyeonhousing.org/2026/01/third-quarter-2025-multifamily-construction-data/,63,DFP-9635218EA1,45,Development Start - Development Start - Other / Unknown - Third Quarter 2025 Multifamily Construction Data,Development Start - Unknown - Other / Unknown,DCL-20260706-061,1
2026-07-06,20260706-000644-f35b7e56,PRJ-20260706-0134,Operational / Property Management Tech - Other / Unknown - Beyond efficiency: How leading multifamily operators are putting AI to work,80,2026-07-06 00:06:44,art_04cbffa23673da57,valid,Market Intelligence,,repeat_penalized,5,open,General Project Signal - Other / Unknown - Multifamily Absorption Rate Remains Below 50%,General Project Signal,Apartment,Apartment,Other / Unknown,Unknown,Unknown,Unknown,Unknown,Unknown,Unknown,Unknown,Unknown,Unknown,Other / Unknown,,,,,,,,,,completed,,27,Low Detail Signal,Monitor only,Multifamily Absorption Rate Remains Below 50%,NAHB Eye on Housing - Multifamily,https://eyeonhousing.org/2026/03/multifamily-absorption-rate-remains-below-50/,78,DFP-AE0C2C64AA,45,General Project Signal - General Project Signal - Other / Unknown - Multifamily Absorption Rate Remains Below 50%,General Project Signal - Unknown - Other / Unknown,DCL-20260706-062,1
2026-07-06,20260706-000644-f35b7e56,PRJ-20260706-0134,Operational / Property Management Tech - Other / Unknown - Beyond efficiency: How leading multifamily operators are putting AI to work,80,2026-07-06 00:06:44,art_d4039cdfbf50dd7d,valid,Market Intelligence,,repeat_penalized,5,open,Disposition / Exit - Other / Unknown - NAHB HBGI: Micro Markets Lone Bright Spot for Single-Family Building in Fourth Quarter,Disposition / Exit,Multifamily,Multifamily,Other / Unknown,Unknown,Unknown,Unknown,Unknown,Unknown,Unknown,Unknown,Unknown,Unknown,Other / Unknown,,,,,,,,,,,,26,Low Detail Signal,Monitor only,NAHB HBGI: Micro Markets Lone Bright Spot for Single-Family Building in Fourth Quarter,NAHB Eye on Housing - Multifamily,https://eyeonhousing.org/2026/03/nahb-hbgi-micro-markets-lone-bright-spot-for-single-family-building-in-fourth-quarter/,57,DFP-1563B53CA0,45,Disposition / Exit - Disposition / Exit - Other / Unknown - NAHB HBGI: Micro Markets Lone Bright Spot for Single-Family Building in Fourth Quarter,Disposition / Exit - Unknown - Other / Unknown,DCL-20260706-063,1
2026-07-06,20260706-000644-f35b7e56,PRJ-20260706-0134,Operational / Property Management Tech - Other / Unknown - Beyond efficiency: How leading multifamily operators are putting AI to work,80,2026-07-06 00:06:44,art_162dc9bd4d0c6981,valid,Development Activity,GP / Capital Activity; Market Intelligence,repeat_penalized,58,open,Operational / Property Management Tech - Other / Unknown - Beyond efficiency: How leading multifamily operators are putting AI to work,Operational / Property Management Tech,Multifamily,Multifamily,Other / Unknown,Unknown,Unknown,Unknown,Unknown,Unknown,Unknown,Unknown,Unknown,Unknown,Other / Unknown,,,,,,,,,,,,24,Low Detail Signal,Monitor only,Beyond efficiency: How leading multifamily operators are putting AI to work,Multifamily Dive,https://www.multifamilydive.com/spons/beyond-efficiency-how-leading-multifamily-operators-are-putting-ai-to-work/823603/,51,DFP-045C73BFDB,45,Operational / Property Management Tech - Operational / Property Management Tech - Other / Unknown - Beyond efficiency: How leading multifamily operators are putting AI to work,Operational / Property Management Tech - Unknown - Other / Unknown,DCL-20260706-064,1
