run_date,run_id,run_timestamp,duplicate_cluster_id,deal_fingerprint_id,duplicate_count,primary_reference_article,duplicate_articles,deduplicated_opportunity_score,deduplicated_distress_score,opportunities_before_deduplication,distress_before_deduplication,opportunities_removed_via_deduplication,distress_inflation_prevented,multi_source_confirmation,strongest_opportunity_type,strongest_distress_type,market,residential_sector
2026-05-26,20260526-230211-c37354de,2026-05-26 23:02:11,DCL-20260526-002,DFP-B52F91F0C5,2,JLL Lines Up $144M Construction Loan for Santa Ana Multifamily,JLL Lines Up $144M Construction Loan for Santa Ana Multifamily,72,76,1,1,0,0,Yes,,construction loan gap,California,Apartment
2026-05-26,20260526-230211-c37354de,2026-05-26 23:02:11,DCL-20260526-010,DFP-EF7A51548D,2,$46M Bridge Loan Refinances Newly Built Moreno Valley Apartments,$46M Bridge Loan Refinances Newly Built Moreno Valley Apartments,70,76,1,1,0,0,Yes,,bridge loan stress,California,Apartment
2026-05-26,20260526-230211-c37354de,2026-05-26 23:02:11,DCL-20260526-034,DFP-5FF0E680D7,2,Anaheim Industrial Outdoor Storage Site Secures Bridge Loan,Anaheim Industrial Outdoor Storage Site Secures Bridge Loan,65,67,1,1,0,0,Yes,,bridge loan stress,California,General Residential
2026-05-26,20260526-230211-c37354de,2026-05-26 23:02:11,DCL-20260526-017,DFP-3213D240BF,2,Alta Developers Lands $91.8M Construction Loan for Miami Apartments,Alta Developers Lands $91.8M Construction Loan for Miami Apartments,64,60,1,1,0,0,Yes,Construction Financing Gap,,Sun Belt,Apartment
2026-05-26,20260526-230211-c37354de,2026-05-26 23:02:11,DCL-20260526-018,DFP-66DA719F81,2,Hillpointe Secures $67M Construction Loan for Tampa Apartments and Breaks Ground,Hillpointe Secures $67M Construction Loan for Tampa Apartments and Breaks Ground,64,60,1,1,0,0,Yes,Construction Financing Gap,,Sun Belt,Apartment
2026-05-26,20260526-230211-c37354de,2026-05-26 23:02:11,DCL-20260526-022,DFP-732A1631F7,2,S. Florida Ritz-Carlton Developer Inks $401M Bridge Loan,S. Florida Ritz-Carlton Developer Inks $401M Bridge Loan,63,59,1,1,0,0,Yes,Land / Pipeline Opportunity,,Florida,Apartment
2026-05-26,20260526-230211-c37354de,2026-05-26 23:02:11,DCL-20260526-023,DFP-BCEFCB112D,2,Black Bear Capital Arranges $39M Loan for Refinancing of Long Island Apartment Complex,Black Bear Capital Arranges $39M Loan for Refinancing of Long Island Apartment Complex,63,59,1,1,0,0,Yes,Refinancing Gap,,New York,Apartment
2026-05-26,20260526-230211-c37354de,2026-05-26 23:02:11,DCL-20260526-025,DFP-2467FB86C8,2,"L.A.'s poor ParkScore, Oceanwide sale delayed, and more","L.A.'s poor ParkScore, Oceanwide sale delayed, and more",62,67,1,1,0,0,Yes,,stalled project,Los Angeles,General Residential
2026-05-26,20260526-230211-c37354de,2026-05-26 23:02:11,DCL-20260526-056,DFP-8A2A84B303,2,Georgia Tech Student Housing Investors Ink Refi,Georgia Tech Student Housing Investors Ink Refi,58,53,1,1,0,0,Yes,Refinancing Gap,,Sun Belt,Student Housing
2026-05-26,20260526-230211-c37354de,2026-05-26 23:02:11,DCL-20260526-003,DFP-93359E6D9F,1,Charlotte Apartment Project Fetches $107M,Charlotte Apartment Project Fetches $107M,83,0,1,0,0,0,No,GP Capability Partnership Opportunity,,Sun Belt,Apartment
2026-05-26,20260526-230211-c37354de,2026-05-26 23:02:11,DCL-20260526-012,DFP-588F766601,1,Blackstone Announces Joint Venture with Google to Create New TPU Cloud,Blackstone Announces Joint Venture with Google to Create New TPU Cloud,80,0,1,0,0,0,No,JV / Partnership Gap,,New York,General Residential
2026-05-26,20260526-230211-c37354de,2026-05-26 23:02:11,DCL-20260526-020,DFP-3111B08007,1,VoltaGrid Announces $1 Billion Strategic Equity Investment from Blackstone and Halliburton to Fund Growth and Acquisition of Propell,VoltaGrid Announces $1 Billion Strategic Equity Investment from Blackstone and Halliburton to Fund Growth and Acquisition of Propell,79,0,1,0,0,0,No,Acquisition Opportunity,,Sun Belt,General Residential
2026-05-26,20260526-230211-c37354de,2026-05-26 23:02:11,DCL-20260526-024,DFP-DFAF6AAF0C,1,Greysteel Brokers Sale of Two Richmond Virginia Area Multifamily Low-Income Housing Tax Credit Properties,Greysteel Brokers Sale of Two Richmond Virginia Area Multifamily Low-Income Housing Tax Credit Properties,78,0,1,0,0,0,No,Affordable / Workforce Housing Opportunity,,National,Affordable Housing
2026-05-26,20260526-230211-c37354de,2026-05-26 23:02:11,DCL-20260526-026,DFP-A82CF81D10,1,"AvalonBay, Equity Residential Strike Largest REIT Merger In U.S. History","AvalonBay, Equity Residential Strike Largest REIT Merger In U.S. History",76,0,1,0,0,0,No,GP Capability Partnership Opportunity,,National,Apartment
2026-05-26,20260526-230211-c37354de,2026-05-26 23:02:11,DCL-20260526-004,DFP-3CDAAFD980,1,Pacific Urban Investors Secures San Diego Multifamily Asset for $90M,Pacific Urban Investors Secures San Diego Multifamily Asset for $90M,69,0,1,0,0,0,No,Acquisition Opportunity,,California,Apartment
2026-05-26,20260526-230211-c37354de,2026-05-26 23:02:11,DCL-20260526-005,DFP-534C0327BF,1,Northmarq: Multifamily Sale Serves as Benchmark for Fresno Market,Northmarq: Multifamily Sale Serves as Benchmark for Fresno Market,68,0,1,0,0,0,No,LA / California Entitlement Opportunity,,California,Apartment
2026-05-26,20260526-230211-c37354de,2026-05-26 23:02:11,DCL-20260526-001,DFP-1E6DD9B4C9,1,Habitat development opens for residents next to La Cienega/Jefferson Station,Habitat development opens for residents next to La Cienega/Jefferson Station,68,0,1,0,0,0,No,LA / California Entitlement Opportunity,,Los Angeles,Workforce Housing
2026-05-26,20260526-230211-c37354de,2026-05-26 23:02:11,DCL-20260526-007,DFP-F25DBA9925,1,Hudson Valley Property Group Expands California Presence with Elk Grove Acquisition,Hudson Valley Property Group Expands California Presence with Elk Grove Acquisition,67,0,1,0,0,0,No,Acquisition Opportunity,,California,Apartment
2026-05-26,20260526-230211-c37354de,2026-05-26 23:02:11,DCL-20260526-009,DFP-70688DBB3C,1,Affordable housing unwrapped at 611 S. Hobart Blvd. in Koreatown,Affordable housing unwrapped at 611 S. Hobart Blvd. in Koreatown,67,0,1,0,0,0,No,LA / California Entitlement Opportunity,,California,Affordable Housing
2026-05-26,20260526-230211-c37354de,2026-05-26 23:02:11,DCL-20260526-011,DFP-C10C479E42,1,Affordable housing takes shape at 101 Pacific Coast Hwy. in Long Beach,Affordable housing takes shape at 101 Pacific Coast Hwy. in Long Beach,67,0,1,0,0,0,No,LA / California Entitlement Opportunity,,California,Affordable Housing
2026-05-26,20260526-230211-c37354de,2026-05-26 23:02:11,DCL-20260526-008,DFP-11D7250843,1,17 apartments planned at 2217 S. Fox Hills Dr. in Century City,17 apartments planned at 2217 S. Fox Hills Dr. in Century City,66,0,1,0,0,0,No,LA / California Entitlement Opportunity,,Los Angeles,Affordable Housing
2026-05-26,20260526-230211-c37354de,2026-05-26 23:02:11,DCL-20260526-013,DFP-4E45D6C4AD,1,Avison Young Markets Echo Park Multifamily Portfolio,Avison Young Markets Echo Park Multifamily Portfolio,65,0,1,0,0,0,No,LA / California Entitlement Opportunity,,Los Angeles,Apartment
2026-05-26,20260526-230211-c37354de,2026-05-26 23:02:11,DCL-20260526-016,DFP-0B566E6C3C,1,JLL Arranges $252M Financing for Huntington Beach Seniors Project,JLL Arranges $252M Financing for Huntington Beach Seniors Project,64,0,1,0,0,0,No,LA / California Entitlement Opportunity,,California,Senior Housing
2026-05-26,20260526-230211-c37354de,2026-05-26 23:02:11,DCL-20260526-027,DFP-1EA4D4DDB2,1,Developer revives plan for Best Western hotel at 2645 S. Western Ave. in Jefferson Park,Developer revives plan for Best Western hotel at 2645 S. Western Ave. in Jefferson Park,63,0,1,0,0,0,No,LA / California Entitlement Opportunity,,Los Angeles,Multifamily
2026-05-26,20260526-230211-c37354de,2026-05-26 23:02:11,DCL-20260526-006,DFP-30194271EF,1,El-Ad Pays $45.5M for Coconut Grove Property,El-Ad Pays $45.5M for Coconut Grove Property,62,0,1,0,0,0,No,Acquisition Opportunity,,Sun Belt,Apartment
2026-05-26,20260526-230211-c37354de,2026-05-26 23:02:11,DCL-20260526-032,DFP-893B90F6F4,1,Demolition Permits Filed For 1939 Market Street in San Francisco,Demolition Permits Filed For 1939 Market Street in San Francisco,62,0,1,0,0,0,No,LA / California Entitlement Opportunity,,California,Senior Housing
2026-05-26,20260526-230211-c37354de,2026-05-26 23:02:11,DCL-20260526-028,DFP-C282C059CC,1,Adaptive reuse planned for Westwood office tower at 10900 Wilshire Blvd.,Adaptive reuse planned for Westwood office tower at 10900 Wilshire Blvd.,62,0,1,0,0,0,No,LA / California Entitlement Opportunity,,Los Angeles,Office-to-Residential Conversion
2026-05-26,20260526-230211-c37354de,2026-05-26 23:02:11,DCL-20260526-047,DFP-058F8121E4,1,"Affordable Housing Pivot For 11880 Skyline Boulevard, Oakland Hills","Affordable Housing Pivot For 11880 Skyline Boulevard, Oakland Hills",61,0,1,0,0,0,No,LA / California Entitlement Opportunity,,California,Affordable Housing
2026-05-26,20260526-230211-c37354de,2026-05-26 23:02:11,DCL-20260526-019,DFP-6A628BF905,1,Bridge Investment Group Lends $40M on Tampa Apartments Buy,Bridge Investment Group Lends $40M on Tampa Apartments Buy,60,0,1,0,0,0,No,JV / Partnership Gap,,Sun Belt,Apartment
2026-05-26,20260526-230211-c37354de,2026-05-26 23:02:11,DCL-20260526-045,DFP-771DCE4EC1,1,Renderings revealed: Arts District towers at 2143 E. Violet Street,Renderings revealed: Arts District towers at 2143 E. Violet Street,60,0,1,0,0,0,No,LA / California Entitlement Opportunity,,Los Angeles,Affordable Housing
2026-05-26,20260526-230211-c37354de,2026-05-26 23:02:11,DCL-20260526-030,DFP-35E648DA28,1,Dominium Acquires Sunrise Pointe with Plans to Preserve the Affordability of the Property and Complete a $9.5M Renovation,Dominium Acquires Sunrise Pointe with Plans to Preserve the Affordability of the Property and Complete a $9.5M Renovation,58,0,1,0,0,0,No,Acquisition Opportunity,,Florida,Affordable Housing
2026-05-26,20260526-230211-c37354de,2026-05-26 23:02:11,DCL-20260526-031,DFP-454BA7F7FD,1,US Merchants Picks Up Rail-Ready Surprise Warehouse for $63.8M,US Merchants Picks Up Rail-Ready Surprise Warehouse for $63.8M,57,0,1,0,0,0,No,Acquisition Opportunity,,Sun Belt,General Residential
2026-05-26,20260526-230211-c37354de,2026-05-26 23:02:11,DCL-20260526-037,DFP-D6C534F07A,1,Haven Housing Expands Texas Multifamily Platform with Acquisition of 309-Unit Hays Park Apartments in Kyle Texas,Haven Housing Expands Texas Multifamily Platform with Acquisition of 309-Unit Hays Park Apartments in Kyle Texas,57,0,1,0,0,0,No,Acquisition Opportunity,,Sun Belt,Affordable Housing
2026-05-26,20260526-230211-c37354de,2026-05-26 23:02:11,DCL-20260526-040,DFP-C2F4DF8322,1,Miami Apartments Trade for $109.9M,Miami Apartments Trade for $109.9M,57,0,1,0,0,0,No,Acquisition Opportunity,,Sun Belt,Apartment
2026-05-26,20260526-230211-c37354de,2026-05-26 23:02:11,DCL-20260526-036,DFP-B582EFAEF4,1,"Plans Increase For 1223 East 33rd Avenue in Fruitvale, Oakland","Plans Increase For 1223 East 33rd Avenue in Fruitvale, Oakland",57,0,1,0,0,0,No,LA / California Entitlement Opportunity,,Other / Unknown,Affordable Housing
2026-05-26,20260526-230211-c37354de,2026-05-26 23:02:11,DCL-20260526-041,DFP-FB3F20D8F2,1,Insignia Pursuing Embassy Row Redevelopment,Insignia Pursuing Embassy Row Redevelopment,57,0,1,0,0,0,No,Land / Pipeline Opportunity,,Sun Belt,Apartment
2026-05-26,20260526-230211-c37354de,2026-05-26 23:02:11,DCL-20260526-029,DFP-E764F985F9,1,"Trumark Real Estate Management Buys Multi-Tenant Industrial Building in Peoria, Arizona for $20.7M","Trumark Real Estate Management Buys Multi-Tenant Industrial Building in Peoria, Arizona for $20.7M",56,0,1,0,0,0,No,Acquisition Opportunity,,Arizona,General Residential
2026-05-26,20260526-230211-c37354de,2026-05-26 23:02:11,DCL-20260526-039,DFP-0EB7675D92,1,Eastern Union Arranges $125M Acquisition Loan for Chicago MF Complex,Eastern Union Arranges $125M Acquisition Loan for Chicago MF Complex,56,0,1,0,0,0,No,Acquisition Opportunity,,Other / Unknown,Apartment
2026-05-26,20260526-230211-c37354de,2026-05-26 23:02:11,DCL-20260526-043,DFP-0B892EA911,1,"IPA Brokers Sale of 269-Unit Apartment Complex in Newington, Connecticut","IPA Brokers Sale of 269-Unit Apartment Complex in Newington, Connecticut",56,0,1,0,0,0,No,Acquisition Opportunity,,Other / Unknown,Apartment
2026-05-26,20260526-230211-c37354de,2026-05-26 23:02:11,DCL-20260526-044,DFP-8F61AB7E56,1,ICON Real Estate Negotiates $7.9M Sale of Northern New Jersey Apartment Building,ICON Real Estate Negotiates $7.9M Sale of Northern New Jersey Apartment Building,56,0,1,0,0,0,No,Acquisition Opportunity,,Other / Unknown,Apartment
2026-05-26,20260526-230211-c37354de,2026-05-26 23:02:11,DCL-20260526-051,DFP-546EFB363D,1,Work Begins on 94-Unit Scottsdale Luxury BTR Community,Work Begins on 94-Unit Scottsdale Luxury BTR Community,56,0,1,0,0,0,No,BTR / SFR Platform Opportunity,,Sun Belt,BTR / Single-Family Rental
2026-05-26,20260526-230211-c37354de,2026-05-26 23:02:11,DCL-20260526-042,DFP-C0931E80DE,1,Dwight Capital Provides $114M HUD-Insured Loan for Office-to-Apartment Conversion in Milwaukee,Dwight Capital Provides $114M HUD-Insured Loan for Office-to-Apartment Conversion in Milwaukee,56,0,1,0,0,0,No,Office-to-Residential Conversion Opportunity,,National,Affordable Housing
2026-05-26,20260526-230211-c37354de,2026-05-26 23:02:11,DCL-20260526-046,DFP-4289CB0179,1,Sagard Real Estate Expands PNW Footprint with Seattle-Area MF Acquisition,Sagard Real Estate Expands PNW Footprint with Seattle-Area MF Acquisition,55,0,1,0,0,0,No,Acquisition Opportunity,,Seattle,Apartment
2026-05-26,20260526-230211-c37354de,2026-05-26 23:02:11,DCL-20260526-050,DFP-940C516B1B,1,"JLL Negotiates Sale of 357,570 SF Distribution Center in Northwest Houston","JLL Negotiates Sale of 357,570 SF Distribution Center in Northwest Houston",55,0,1,0,0,0,No,Acquisition Opportunity,,Sun Belt,General Residential
2026-05-26,20260526-230211-c37354de,2026-05-26 23:02:11,DCL-20260526-052,DFP-8F6D9A043E,1,NexMetro Debuts 229-Unit San Tan Valley BTR Community,NexMetro Debuts 229-Unit San Tan Valley BTR Community,55,0,1,0,0,0,No,BTR / SFR Platform Opportunity,,Sun Belt,BTR / Single-Family Rental
2026-05-26,20260526-230211-c37354de,2026-05-26 23:02:11,DCL-20260526-048,DFP-588F90FA5C,1,"Ares, Scion Launch JV With $910M Deal For Student Housing Portfolio","Ares, Scion Launch JV With $910M Deal For Student Housing Portfolio",55,0,1,0,0,0,No,JV / Partnership Gap,,National,Student Housing
2026-05-26,20260526-230211-c37354de,2026-05-26 23:02:11,DCL-20260526-049,DFP-8510FE41CD,1,"Scion Group, Ares Management Corp. partner for $910M student housing buy","Scion Group, Ares Management Corp. partner for $910M student housing buy",55,0,1,0,0,0,No,JV / Partnership Gap,,Other / Unknown,Student Housing
2026-05-26,20260526-230211-c37354de,2026-05-26 23:02:11,DCL-20260526-055,DFP-F59A9F56DA,1,Cambridge Properties Bringing New Life to Aging Charlotte Center,Cambridge Properties Bringing New Life to Aging Charlotte Center,55,0,1,0,0,0,No,LA / California Entitlement Opportunity,,Sun Belt,Apartment
2026-05-26,20260526-230211-c37354de,2026-05-26 23:02:11,DCL-20260526-060,DFP-C050CB07F0,1,Multifamily starts rose again in April,Multifamily starts rose again in April,54,0,1,0,0,0,No,Land / Pipeline Opportunity,,National,Apartment
2026-05-26,20260526-230211-c37354de,2026-05-26 23:02:11,DCL-20260526-053,DFP-A526605C91,1,"$28M Housing, Mixed-Use Development in Baltimore Breaks Ground","$28M Housing, Mixed-Use Development in Baltimore Breaks Ground",54,0,1,0,0,0,No,Land / Pipeline Opportunity,,Other / Unknown,Mixed-Use Residential
2026-05-26,20260526-230211-c37354de,2026-05-26 23:02:11,DCL-20260526-059,DFP-2F6D8F65F6,1,Missing Middle Weakness,Missing Middle Weakness,54,0,1,0,0,0,No,Land / Pipeline Opportunity,,Other / Unknown,Apartment
2026-05-26,20260526-230211-c37354de,2026-05-26 23:02:11,DCL-20260526-033,DFP-9599707F8E,1,Related Breaks Ground on $200M Multifamily Project Along St. Johns River in Jacksonville,Related Breaks Ground on $200M Multifamily Project Along St. Johns River in Jacksonville,54,0,1,0,0,0,No,Land / Pipeline Opportunity,,Southeast,Apartment
2026-05-26,20260526-230211-c37354de,2026-05-26 23:02:11,DCL-20260526-062,DFP-DBE4DBFDBE,1,"Missner Group Acquires 843,531 SF Industrial Portfolio in Indiana","Missner Group Acquires 843,531 SF Industrial Portfolio in Indiana",53,0,1,0,0,0,No,Acquisition Opportunity,,National,BTR / Single-Family Rental
2026-05-26,20260526-230211-c37354de,2026-05-26 23:02:11,DCL-20260526-061,DFP-51A9A06C3F,1,Colibri Commons Affordable Housing Opens in East Palo Alto,Colibri Commons Affordable Housing Opens in East Palo Alto,53,0,1,0,0,0,No,Affordable / Workforce Housing Opportunity,,Other / Unknown,Affordable Housing
2026-05-26,20260526-230211-c37354de,2026-05-26 23:02:11,DCL-20260526-063,DFP-57A3A9A4F0,1,Shorter Apartment Construction Time in 2024,Shorter Apartment Construction Time in 2024,53,0,1,0,0,0,No,LA / California Entitlement Opportunity,,Other / Unknown,Apartment
2026-05-26,20260526-230211-c37354de,2026-05-26 23:02:11,DCL-20260526-038,DFP-0A214443A6,1,TSB Realty Arranges Sale of 398-Bed Student Housing Community Near University of Kentucky,TSB Realty Arranges Sale of 398-Bed Student Housing Community Near University of Kentucky,52,0,1,0,0,0,No,Acquisition Opportunity,,Southeast,Student Housing
2026-05-26,20260526-230211-c37354de,2026-05-26 23:02:11,DCL-20260526-065,DFP-C96F67339E,1,Builders Stay Cautious as Single-Family Permits Weaken,Builders Stay Cautious as Single-Family Permits Weaken,52,0,1,0,0,0,No,LA / California Entitlement Opportunity,,Other / Unknown,Multifamily
2026-05-26,20260526-230211-c37354de,2026-05-26 23:02:11,DCL-20260526-066,DFP-53DEBBEA0C,1,First Quarter 2026 Multifamily Construction Data,First Quarter 2026 Multifamily Construction Data,51,0,1,0,0,0,No,Land / Pipeline Opportunity,,Other / Unknown,Multifamily
2026-05-26,20260526-230211-c37354de,2026-05-26 23:02:11,DCL-20260526-067,DFP-B90543DC0D,1,Fourth Quarter 2025 Multifamily Construction Data,Fourth Quarter 2025 Multifamily Construction Data,51,0,1,0,0,0,No,Land / Pipeline Opportunity,,Other / Unknown,Multifamily
2026-05-26,20260526-230211-c37354de,2026-05-26 23:02:11,DCL-20260526-068,DFP-929C698B57,1,Overall Housing Starts Inch Lower in 2025,Overall Housing Starts Inch Lower in 2025,51,0,1,0,0,0,No,Land / Pipeline Opportunity,,Other / Unknown,Multifamily
2026-05-26,20260526-230211-c37354de,2026-05-26 23:02:11,DCL-20260526-069,DFP-9635218EA1,1,Third Quarter 2025 Multifamily Construction Data,Third Quarter 2025 Multifamily Construction Data,51,0,1,0,0,0,No,Land / Pipeline Opportunity,,Other / Unknown,Multifamily
2026-05-26,20260526-230211-c37354de,2026-05-26 23:02:11,DCL-20260526-071,DFP-AC340673FF,1,"House Passes BTR-Friendly Housing Bill, But Senate Fight Looms","House Passes BTR-Friendly Housing Bill, But Senate Fight Looms",50,0,1,0,0,0,No,BTR / SFR Platform Opportunity,,National,BTR / Single-Family Rental
2026-05-26,20260526-230211-c37354de,2026-05-26 23:02:11,DCL-20260526-070,DFP-AE0C2C64AA,1,Multifamily Absorption Rate Remains Below 50%,Multifamily Absorption Rate Remains Below 50%,50,0,1,0,0,0,No,Land / Pipeline Opportunity,,Other / Unknown,Apartment
