run_date,run_id,run_timestamp,regime,raw_score,normalized_score,final_score,strength_label,supporting_signals,interpretation
2026-06-23,20260623-235839-1625a2df,2026-06-23 23:58:39,Selective Capital Re-entry,134,89,89,Very Strong,Institutional Flow articles: 16; Deal Size Signal articles: 9; Institutional player mentions: 10,"Institutional flow, deal-size, or major-player activity suggests capital-market re-engagement."
2026-06-23,20260623-235839-1625a2df,2026-06-23 23:58:39,Financing Stress,130,87,87,Very Strong,Financing Risk articles: 16; Financing/cap-rate market signals: 5; Financing matched-keyword articles: 13,"Debt, rates, refinancing, or cap-rate pressure is visible enough to affect underwriting attention."
2026-06-23,20260623-235839-1625a2df,2026-06-23 23:58:39,Supply Pressure,106,71,71,Strong,Supply Pressure articles: 4; Supply/vacancy/concession signals: 3; Supply matched-keyword articles: 5,"Supply, starts, deliveries, lease-up, vacancy, or concession signals are visible."
2026-06-23,20260623-235839-1625a2df,2026-06-23 23:58:39,Policy / Entitlement Watch,100,67,67,Strong,Regulation Risk articles: 5; Policy matched-keyword articles: 6; California / Los Angeles focus count: 9,"Policy, zoning, permitting, entitlement, rent-control, or housing-production signals require monitoring."
2026-06-23,20260623-235839-1625a2df,2026-06-23 23:58:39,Developer Strategy Shift,88,59,59,Moderate,Developer Strategy articles: 29; Developer matched-keyword articles: 12; Must Read articles: 34,"Developer behavior, product strategy, adaptive reuse, BTR, modular, or operating-model signals are visible."
2026-06-23,20260623-235839-1625a2df,2026-06-23 23:58:39,Construction Cost Pressure,0,0,0,Not Detected,Cost Control articles: 0; Construction Cost Signal articles: 0; Cost matched-keyword articles: 0,Construction Cost Pressure is not a meaningful signal in this run.
2026-06-23,20260623-235839-1625a2df,2026-06-23 23:58:39,Stable Monitoring Environment,0,0,0,Not Detected,Highest active regime score before stable adjustment: 134; Monitor articles: 2,Stable Monitoring Environment is not a meaningful signal in this run.
