run_date,run_id,run_timestamp,regime,raw_score,normalized_score,final_score,strength_label,supporting_signals,interpretation
2026-05-30,20260530-230208-ccf8785d,2026-05-30 23:02:08,Selective Capital Re-entry,134,89,89,Very Strong,Institutional Flow articles: 16; Deal Size Signal articles: 8; Institutional player mentions: 11,"Institutional flow, deal-size, or major-player activity suggests capital-market re-engagement."
2026-05-30,20260530-230208-ccf8785d,2026-05-30 23:02:08,Financing Stress,121,81,81,Very Strong,Financing Risk articles: 19; Financing/cap-rate market signals: 6; Financing matched-keyword articles: 18,"Debt, rates, refinancing, or cap-rate pressure is visible enough to affect underwriting attention."
2026-05-30,20260530-230208-ccf8785d,2026-05-30 23:02:08,Supply Pressure,121,81,81,Very Strong,Supply Pressure articles: 6; Supply/vacancy/concession signals: 4; Supply matched-keyword articles: 6,"Supply, starts, deliveries, lease-up, vacancy, or concession signals are visible."
2026-05-30,20260530-230208-ccf8785d,2026-05-30 23:02:08,Policy / Entitlement Watch,100,67,67,Strong,Regulation Risk articles: 7; Policy matched-keyword articles: 9; California / Los Angeles focus count: 17,"Policy, zoning, permitting, entitlement, rent-control, or housing-production signals require monitoring."
2026-05-30,20260530-230208-ccf8785d,2026-05-30 23:02:08,Developer Strategy Shift,88,59,59,Moderate,Developer Strategy articles: 35; Developer matched-keyword articles: 10; Must Read articles: 39,"Developer behavior, product strategy, adaptive reuse, BTR, modular, or operating-model signals are visible."
2026-05-30,20260530-230208-ccf8785d,2026-05-30 23:02:08,Construction Cost Pressure,8,5,5,Not Detected,Cost Control articles: 0; Construction Cost Signal articles: 0; Cost matched-keyword articles: 2,Construction Cost Pressure is not a meaningful signal in this run.
2026-05-30,20260530-230208-ccf8785d,2026-05-30 23:02:08,Stable Monitoring Environment,0,0,0,Not Detected,Highest active regime score before stable adjustment: 134; Monitor articles: 4,Stable Monitoring Environment is not a meaningful signal in this run.
