run_date,run_id,run_timestamp,deal_fingerprint_id,duplicate_cluster_id,fingerprint_confidence,canonical_project_name,canonical_deal_name,canonical_event_name,deal_type,market,residential_sector,canonical_gp_or_developer,canonical_lender_or_debt_provider,unit_count,dollar_amount,loan_amount,source_count,article_count,duplicate_count,sources,article_titles,markets_detected,highest_deal_signal_score
2026-07-13,20260713-235520-9dd8478a,2026-07-13 23:55:20,DFP-6AEEE5186D,DCL-20260713-007,100,Office-to-Residential Conversion - New York City / New York - Apollo Provides $71M Loan for Tribeca Luxury Condo Conversion,Office-to-Residential Conversion - Office-to-Residential Conversion - New York City / New York - Apollo Provides $71M Loan for Tribeca Luxury Condo Conversion,Office-to-Residential Conversion - JLL - New York,Office-to-Residential Conversion,New York City / New York,General Residential,JLL,JLL,18 units,$71M; $71M; $71m,$71M,1,1,1,Commercial Observer,Apollo Provides $71M Loan for Tribeca Luxury Condo Conversion,New York City / New York,85
2026-07-13,20260713-235520-9dd8478a,2026-07-13 23:55:20,DFP-DB5E52C77E,DCL-20260713-002,90,"Acquisition - Miami / Florida - Avalon Bay Planning Apartments, Retail in South Miami","Acquisition - Acquisition - Miami / Florida - Avalon Bay Planning Apartments, Retail in South Miami",Acquisition - AvalonBay - Sun Belt,Acquisition,Miami / Florida,Mixed-Use Residential,AvalonBay,cushman,,$22 m; $22 million; $22,,1,1,1,Connect CRE South Florida,"Avalon Bay Planning Apartments, Retail in South Miami",Miami / Florida,85
2026-07-13,20260713-235520-9dd8478a,2026-07-13 23:55:20,DFP-5AEA42B431,DCL-20260713-020,90,"Acquisition - San Francisco / California - Spear Street Capital Buys Lower Manhattan Office, Retail Building for $50.5M","Acquisition - Acquisition - San Francisco / California - Spear Street Capital Buys Lower Manhattan Office, Retail Building for $50.5M",Acquisition - JLL - California,Acquisition,San Francisco / California,General Residential,JLL,JLL,,$50.5M; $50.5M; $50.5 million,$50.5m,1,1,1,REBusiness Online,"Spear Street Capital Buys Lower Manhattan Office, Retail Building for $50.5M",San Francisco / California,69
2026-07-13,20260713-235520-9dd8478a,2026-07-13 23:55:20,DFP-634169449E,DCL-20260713-003,90,Acquisition - New York City / New York - JLL Negotiates $25.1M Sale of Two Multifamily Development Sites in Brooklyn,Acquisition - Acquisition - New York City / New York - JLL Negotiates $25.1M Sale of Two Multifamily Development Sites in Brooklyn,Acquisition - JLL - New York,Acquisition,New York City / New York,Multifamily,JLL,JLL,,$25.1M; $25.1M; $25.1 million,,1,1,1,REBusiness Online,JLL Negotiates $25.1M Sale of Two Multifamily Development Sites in Brooklyn,New York City / New York,85
2026-07-13,20260713-235520-9dd8478a,2026-07-13 23:55:20,DFP-0429255F69,DCL-20260713-005,90,Construction Financing - Miami / Florida - S3 Originates $111M Construction Loan for Edgewater Rental Community,Construction Financing - Construction Financing - Miami / Florida - S3 Originates $111M Construction Loan for Edgewater Rental Community,Construction Financing - JLL - JLL - Sun Belt,Construction Financing,Miami / Florida,Mixed-Use Residential,JLL,JLL,,$111M; $111M; $111 million,$111M,1,1,1,Connect CRE South Florida,S3 Originates $111M Construction Loan for Edgewater Rental Community,Miami / Florida,85
2026-07-13,20260713-235520-9dd8478a,2026-07-13 23:55:20,DFP-BB7B16FB5F,DCL-20260713-001,90,Development Start - Atlanta / Georgia - Financing Secured for Centennial Yards Mixed-Use Project,Development Start - Development Start - Atlanta / Georgia - Financing Secured for Centennial Yards Mixed-Use Project,Development Start - CIM Group - Los Angeles,Development Start,Atlanta / Georgia,Mixed-Use Residential,CIM Group,Unknown,280 apartments,$5 billion,$5 billion,1,1,1,Connect CRE Apartments,Financing Secured for Centennial Yards Mixed-Use Project,Atlanta / Georgia,87
2026-07-13,20260713-235520-9dd8478a,2026-07-13 23:55:20,DFP-F23D3A3F9C,DCL-20260713-010,90,Disposition / Exit - Atlanta / Georgia - UDR Offloads Nashville Apartments After 31-Year Hold,Disposition / Exit - Disposition / Exit - Atlanta / Georgia - UDR Offloads Nashville Apartments After 31-Year Hold,Disposition / Exit - UDR - Los Angeles,Disposition / Exit,Atlanta / Georgia,Apartment,UDR,Freddie Mac,,$41.5 million; $41.5 million; $29.4 million,$41.5 million,1,1,1,Connect CRE Apartments,UDR Offloads Nashville Apartments After 31-Year Hold,Atlanta / Georgia,81
2026-07-13,20260713-235520-9dd8478a,2026-07-13 23:55:20,DFP-BC1CD95725,DCL-20260713-034,90,General Project Signal - Miami / Florida - AvalonBay pays $22M for full-block development site in Miami,General Project Signal - General Project Signal - Miami / Florida - AvalonBay pays $22M for full-block development site in Miami,General Project Signal - AvalonBay - Sun Belt,General Project Signal,Miami / Florida,General Residential,AvalonBay,cushman,,$22M; $22M; $90,,1,1,1,Multifamily Dive,AvalonBay pays $22M for full-block development site in Miami,Miami / Florida,60
2026-07-13,20260713-235520-9dd8478a,2026-07-13 23:55:20,DFP-1E749BA1F2,DCL-20260713-014,90,General Project Signal - Texas - Cushman & Wakefield Arranges $95.74M in Financing for 626-Unit Texas Multifamily Portfolio,General Project Signal - General Project Signal - Texas - Cushman & Wakefield Arranges $95.74M in Financing for 626-Unit Texas Multifamily Portfolio,General Project Signal - Benefit Street Partners - Texas,General Project Signal,Texas,Multifamily,Benefit Street Partners,cushman,,$95.74M; $95.74 million; $76.24 million,$95.74M,1,1,1,Yield PRO,Cushman & Wakefield Arranges $95.74M in Financing for 626-Unit Texas Multifamily Portfolio,Texas,75
2026-07-13,20260713-235520-9dd8478a,2026-07-13 23:55:20,DFP-16B5656F42,DCL-20260713-016,90,General Project Signal - Other / Unknown - Merchants Capital Arranges $10.8M in Financing for Affordable Housing Development in Kansa...,General Project Signal - General Project Signal - Other / Unknown - Merchants Capital Arranges $10.8M in Financing for Affordable Housing Development in Kansa...,General Project Signal - Merchants Capital - Other / Unknown,General Project Signal,Other / Unknown,Affordable Housing,Merchants Capital,Freddie Mac,121 units,$10.8M; $10.8M; $10.8 million,$10.8M,1,1,1,REBusiness Online,Merchants Capital Arranges $10.8M in Financing for Affordable Housing Development in Kansas,Other / Unknown,75
2026-07-13,20260713-235520-9dd8478a,2026-07-13 23:55:20,DFP-CDA5823553,DCL-20260713-006,90,JV / Partnership - Other / Unknown - CBRE Brokers $6.3M Sale of Multifamily Redevelopment Site in Chicago’s Wrigleyville,JV / Partnership - JV / Partnership - Other / Unknown - CBRE Brokers $6.3M Sale of Multifamily Redevelopment Site in Chicago’s Wrigleyville,JV / Partnership - CBRE - Other / Unknown,JV / Partnership,Other / Unknown,Apartment,CBRE,CBRE,99 units,$6.3M; $6.3M; $6.3 million,,1,1,1,REBusiness Online,CBRE Brokers $6.3M Sale of Multifamily Redevelopment Site in Chicago’s Wrigleyville,Other / Unknown,85
2026-07-13,20260713-235520-9dd8478a,2026-07-13 23:55:20,DFP-A3E88CB2AD,DCL-20260713-009,90,Refinancing - Miami / Florida - JPMorgan Funnels $205M to Refi Blackstone’s East Hotel in Miami,Refinancing - Refinancing - Miami / Florida - JPMorgan Funnels $205M to Refi Blackstone’s East Hotel in Miami,Refinancing - Blackstone - jpmorgan - Sun Belt,Refinancing,Miami / Florida,Apartment,Blackstone,jpmorgan,,$205M; $205M; $300 million,$205 m,1,1,1,Commercial Observer,JPMorgan Funnels $205M to Refi Blackstone’s East Hotel in Miami,Miami / Florida,85
2026-07-13,20260713-235520-9dd8478a,2026-07-13 23:55:20,DFP-FF7F3C408D,DCL-20260713-011,90,Refinancing - Northern Virginia / Virginia - Newmark Refis Multifamily Portfolio With $163M Fannie Mae Loan,Refinancing - Refinancing - Northern Virginia / Virginia - Newmark Refis Multifamily Portfolio With $163M Fannie Mae Loan,Refinancing - Fannie Mae - Fannie Mae - Northern Virginia / Virginia,Refinancing,Northern Virginia / Virginia,Multifamily,Fannie Mae,Fannie Mae,,$163M; $163M; $163 million,$163M,1,1,1,Commercial Observer,Newmark Refis Multifamily Portfolio With $163M Fannie Mae Loan,Northern Virginia / Virginia,79
2026-07-13,20260713-235520-9dd8478a,2026-07-13 23:55:20,DFP-EE104E4630,DCL-20260713-008,90,Refinancing - New York - JLL Secures $332M Refinancing for Chicago’s Tallest All-Rental Multifamily Tower,Refinancing - Refinancing - New York - JLL Secures $332M Refinancing for Chicago’s Tallest All-Rental Multifamily Tower,Refinancing - JLL - JLL - New York,Refinancing,New York,Multifamily,JLL,JLL,,$332M; $275 million; $57 million,$332M,1,1,1,Yield PRO,JLL Secures $332M Refinancing for Chicago’s Tallest All-Rental Multifamily Tower,New York,85
2026-07-13,20260713-235520-9dd8478a,2026-07-13 23:55:20,DFP-57DB0FC8DC,DCL-20260713-025,80,Acquisition - Phoenix / Arizona - Alliance Sells Phoenix Apartments for $81.4M,Acquisition - Acquisition - Phoenix / Arizona - Alliance Sells Phoenix Apartments for $81.4M,Acquisition - Alliance Residential - Sun Belt,Acquisition,Phoenix / Arizona,Apartment,Alliance Residential,Unknown,,$81.4M; $81.4M; $81.4 million,,1,1,1,Connect CRE Phoenix,Alliance Sells Phoenix Apartments for $81.4M,Phoenix / Arizona,64
2026-07-13,20260713-235520-9dd8478a,2026-07-13 23:55:20,DFP-4D0058AABC,DCL-20260713-029,80,Acquisition - Miami / Florida - Pembroke Pines Rental Asset Trades for $80.5M,Acquisition - Acquisition - Miami / Florida - Pembroke Pines Rental Asset Trades for $80.5M,Acquisition - Waterton - Sun Belt,Acquisition,Miami / Florida,Apartment,Waterton,Unknown,,$80.5M; $80.5M; $80.5 million,,1,1,1,Connect CRE South Florida,Pembroke Pines Rental Asset Trades for $80.5M,Miami / Florida,62
2026-07-13,20260713-235520-9dd8478a,2026-07-13 23:55:20,DFP-0162579E7E,DCL-20260713-004,80,Construction Financing - California - Dwight Provides Largest Construction Loan in Company History for Gilroy Multifamily,Construction Financing - Construction Financing - California - Dwight Provides Largest Construction Loan in Company History for Gilroy Multifamily,Construction Financing - Dwight Mortgage Trust - California,Construction Financing,California,Apartment,Dwight Mortgage Trust,Unknown,,$183; $183,$183,1,1,1,Connect CRE California,Dwight Provides Largest Construction Loan in Company History for Gilroy Multifamily,California,85
2026-07-13,20260713-235520-9dd8478a,2026-07-13 23:55:20,DFP-45A3CEBEB4,DCL-20260713-013,80,Construction Financing - Other / Unknown - Boyd Wilson expands Lehigh Valley Multifamily Portfolio with $97M Acquisition of The Landi...,Construction Financing - Construction Financing - Other / Unknown - Boyd Wilson expands Lehigh Valley Multifamily Portfolio with $97M Acquisition of The Landi...,Construction Financing - Freddie Mac - Freddie Mac - Other / Unknown,Construction Financing,Other / Unknown,Apartment,Freddie Mac,Freddie Mac,,$97M; $97 million; $67.9 million,$67.9 million,1,1,1,Yield PRO,Boyd Wilson expands Lehigh Valley Multifamily Portfolio with $97M Acquisition of The Landings,Other / Unknown,75
2026-07-13,20260713-235520-9dd8478a,2026-07-13 23:55:20,DFP-02BAF3D804,DCL-20260713-012,80,"Construction Financing - Miami / Florida - Fort Lauderdale Developer Inks Financing for Condos, Apartments, Retail","Construction Financing - Construction Financing - Miami / Florida - Fort Lauderdale Developer Inks Financing for Condos, Apartments, Retail",Construction Financing - IPA - Sun Belt,Construction Financing,Miami / Florida,Apartment,IPA,Unknown,,$54 million; $54 million,$54 million,1,1,1,Connect CRE Apartments,"Fort Lauderdale Developer Inks Financing for Condos, Apartments, Retail",Miami / Florida,76
2026-07-13,20260713-235520-9dd8478a,2026-07-13 23:55:20,DFP-32D0878435,DCL-20260713-018,80,Disposition / Exit - Atlanta / Georgia - Berkadia Arranges Sale and Financing of Two Multifamily Properties in Augusta,Disposition / Exit - Disposition / Exit - Atlanta / Georgia - Berkadia Arranges Sale and Financing of Two Multifamily Properties in Augusta,Disposition / Exit - Berkadia - Los Angeles,Disposition / Exit,Atlanta / Georgia,Multifamily,Berkadia,Berkadia,,,,1,1,1,Yield PRO,Berkadia Arranges Sale and Financing of Two Multifamily Properties in Augusta,Atlanta / Georgia,71
2026-07-13,20260713-235520-9dd8478a,2026-07-13 23:55:20,DFP-8E01CE09E1,DCL-20260713-019,80,Disposition / Exit - Washington DC - Berkadia Arranges Sale of 423-Unit MXU Trophy Property in Arlington,Disposition / Exit - Disposition / Exit - Washington DC - Berkadia Arranges Sale of 423-Unit MXU Trophy Property in Arlington,Disposition / Exit - Berkadia - Washington DC,Disposition / Exit,Washington DC,Apartment,Berkadia,Berkadia,,,,1,1,1,Connect CRE,Berkadia Arranges Sale of 423-Unit MXU Trophy Property in Arlington,Washington DC,71
2026-07-13,20260713-235520-9dd8478a,2026-07-13 23:55:20,DFP-9F74F1826A,DCL-20260713-026,80,Disposition / Exit - Sun Belt - Institutional Property Advisors Brokers Sale and Arranges Financing for Apartment Property...,Disposition / Exit - Disposition / Exit - Sun Belt - Institutional Property Advisors Brokers Sale and Arranges Financing for Apartment Property...,Disposition / Exit - IPA - Sun Belt,Disposition / Exit,Sun Belt,Apartment,IPA,Unknown,,$18.85 million; $221; $280 ,$18.85 million,1,1,1,Yield PRO,Institutional Property Advisors Brokers Sale and Arranges Financing for Apartment Property in Portland Oregon,Sun Belt,64
2026-07-13,20260713-235520-9dd8478a,2026-07-13 23:55:20,DFP-D95150D505,DCL-20260713-015,80,"General Project Signal - California - Final Approval For 3896 Stevens Creek Boulevard, San Jose","General Project Signal - General Project Signal - California - Final Approval For 3896 Stevens Creek Boulevard, San Jose",General Project Signal - Holland Partner Group - California,General Project Signal,California,Apartment,Holland Partner Group,Unknown,575 apartments,,,1,1,1,SF YIMBY,"Final Approval For 3896 Stevens Creek Boulevard, San Jose",California,75
2026-07-13,20260713-235520-9dd8478a,2026-07-13 23:55:20,DFP-357364228B,DCL-20260713-047,80,General Project Signal - Los Angeles / California - MMCC Arranges Financing for Northridge Offices,General Project Signal - General Project Signal - Los Angeles / California - MMCC Arranges Financing for Northridge Offices,General Project Signal - Marcus & Millichap - Los Angeles,General Project Signal,Los Angeles / California,General Residential,Marcus & Millichap,Unknown,,$5.7 million; $5.7 million,$5.7 million,1,1,1,Connect CRE California,MMCC Arranges Financing for Northridge Offices,Los Angeles / California,50
2026-07-13,20260713-235520-9dd8478a,2026-07-13 23:55:20,DFP-50369B36E7,DCL-20260713-017,75,Construction Financing - Colorado - Concord Summit Capital Arranges $115.5M Construction Loan for Multifamily Development in F...,Construction Financing - Construction Financing - Colorado - Concord Summit Capital Arranges $115.5M Construction Loan for Multifamily Development in F...,Construction Financing - Unknown - Colorado,Construction Financing,Colorado,Apartment,Unknown,Unknown,457 apartments,$115.5M; $115.5M; $115.5 million,$115.5M,1,1,1,REBusiness Online,"Concord Summit Capital Arranges $115.5M Construction Loan for Multifamily Development in Fort Collins, Colorado",Colorado,72
2026-07-13,20260713-235520-9dd8478a,2026-07-13 23:55:20,DFP-249A0D807D,DCL-20260713-022,75,Disposition / Exit - Los Angeles / California - Silver Lake Development Parcel Increases Density Through Re-Entitlement,Disposition / Exit - Disposition / Exit - Los Angeles / California - Silver Lake Development Parcel Increases Density Through Re-Entitlement,Disposition / Exit - Unknown - Los Angeles,Disposition / Exit,Los Angeles / California,Affordable Housing,Unknown,northmarq,,$5.25; $5.25,,1,1,1,Connect CRE,Silver Lake Development Parcel Increases Density Through Re-Entitlement,Los Angeles / California,69
2026-07-13,20260713-235520-9dd8478a,2026-07-13 23:55:20,DFP-8275D72BB5,DCL-20260713-021,75,Disposition / Exit - Phoenix / Arizona - Rise48 Equity Acquires N. Phoenix Rental Community,Disposition / Exit - Disposition / Exit - Phoenix / Arizona - Rise48 Equity Acquires N. Phoenix Rental Community,Disposition / Exit - Unknown - Sun Belt,Disposition / Exit,Phoenix / Arizona,Apartment,Unknown,northmarq,,$21.7 million; $21.7 million,,1,1,1,Connect CRE Phoenix,Rise48 Equity Acquires N. Phoenix Rental Community,Phoenix / Arizona,69
2026-07-13,20260713-235520-9dd8478a,2026-07-13 23:55:20,DFP-EC10682DE2,DCL-20260713-028,75,General Project Signal - Dallas / Texas - Sundance Bay Snags $95.7M Financing on Two Texas Rental Communities,General Project Signal - General Project Signal - Dallas / Texas - Sundance Bay Snags $95.7M Financing on Two Texas Rental Communities,General Project Signal - Unknown - Los Angeles,General Project Signal,Dallas / Texas,Apartment,Unknown,cushman,,$95.7M; $95.7M; $95.7 million,$95.7M,1,1,1,Connect CRE Apartments,Sundance Bay Snags $95.7M Financing on Two Texas Rental Communities,Dallas / Texas,63
2026-07-13,20260713-235520-9dd8478a,2026-07-13 23:55:20,DFP-E9DBCBB1A5,DCL-20260713-033,70,Disposition / Exit - San Francisco / California - Marcus & Millichap Arranges Sale of 18-Unit Multifamily Property in San Francisco,Disposition / Exit - Disposition / Exit - San Francisco / California - Marcus & Millichap Arranges Sale of 18-Unit Multifamily Property in San Francisco,Disposition / Exit - Marcus & Millichap - California,Disposition / Exit,San Francisco / California,Apartment,Marcus & Millichap,Unknown,,,,1,1,1,Yield PRO,Marcus & Millichap Arranges Sale of 18-Unit Multifamily Property in San Francisco,San Francisco / California,60
2026-07-13,20260713-235520-9dd8478a,2026-07-13 23:55:20,DFP-00EF2B59C3,DCL-20260713-032,65,"Acquisition - Atlanta / Georgia - Hanover Acquires Land Near Gas South Arena in Metro Atlanta, Plans 305-Unit Apartment Deve...","Acquisition - Acquisition - Atlanta / Georgia - Hanover Acquires Land Near Gas South Arena in Metro Atlanta, Plans 305-Unit Apartment Deve...",Acquisition - Unknown - Los Angeles,Acquisition,Atlanta / Georgia,Apartment,Unknown,Unknown,,$12.4 million; $12.4 million,,1,1,1,REBusiness Online,"Hanover Acquires Land Near Gas South Arena in Metro Atlanta, Plans 305-Unit Apartment Development",Atlanta / Georgia,60
2026-07-13,20260713-235520-9dd8478a,2026-07-13 23:55:20,DFP-C2B2A108EA,DCL-20260713-043,65,Acquisition - Atlanta / Georgia - Lion Real Estate Picks Up Atlanta Apartments for $51M,Acquisition - Acquisition - Atlanta / Georgia - Lion Real Estate Picks Up Atlanta Apartments for $51M,Acquisition - Unknown - Los Angeles,Acquisition,Atlanta / Georgia,Apartment,Unknown,Unknown,,$51M; $51M; $51m,,1,1,1,Connect CRE Atlanta,Lion Real Estate Picks Up Atlanta Apartments for $51M,Atlanta / Georgia,52
2026-07-13,20260713-235520-9dd8478a,2026-07-13 23:55:20,DFP-1B8EDA4290,DCL-20260713-039,65,BTR / Build-to-Rent - Phoenix / Arizona - Cavan Spins Off Phoenix BTR Community for $112.5M,BTR / Build-to-Rent - BTR / Build-to-Rent - Phoenix / Arizona - Cavan Spins Off Phoenix BTR Community for $112.5M,BTR / Build-to-Rent - Unknown - Sun Belt,BTR / Build-to-Rent,Phoenix / Arizona,BTR / Single-Family Rental,Unknown,Unknown,,$112.5M; $112.5M; $112.5 million,,1,1,1,Connect CRE Apartments,Cavan Spins Off Phoenix BTR Community for $112.5M,Phoenix / Arizona,54
2026-07-13,20260713-235520-9dd8478a,2026-07-13 23:55:20,DFP-22EE1ED222,DCL-20260713-030,65,Construction Financing - Miami / Florida - LCOR Inks $192.5M Construction Loan for Biscayne Bay Apartments,Construction Financing - Construction Financing - Miami / Florida - LCOR Inks $192.5M Construction Loan for Biscayne Bay Apartments,Construction Financing - Unknown - Sun Belt,Construction Financing,Miami / Florida,Apartment,Unknown,Unknown,,$192.5M; $192.5M; $192.5 million,$192.5M,1,1,1,Connect CRE South Florida,LCOR Inks $192.5M Construction Loan for Biscayne Bay Apartments,Miami / Florida,61
2026-07-13,20260713-235520-9dd8478a,2026-07-13 23:55:20,DFP-18C913D7CF,DCL-20260713-042,65,Development Start - Virginia - Bonaventure Breaks Ground on Attain at Newtown a 320-Unit Class A Opportunity Zone Multifa...,Development Start - Development Start - Virginia - Bonaventure Breaks Ground on Attain at Newtown a 320-Unit Class A Opportunity Zone Multifa...,Development Start - Unknown - Virginia,Development Start,Virginia,Multifamily,Unknown,Unknown,,$85.3 million; $85.3 million,,1,1,1,Yield PRO,Bonaventure Breaks Ground on Attain at Newtown a 320-Unit Class A Opportunity Zone Multifamily Development in Norfolk,Virginia,53
2026-07-13,20260713-235520-9dd8478a,2026-07-13 23:55:20,DFP-D9CF55E2C4,DCL-20260713-031,65,"Disposition / Exit - Los Angeles / California - Behind the LAX people mover fiasco, CicLAvia returns on July 19, and more","Disposition / Exit - Disposition / Exit - Los Angeles / California - Behind the LAX people mover fiasco, CicLAvia returns on July 19, and more",Disposition / Exit - Unknown - Los Angeles,Disposition / Exit,Los Angeles / California,Affordable Housing,Unknown,Unknown,,$250; $357 million; $10.1 million,$250,1,1,1,Urbanize LA,"Behind the LAX people mover fiasco, CicLAvia returns on July 19, and more",Los Angeles / California,61
2026-07-13,20260713-235520-9dd8478a,2026-07-13 23:55:20,DFP-ABEBB1FBFF,DCL-20260713-040,65,"Disposition / Exit - Seattle - Kidder Mathews Arranges Sale of Capitol Hill Mixed-Use Apartment Building for $4,575,000","Disposition / Exit - Disposition / Exit - Seattle - Kidder Mathews Arranges Sale of Capitol Hill Mixed-Use Apartment Building for $4,575,000",Disposition / Exit - Unknown - Seattle,Disposition / Exit,Seattle,Mixed-Use Residential,Unknown,Unknown,,$4; $4; $4,,1,1,1,Yield PRO,"Kidder Mathews Arranges Sale of Capitol Hill Mixed-Use Apartment Building for $4,575,000",Seattle,54
2026-07-13,20260713-235520-9dd8478a,2026-07-13 23:55:20,DFP-048D17D475,DCL-20260713-023,65,Entitlement / Permitting - Los Angeles / California - 78-unit affordable housing complex to rise at 12025 Hoffman St. in Studio City,Entitlement / Permitting - Entitlement / Permitting - Los Angeles / California - 78-unit affordable housing complex to rise at 12025 Hoffman St. in Studio City,Entitlement / Permitting - Unknown - Los Angeles,Entitlement / Permitting,Los Angeles / California,Affordable Housing,Unknown,Unknown,78 apartments,,,1,1,1,Urbanize LA,78-unit affordable housing complex to rise at 12025 Hoffman St. in Studio City,Los Angeles / California,65
2026-07-13,20260713-235520-9dd8478a,2026-07-13 23:55:20,DFP-20712C59A0,DCL-20260713-024,65,Entitlement / Permitting - Los Angeles / California - Affordable housing starts work at 11031 Aqua Vista Street in Studio City,Entitlement / Permitting - Entitlement / Permitting - Los Angeles / California - Affordable housing starts work at 11031 Aqua Vista Street in Studio City,Entitlement / Permitting - Unknown - Los Angeles,Entitlement / Permitting,Los Angeles / California,Affordable Housing,Unknown,Unknown,800 homes,,,1,1,1,Urbanize LA,Affordable housing starts work at 11031 Aqua Vista Street in Studio City,Los Angeles / California,65
2026-07-13,20260713-235520-9dd8478a,2026-07-13 23:55:20,DFP-5F98FB3565,DCL-20260713-045,65,General Project Signal - Atlanta / Georgia - Developer Duo Adding 350 Apartments to Dunwoody Mixed-Use Project,General Project Signal - General Project Signal - Atlanta / Georgia - Developer Duo Adding 350 Apartments to Dunwoody Mixed-Use Project,General Project Signal - Unknown - Los Angeles,General Project Signal,Atlanta / Georgia,Mixed-Use Residential,Unknown,Unknown,350 Apartments,,,1,1,1,Connect CRE Atlanta,Developer Duo Adding 350 Apartments to Dunwoody Mixed-Use Project,Atlanta / Georgia,51
2026-07-13,20260713-235520-9dd8478a,2026-07-13 23:55:20,DFP-FC92997104,DCL-20260713-046,65,General Project Signal - Dallas / Texas - StreetLights Residential Completes 134-Unit Apartment Building in Houston,General Project Signal - General Project Signal - Dallas / Texas - StreetLights Residential Completes 134-Unit Apartment Building in Houston,General Project Signal - Unknown - Los Angeles,General Project Signal,Dallas / Texas,Apartment,Unknown,Unknown,,$9,,1,1,1,REBusiness Online,StreetLights Residential Completes 134-Unit Apartment Building in Houston,Dallas / Texas,51
2026-07-13,20260713-235520-9dd8478a,2026-07-13 23:55:20,DFP-1CC92B04D8,DCL-20260713-052,65,General Project Signal - Other / Unknown - 2026 Resident Experience Management Report,General Project Signal - General Project Signal - Other / Unknown - 2026 Resident Experience Management Report,General Project Signal - Unknown - Other / Unknown,General Project Signal,Other / Unknown,Multifamily,Unknown,Unknown,250 units,$4; $4; $90,,1,1,1,Multifamily Executive,2026 Resident Experience Management Report,Other / Unknown,40
2026-07-13,20260713-235520-9dd8478a,2026-07-13 23:55:20,DFP-C771F888AB,DCL-20260713-048,65,General Project Signal - Miami / Florida - Dezer Advancing Plan for 600 N. Miami Apartment Units,General Project Signal - General Project Signal - Miami / Florida - Dezer Advancing Plan for 600 N. Miami Apartment Units,General Project Signal - Unknown - Sun Belt,General Project Signal,Miami / Florida,Apartment,Unknown,Unknown,269 apartments,,,1,1,1,Connect CRE South Florida,Dezer Advancing Plan for 600 N. Miami Apartment Units,Miami / Florida,49
