run_date,run_id,firm_name,strategic_tier,strategic_weight,residential_sector,detected_markets,detected_source_categories,detected_platform_types,detected_activity_types,article_count,highest_relevance_score,average_relevance_score,capital_flow_signal,relationship_signal,partnership_relevance_to_woomi,california_la_relevance,institutional_relationship_score,recommended_follow_up
2026-05-22,20260522-230155-fb3b56b2,Brookfield,Tier 1 / Immediate Strategic Importance,100,Apartment,National,Core Multifamily News,Other,acquisition; refinancing; operational technology / AI adoption,1,100,100.0,Capital Inflow,GP Capability Benchmark Signal,competitive pressure indicator,Low,100,Track capital deployment and pricing signals
2026-05-22,20260522-230155-fb3b56b2,Wood Partners,Tier 3 / Growth and Market Signal Watch,50,Apartment,Other / Unknown; Sun Belt,Core Multifamily News; Site / Parcel Source Expansion,Other,disposition / exit; refinancing; JV / partnership; operational technology / AI adoption,2,100,100.0,Capital Outflow / Exit,Potential JV / Partnership Signal,potential JV partnership signal,Low,98,Map potential GP / JV relationship and monitor partnership activity
2026-05-22,20260522-230155-fb3b56b2,Blackstone,Tier 1 / Immediate Strategic Importance,100,General Residential,New York; Sun Belt,Developer / GP Newsrooms,Other,acquisition; refinancing; JV / partnership; capital raise; operational technology / AI adoption,3,61,58.3,Capital Inflow,Potential JV / Partnership Signal,potential JV partnership signal,Low,93,Map potential GP / JV relationship and monitor partnership activity
2026-05-22,20260522-230155-fb3b56b2,AvalonBay,Tier 1 / Immediate Strategic Importance,100,Apartment,California; National,Core Multifamily News,Other,market expansion,2,100,94.5,No Clear Capital Flow Signal,No Clear Relationship Signal,benchmark underwriting assumptions,High,92,Review California / LA capital and developer activity
2026-05-22,20260522-230155-fb3b56b2,Equity Residential,Tier 1 / Immediate Strategic Importance,100,Apartment,California; National,Core Multifamily News,Other,market expansion,2,100,94.5,No Clear Capital Flow Signal,No Clear Relationship Signal,benchmark underwriting assumptions,High,92,Review California / LA capital and developer activity
2026-05-22,20260522-230155-fb3b56b2,JPI,Tier 3 / Growth and Market Signal Watch,50,Multifamily,Sun Belt,Core Multifamily News,Other,JV / partnership; market expansion,1,89,89.0,No Clear Capital Flow Signal,Potential JV / Partnership Signal,potential JV partnership signal,Low,78,Map potential GP / JV relationship and monitor partnership activity
