run_date,run_id,run_timestamp,market,market_entry_score,timing_signal_count,opportunity_count,distress_signal_count,capital_flow_score,financing_stress_score,supply_pressure_score,institutional_activity_score,gp_activity_score,residential_sector_fit,woomi_strategic_fit,market_entry_window_label,recommended_entry_posture,key_entry_risks,key_entry_opportunities
2026-06-26,20260626-001102-db0c2cd9,2026-06-26 00:11:02,California,81,3,6,1,100,72,45,100,81,90,100,Active Watch Window,Actively source opportunities,"financing stress and refinancing pressure; entitlement, zoning, permitting, and policy uncertainty",active opportunity radar signals; possible distress or recapitalization watch; capital-flow or institutional activity signal; core Woomi California / LA strategic relevance
2026-06-26,20260626-001102-db0c2cd9,2026-06-26 00:11:02,National / Other,72,16,12,4,0,100,100,89,0,80,55,Selective Entry Window,Monitor refinancing and distress pipeline,"financing stress and refinancing pressure; supply, delivery, lease-up, or concession pressure",active opportunity radar signals; possible distress or recapitalization watch
2026-06-26,20260626-001102-db0c2cd9,2026-06-26 00:11:02,Seattle,71,2,1,1,100,100,45,100,0,65,75,Selective Entry Window,Monitor refinancing and distress pipeline,financing stress and refinancing pressure,active opportunity radar signals; possible distress or recapitalization watch; capital-flow or institutional activity signal
2026-06-26,20260626-001102-db0c2cd9,2026-06-26 00:11:02,Sun Belt,63,1,1,1,100,51,45,100,55,80,75,Early Signal / Prepare,Monitor refinancing and distress pipeline,limited timing evidence,active opportunity radar signals; possible distress or recapitalization watch; capital-flow or institutional activity signal
2026-06-26,20260626-001102-db0c2cd9,2026-06-26 00:11:02,New York,57,1,2,0,100,0,45,100,65,65,55,Early Signal / Prepare,Prepare GP conversations,limited timing evidence,active opportunity radar signals; capital-flow or institutional activity signal
2026-06-26,20260626-001102-db0c2cd9,2026-06-26 00:11:02,Los Angeles,34,0,0,0,100,0,45,100,74,90,100,Monitor Only,Prepare GP conversations,"entitlement, zoning, permitting, and policy uncertainty",capital-flow or institutional activity signal; core Woomi California / LA strategic relevance
2026-06-26,20260626-001102-db0c2cd9,2026-06-26 00:11:02,Florida,32,0,0,0,100,0,45,100,53,80,75,Monitor Only,Monitor only,limited timing evidence,capital-flow or institutional activity signal
2026-06-26,20260626-001102-db0c2cd9,2026-06-26 00:11:02,Texas,32,0,0,0,100,0,45,100,51,80,75,Monitor Only,Monitor only,limited timing evidence,capital-flow or institutional activity signal
