run_date,run_id,run_timestamp,submarket_name,parent_market,article_count,deal_count,entitlement_signal_count,opportunity_count,distress_signal_count,timing_signal_count,dominant_residential_sector,dominant_deal_type,dominant_entitlement_signal,site_strategy_theme,submarket_opportunity_score,submarket_risk_score,execution_complexity_score,woomi_site_strategy_relevance,recommended_submarket_action,key_evidence
2026-06-06,20260606-081908-38f3e371,2026-06-06 08:19:08,Miami,Florida,6,4,1,4,2,4,Apartment,Construction Financing,CEQA / Environmental Review,Mixed-use corridor,100,74,30,Strategic watch submarket,Monitor entitlement precedent,"$8,200 Rents Await Tenants of New Coral Gables Luxury Apartments; Acquisition - Miami / Florida - Miami Apartments Trade for $109.9M; Alta Developers Lands $91.8M Construction Loan for Miami Apartments; Construction Financing - Miami / Florida - Alta Developers Lands $91.8M Construction Loan for Miami Apartments; Construction Financing - Miami / Florida - MG Developer and Vertical Developments Secure $100M Construction Loan for Alhambra Par"
2026-06-06,20260606-081908-38f3e371,2026-06-06 08:19:08,Phoenix,Arizona,5,5,1,5,2,6,Apartment,Construction Financing,Office-to-Residential Conversion,Office conversion corridor,100,67,45,Strategic watch submarket,Monitor entitlement precedent,BTR / Build-to-Rent - Phoenix / Arizona - Porter Kyle Builders Names Industry Veteran John Rowland Vice President of Construction; Camelback Office-to-Apartment Conversion Nearly Complete; Construction Financing - Phoenix / Arizona - Scottsdale Developer Inks $141M Construction Loan for Luxury Apartments; Construction Financing - Phoenix / Arizona - Scottsdale Developer The Hampton Group Secures $141M Construction Loan for Luxury Apartmen...; Empire Group Starts Work on $170M Phoenix Apartment Tower
2026-06-06,20260606-081908-38f3e371,2026-06-06 08:19:08,New York,New York,7,5,3,5,1,5,Affordable Housing,Entitlement / Permitting,Entitlement Approval,Transit-oriented development,100,51,55,Strategic watch submarket,Monitor entitlement precedent,40-unit development moves forward at 2301 N. Sepulveda Blvd. in Manhattan Beach; Acquisition - New York City / New York - Jonathan Rose Cos. Buys Upper Manhattan Affordable Housing Building for $53M; Entitlement / Permitting - New York - Proposed apartments face appeal at 3411 Foothill Blvd. in Glendale; Entitlement / Permitting - New York City / New York - 40-unit development moves forward at 2301 N. Sepulveda Blvd. in Manhattan Beach; General Project Signal - New York - Panepinto Properties Begins Leasing 53-Story Apartment Tower in Jersey City
2026-06-06,20260606-081908-38f3e371,2026-06-06 08:19:08,Los Angeles,Los Angeles,10,7,8,1,0,1,Affordable Housing,Entitlement / Permitting,Entitlement Approval,Downtown infill; Mixed-use corridor,100,44,42,High relevance to Woomi site strategy,Monitor entitlement precedent,"19-story high-rise starts work at 6055 Center Drive in Westchester; 40-unit development moves forward at 2301 N. Sepulveda Blvd. in Manhattan Beach; 85 apartments proposed at 15242 W. Parthenia St. in North Hills; Acquisition - Los Angeles / California - Advanced Real Estate Acquires, Rebrands Rowland Heights Apartments; Advanced Real Estate Acquires, Rebrands Rowland Heights Apartments"
2026-06-06,20260606-081908-38f3e371,2026-06-06 08:19:08,Houston,Texas,5,4,0,2,0,1,Apartment,Disposition / Exit,General Entitlement Signal,General submarket monitoring,95,0,20,Strategic watch submarket,Review potential acquisition pipeline,"19-story high-rise starts work at 6055 Center Drive in Westchester; Acquisition - Houston / Texas - Berkadia Brokers Sale of 186-Unit Seniors Housing Property Near Houston; Berkadia Brokers Sale of 186-Unit Seniors Housing Property Near Houston; Disposition / Exit - Houston / Texas - Targo Capital Partners Buys 185 East Houston Street, Part of $81M Portfolio; Disposition / Exit - Los Angeles / California - 19-story high-rise starts work at 6055 Center Drive in Westchester"
2026-06-06,20260606-081908-38f3e371,2026-06-06 08:19:08,Manhattan,New York,3,3,1,2,0,2,Affordable Housing,Refinancing,Entitlement Approval,General submarket monitoring,91,15,30,Strategic watch submarket,Monitor entitlement precedent,40-unit development moves forward at 2301 N. Sepulveda Blvd. in Manhattan Beach; Acquisition - New York City / New York - Jonathan Rose Cos. Buys Upper Manhattan Affordable Housing Building for $53M; Entitlement / Permitting - New York City / New York - 40-unit development moves forward at 2301 N. Sepulveda Blvd. in Manhattan Beach; JLL Real Estate Capital Provides $70M for West Village Multifamily Refi; Jonathan Rose Cos. Buys Upper Manhattan Affordable Housing Building for $53M
2026-06-06,20260606-081908-38f3e371,2026-06-06 08:19:08,Scottsdale,Arizona,2,2,0,2,2,2,Apartment,Construction Financing,General Entitlement Signal,General submarket monitoring,86,67,20,Strategic watch submarket,Monitor refinancing / distress pipeline,Construction Financing - Phoenix / Arizona - Scottsdale Developer Inks $141M Construction Loan for Luxury Apartments; Construction Financing - Phoenix / Arizona - Scottsdale Developer The Hampton Group Secures $141M Construction Loan for Luxury Apartmen...; Scottsdale Developer Inks $141M Construction Loan for Luxury Apartments; Scottsdale Developer The Hampton Group Secures $141M Construction Loan for Luxury Apartments IKONIC
2026-06-06,20260606-081908-38f3e371,2026-06-06 08:19:08,Atlanta,Southeast,3,2,0,2,1,2,Student Housing,General Project Signal,General Entitlement Signal,University-adjacent,76,44,20,Strategic watch submarket,Review potential acquisition pipeline,General Project Signal - Atlanta / Georgia - Insignia Pursuing Embassy Row Redevelopment; Georgia Tech Student Housing Investors Ink Refi; Insignia Pursuing Embassy Row Redevelopment; Portman Targeting Duluth for Mixed-Use Project; Refinancing - Atlanta / Georgia - Georgia Tech Student Housing Investors Ink Refi
2026-06-06,20260606-081908-38f3e371,2026-06-06 08:19:08,DTLA,Los Angeles,1,1,2,1,0,1,Affordable Housing,Entitlement / Permitting,Planning Approval,Downtown infill; Mixed-use corridor,76,33,40,High relevance to Woomi site strategy,Monitor entitlement precedent,Entitlement / Permitting - Los Angeles / California - L.A. City Council upholds approval of mixed-use project at 787 S. Alameda St. in DTLA; L.A. City Council upholds approval of mixed-use project at 787 S. Alameda St. in DTLA
2026-06-06,20260606-081908-38f3e371,2026-06-06 08:19:08,Glendale,Los Angeles,1,1,2,1,0,1,Affordable Housing,Entitlement / Permitting,Planning Approval,General submarket monitoring,75,25,65,High relevance to Woomi site strategy,Monitor entitlement precedent,Entitlement / Permitting - New York - Proposed apartments face appeal at 3411 Foothill Blvd. in Glendale; Proposed apartments face appeal at 3411 Foothill Blvd. in Glendale
2026-06-06,20260606-081908-38f3e371,2026-06-06 08:19:08,Santa Ana,Orange County,1,1,0,1,1,1,Apartment,Construction Financing,General Entitlement Signal,General submarket monitoring,74,59,30,High relevance to Woomi site strategy,Monitor refinancing / distress pipeline,Construction Financing - California - JLL Lines Up $144M Construction Loan for Santa Ana Multifamily; JLL Lines Up $144M Construction Loan for Santa Ana Multifamily
2026-06-06,20260606-081908-38f3e371,2026-06-06 08:19:08,Dallas,Texas,2,2,0,2,0,0,Apartment,General Project Signal,General Entitlement Signal,General submarket monitoring,66,0,20,Strategic watch submarket,Review potential acquisition pipeline,"General Project Signal - Dallas / Texas - Rosewood Property Co. Begins Leasing 338-Unit Apartment Community in Plano; General Project Signal - Dallas / Texas - Seco Planning 12-Story, $100M FW Apartment Highrise; Rosewood Property Co. Begins Leasing 338-Unit Apartment Community in Plano; Seco Planning 12-Story, $100M FW Apartment Highrise"
2026-06-06,20260606-081908-38f3e371,2026-06-06 08:19:08,Long Beach,Los Angeles,1,1,0,1,0,1,Affordable Housing,Development Start,General Entitlement Signal,General submarket monitoring,63,0,30,High relevance to Woomi site strategy,Review potential acquisition pipeline,Construction begins for affordable housing at 4151 E. Fountain Ave. in Long Beach; Development Start - California - Construction begins for affordable housing at 4151 E. Fountain Ave. in Long Beach
2026-06-06,20260606-081908-38f3e371,2026-06-06 08:19:08,Austin,Texas,1,1,0,1,1,1,Apartment,Construction Financing,General Entitlement Signal,General submarket monitoring,49,45,20,Strategic watch submarket,Track local GP / sponsor activity,Construction Financing - Austin / Texas - Dwight Capital Lends $66M of HUD Debt on Texas Luxury Apartments Project; Dwight Capital Lends $66M of HUD Debt on Texas Luxury Apartments Project
2026-06-06,20260606-081908-38f3e371,2026-06-06 08:19:08,Jersey City,New York,1,1,0,1,0,0,Apartment,General Project Signal,General Entitlement Signal,General submarket monitoring,44,0,20,General monitoring,Monitor only,General Project Signal - New York - Panepinto Properties Begins Leasing 53-Story Apartment Tower in Jersey City; Panepinto Properties Begins Leasing 53-Story Apartment Tower in Jersey City
2026-06-06,20260606-081908-38f3e371,2026-06-06 08:19:08,California,National / Other,0,4,0,0,0,0,General Residential,General Project Signal,General Entitlement Signal,General submarket monitoring,32,0,20,General monitoring,Track local GP / sponsor activity,"Development Start - California - Harbor Island West Marina Launches $70M Redevelopment; Disposition / Exit - California - Former Bank Branch Positioned as Development Opportunity in Garden Grove Sale; General Project Signal - California - JLL Arranges $252M Financing for Huntington Beach Seniors Project; Recapitalization - California - PEF Advisors, Freestone Capital Form JV to Recapitalize Affordable Properties"
2026-06-06,20260606-081908-38f3e371,2026-06-06 08:19:08,San Francisco,National / Other,0,1,1,0,0,0,Apartment,Entitlement / Permitting,Entitlement Approval,General submarket monitoring,26,11,20,General monitoring,Monitor entitlement precedent,"Entitlement / Permitting - San Francisco / California - Permits Filed For 821 Corbett Avenue in Twin Peaks, San Francisco"
2026-06-06,20260606-081908-38f3e371,2026-06-06 08:19:08,Orange County,Orange County,4,0,0,0,0,0,Apartment,General Project Signal,General Entitlement Signal,General submarket monitoring,12,0,30,Low relevance,Track local GP / sponsor activity,"Former Bank Branch Positioned as Development Opportunity in Garden Grove Sale; JLL Arranges $252M Financing for Huntington Beach Seniors Project; JLL Lines Up $144M Construction Loan for Santa Ana Multifamily; PEF Advisors, Freestone Capital Form JV to Recapitalize Affordable Properties"
2026-06-06,20260606-081908-38f3e371,2026-06-06 08:19:08,Southeast,National / Other,0,1,0,0,0,0,Apartment,Refinancing,General Entitlement Signal,General submarket monitoring,8,0,20,Low relevance,Track local GP / sponsor activity,Refinancing - Florida - Walker & Dunlop Arranges $223M in Bridge Financing for Southeast Multifamily Portfolio
2026-06-06,20260606-081908-38f3e371,2026-06-06 08:19:08,Texas,National / Other,0,1,0,0,0,0,Student Housing,JV / Partnership,General Entitlement Signal,General submarket monitoring,8,0,20,Low relevance,Track local GP / sponsor activity,"JV / Partnership - Texas - JV Closes On 1,128-Bed Texas A&M Housing Deal"
2026-06-06,20260606-081908-38f3e371,2026-06-06 08:19:08,U.S.,National / Other,0,1,0,0,0,0,Apartment,General Project Signal,General Entitlement Signal,General submarket monitoring,8,0,20,Low relevance,Monitor only,General Project Signal - National - Gantry Secures $39.5M Construction Takeout Loan for Saint Paul Class A Multifamily Communi...
2026-06-06,20260606-081908-38f3e371,2026-06-06 08:19:08,Washington Dc,National / Other,0,1,0,0,0,0,Apartment,General Project Signal,General Entitlement Signal,General submarket monitoring,8,0,20,Low relevance,Monitor only,General Project Signal - Washington DC - Arrow Real Estate Advisors Arranges $70M for Delaware MF Development
2026-06-06,20260606-081908-38f3e371,2026-06-06 08:19:08,Charlotte,Southeast,1,0,0,0,0,0,Apartment,General Project Signal,General Entitlement Signal,General submarket monitoring,0,0,20,Low relevance,Monitor only,Northwood Ravin Launches Pre-Leasing for Boutique Multifamily Community The Artisan in South End Charlotte
2026-06-06,20260606-081908-38f3e371,2026-06-06 08:19:08,Fort Worth,Texas,1,0,0,0,0,0,Apartment,General Project Signal,General Entitlement Signal,General submarket monitoring,0,0,20,Low relevance,Monitor only,"Seco Planning 12-Story, $100M FW Apartment Highrise"
2026-06-06,20260606-081908-38f3e371,2026-06-06 08:19:08,Seattle,Seattle,1,0,0,0,0,0,Affordable Housing,General Project Signal,General Entitlement Signal,General submarket monitoring,0,0,20,Low relevance,Track local GP / sponsor activity,"PEF Advisors, Freestone Capital Form JV to Recapitalize Affordable Properties"
