run_date,run_id,canonical_project_id,canonical_project_name,project_identity_confidence,run_timestamp,canonical_article_id,article_integrity_status,primary_display_section,secondary_display_sections,repeat_exposure_status,freshness_score,access_status,project_or_deal_name,deal_type,asset_type,residential_sector,market,city_or_submarket,state_or_region,gp_or_developer,canonical_gp_or_developer,institutional_partner,lender_or_debt_provider,canonical_lender_or_debt_provider,capital_partner,canonical_capital_partner,canonical_market,unit_count,dollar_amount,loan_amount,acquisition_price,development_cost,cap_rate,rent_growth,vacancy_rate,concession_signal,construction_start_or_delivery_timing,entitlement_or_permitting_stage,deal_signal_score,deal_priority_label,potential_woomi_use,source_article_title,source,url,relevance_score,deal_fingerprint_id,fingerprint_confidence,canonical_deal_name,canonical_event_name,duplicate_cluster_id,duplicate_count
2026-06-22,20260622-001313-0c1b6c9b,PRJ-20260622-0054,"Construction Financing - California - JLL Arranges Debt, Equity for Luxury Condo Development in Downtown Lafayette",100,2026-06-22 00:13:13,art_63af87ba590521df,valid,Development Activity,GP / Capital Activity,acceptable_repeat,70,open,"Construction Financing - California - JLL Arranges Debt, Equity for Luxury Condo Development in Downtown Lafayette",Construction Financing,Apartment,Apartment,California,California,California,JLL,JLL,Unknown,jll,JLL,Unknown,Unknown,California,,$60.5 million; $60.5 million,$60.5 million,,,,,,,,,93,High Deal Intelligence,Capital market signal,"JLL Arranges Debt, Equity for Luxury Condo Development in Downtown Lafayette",Connect CRE California,https://www.connectcre.com/stories/jll-arranges-debt-equity-for-luxury-condo-development-in-downtown-lafayette/,100,DFP-63C5FF7E28,90,"Construction Financing - Construction Financing - California - JLL Arranges Debt, Equity for Luxury Condo Development in Downtown Lafayette",Construction Financing - JLL - JLL - California,DCL-20260622-001,1
2026-06-22,20260622-001313-0c1b6c9b,PRJ-20260622-0051,Disposition / Exit - California - Former Bank Branch Positioned as Development Opportunity in Garden Grove Sale,100,2026-06-22 00:13:13,art_6e05306f1e52dc16,valid,Development Activity,GP / Capital Activity,repeat_penalized,55,open,Disposition / Exit - California - Yorba Linda Parking Lot Sells for Townhome Redevelopment,Disposition / Exit,Apartment,Apartment,California,California,California,CBRE,CBRE,Unknown,cbre,CBRE,Unknown,Unknown,California,,$8.12; $8.12,,,,,,,,,,89,High Deal Intelligence,Entitlement / zoning watch,Yorba Linda Parking Lot Sells for Townhome Redevelopment,Connect CRE Orange County,https://www.connectcre.com/stories/yorba-linda-parking-lot-sells-for-townhome-redevelopment/,100,DFP-BB73BB97D4,90,Disposition / Exit - Disposition / Exit - California - Yorba Linda Parking Lot Sells for Townhome Redevelopment,Disposition / Exit - CBRE - California,DCL-20260622-002,1
2026-06-22,20260622-001313-0c1b6c9b,PRJ-20260622-0110,Acquisition - New York - Delshah Makes Second Williamsburg Foray in Three Months,100,2026-06-22 00:13:13,art_5a60fd5373964997,valid,Development Activity,GP / Capital Activity,acceptable_repeat,74,open,Acquisition - New York - Delshah Makes Second Williamsburg Foray in Three Months,Acquisition,Apartment,Apartment,New York,New York,New York,JLL,JLL,Unknown,jll,JLL,Unknown,Unknown,New York,,$85.3 million; $85.3 million; $60.5,,$85.3 million,,,,,,,,85,High Deal Intelligence,Pricing benchmark,Delshah Makes Second Williamsburg Foray in Three Months,Connect CRE Apartments,https://www.connectcre.com/stories/delshah-makes-second-williamsburg-foray-in-three-months/,100,DFP-411A9A554C,90,Acquisition - Acquisition - New York - Delshah Makes Second Williamsburg Foray in Three Months,Acquisition - JLL - New York,DCL-20260622-003,1
2026-06-22,20260622-001313-0c1b6c9b,PRJ-20260622-0146,Construction Financing - Miami / Florida - Developer Duo Closes on $67.5M Financing for Coral Gables Condos,100,2026-06-22 00:13:13,art_6f9d9abc3773ed0e,valid,Development Activity,GP / Capital Activity,repeat_penalized,55,open,Construction Financing - Miami / Florida - Developer Duo Closes on $67.5M Financing for Coral Gables Condos,Construction Financing,Apartment,Apartment,Miami / Florida,South Florida,Unknown,Berkadia,Berkadia,Unknown,berkadia,Berkadia,Unknown,Unknown,Sun Belt,,$67.5M; $67.5M; $67.5 million,$67.5M,,,,,,,,,85,High Deal Intelligence,Capital market signal,Developer Duo Closes on $67.5M Financing for Coral Gables Condos,Connect CRE South Florida,https://www.connectcre.com/stories/developer-duo-closes-on-67-5m-financing-for-coral-gables-condos/,100,DFP-9CC21B7AAE,90,Construction Financing - Construction Financing - Miami / Florida - Developer Duo Closes on $67.5M Financing for Coral Gables Condos,Construction Financing - Berkadia - Berkadia - Sun Belt,DCL-20260622-004,1
2026-06-22,20260622-001313-0c1b6c9b,PRJ-20260622-0055,Acquisition - San Francisco / California - Marcus & Millichap Arranges $6.7M Sale of 28-Unit Multifamily Property in San Francisco,100,2026-06-22 00:13:13,art_886857254c88c3da,valid,Development Activity,GP / Capital Activity; Market Intelligence,acceptable_repeat,74,open,Disposition / Exit - San Francisco / California - Levin Johnston Arranges Two Sales on San Francisco Peninsula,Disposition / Exit,Apartment,Apartment,San Francisco / California,California,California,Marcus & Millichap,Marcus & Millichap,Unknown,Unknown,Unknown,Unknown,Unknown,California,31 units,$10.15; $10.15,,,,,,,,,,80,High Deal Intelligence,Underwriting benchmark,Levin Johnston Arranges Two Sales on San Francisco Peninsula,Connect CRE,https://www.connectcre.com/stories/levin-johnston-arranges-two-sales-on-san-francisco-peninsula/,92,DFP-79527D0E9B,90,Disposition / Exit - Disposition / Exit - San Francisco / California - Levin Johnston Arranges Two Sales on San Francisco Peninsula,Disposition / Exit - Marcus & Millichap - California,DCL-20260622-005,1
2026-06-22,20260622-001313-0c1b6c9b,PRJ-20260622-0055,Acquisition - San Francisco / California - Marcus & Millichap Arranges $6.7M Sale of 28-Unit Multifamily Property in San Francisco,100,2026-06-22 00:13:13,art_de95edd16a80a4d3,valid,Development Activity,GP / Capital Activity,acceptable_repeat,74,open,Acquisition - San Francisco / California - Marcus & Millichap Arranges $6.7M Sale of 28-Unit Multifamily Property in San Francisco,Acquisition,Multifamily,Multifamily,San Francisco / California,California,California,Marcus & Millichap,Marcus & Millichap,Unknown,Unknown,Unknown,Unknown,Unknown,California,28 units,$6.7M; $6.7 million; $6.7M,,$6.7M,,,,,,,,79,Useful Deal Signal,Pricing benchmark,Marcus & Millichap Arranges $6.7M Sale of 28-Unit Multifamily Property in San Francisco,REBusiness Online,https://rebusinessonline.com/marcus-millichap-arranges-6-7m-sale-of-28-unit-multifamily-property-in-san-francisco/,78,DFP-529FF54116,90,Acquisition - Acquisition - San Francisco / California - Marcus & Millichap Arranges $6.7M Sale of 28-Unit Multifamily Property in San Francisco,Acquisition - Marcus & Millichap - California,DCL-20260622-006,1
2026-06-22,20260622-001313-0c1b6c9b,PRJ-20260622-0054,"Construction Financing - California - JLL Arranges Debt, Equity for Luxury Condo Development in Downtown Lafayette",100,2026-06-22 00:13:13,art_1cf4b76f3046105a,valid,Development Activity,GP / Capital Activity,repeat_penalized,5,open,General Project Signal - California - JLL Arranges $252M Financing for Huntington Beach Seniors Project,General Project Signal,Senior Housing,Senior Housing,California,California,California,JLL,JLL,Unknown,jll,JLL,Unknown,Unknown,California,,$252M; $252M; $252.1 million,$252M,,,,,,,,,78,Useful Deal Signal,Capital market signal,JLL Arranges $252M Financing for Huntington Beach Seniors Project,Connect CRE Orange County,https://www.connectcre.com/stories/jll-arranges-252m-financing-for-huntington-beach-seniors-project/,85,DFP-C431C120A0,90,General Project Signal - General Project Signal - California - JLL Arranges $252M Financing for Huntington Beach Seniors Project,General Project Signal - JLL - California,DCL-20260622-007,1
2026-06-22,20260622-001313-0c1b6c9b,PRJ-20260622-0051,Disposition / Exit - California - Former Bank Branch Positioned as Development Opportunity in Garden Grove Sale,100,2026-06-22 00:13:13,art_86bc6f4162c00691,valid,Development Activity,GP / Capital Activity,repeat_penalized,5,open,Disposition / Exit - California - Former Bank Branch Positioned as Development Opportunity in Garden Grove Sale,Disposition / Exit,Unknown Residential,General Residential,California,California,California,CBRE,CBRE,Unknown,cbre,CBRE,Unknown,Unknown,California,,$11 million; $1; $11 million,,,,,,,,,,74,Useful Deal Signal,Entitlement / zoning watch,Former Bank Branch Positioned as Development Opportunity in Garden Grove Sale,Connect CRE Orange County,https://www.connectcre.com/stories/former-bank-branch-positioned-as-development-opportunity-in-garden-grove-sale/,57,DFP-5508FCE9F0,90,Disposition / Exit - Disposition / Exit - California - Former Bank Branch Positioned as Development Opportunity in Garden Grove Sale,Disposition / Exit - CBRE - California,DCL-20260622-008,1
2026-06-22,20260622-001313-0c1b6c9b,PRJ-20260622-0139,Development Start - Phoenix / Arizona - Work Underway on UTSA Student Housing Development,80,2026-06-22 00:13:13,art_7a1e718b81f8d019,valid,Development Activity,GP / Capital Activity,acceptable_repeat,70,open,Acquisition - Phoenix / Arizona - Tide Equities Sells Phoenix Rental Asset for $41M,Acquisition,Apartment,Apartment,Phoenix / Arizona,Phoenix,Unknown,Unknown,Unknown,Unknown,northmarq,northmarq,Unknown,Unknown,Sun Belt,,$41M; $41M; $41 million,$41m,$41M,,,,,,,,73,Useful Deal Signal,Pricing benchmark,Tide Equities Sells Phoenix Rental Asset for $41M,Connect CRE Phoenix,https://www.connectcre.com/stories/tide-equities-sells-phoenix-rental-asset-for-41m/,100,DFP-0093CB17AA,75,Acquisition - Acquisition - Phoenix / Arizona - Tide Equities Sells Phoenix Rental Asset for $41M,Acquisition - Unknown - Sun Belt,DCL-20260622-009,1
2026-06-22,20260622-001313-0c1b6c9b,PRJ-20260622-0060,BTR / Build-to-Rent - Florida - Dwight Mortgage Trust Lends $26M on Florida BTR Community,100,2026-06-22 00:13:13,art_3ed7920966afec97,valid,GP / Capital Activity,,acceptable_repeat,70,open,BTR / Build-to-Rent - Florida - Dwight Mortgage Trust Lends $26M on Florida BTR Community,BTR / Build-to-Rent,BTR / Single-Family Rental,BTR / Single-Family Rental,Florida,Florida,Florida,Dwight Mortgage Trust,Dwight Mortgage Trust,Unknown,Unknown,Unknown,Unknown,Unknown,Florida,,$26M; $26M; $26 million,$26M,,,,,,,,,73,Useful Deal Signal,Capital market signal,Dwight Mortgage Trust Lends $26M on Florida BTR Community,Commercial Observer,https://commercialobserver.com/2026/06/dwight-mortgage-trust-florida-build-to-rent/,100,DFP-7F108CB1EA,80,BTR / Build-to-Rent - BTR / Build-to-Rent - Florida - Dwight Mortgage Trust Lends $26M on Florida BTR Community,BTR / Build-to-Rent - Dwight Mortgage Trust - Florida,DCL-20260622-010,1
2026-06-22,20260622-001313-0c1b6c9b,PRJ-20260622-0137,Disposition / Exit - Phoenix / Arizona - Quarterra Sells 290-Unit Kierland Rental Asset,100,2026-06-22 00:13:13,art_258a877c6f7af913,valid,Development Activity,GP / Capital Activity,repeat_penalized,55,open,Disposition / Exit - Phoenix / Arizona - Quarterra Sells 290-Unit Kierland Rental Asset,Disposition / Exit,Apartment,Apartment,Phoenix / Arizona,Phoenix,Unknown,Quarterra,Quarterra,Unknown,Unknown,Unknown,Unknown,Unknown,Sun Belt,,$90 million; $90 million,$90 million,,,,,,,,,73,Useful Deal Signal,Capital market signal,Quarterra Sells 290-Unit Kierland Rental Asset,Connect CRE Phoenix,https://www.connectcre.com/stories/quarterra-sells-290-unit-kierland-rental-asset/,100,DFP-2F24650702,80,Disposition / Exit - Disposition / Exit - Phoenix / Arizona - Quarterra Sells 290-Unit Kierland Rental Asset,Disposition / Exit - Quarterra - Sun Belt,DCL-20260622-011,1
2026-06-22,20260622-001313-0c1b6c9b,PRJ-20260622-0147,"General Project Signal - Miami / Florida - Kolter Multifamily Begins Construction on 386-Unit Apartment Community in Delray Beach, Fl...",80,2026-06-22 00:13:13,art_23d91715741ad799,valid,Development Activity,Market Intelligence,acceptable_repeat,74,open,Development Start - Miami / Florida - Related Urban Starts Work on $167M S. Miami Affordable Housing Venture,Development Start,Affordable Housing,Affordable Housing,Miami / Florida,South Florida,Unknown,Unknown,Unknown,related,Unknown,Unknown,related,Related Companies,Sun Belt,,$167M; $167M; $167 million,,,,,,,,broke ground,,72,Useful Deal Signal,Pipeline / supply signal,Related Urban Starts Work on $167M S. Miami Affordable Housing Venture,Connect CRE Apartments,https://www.connectcre.com/stories/related-urban-starts-work-on-167m-s-miami-affordable-housing-venture/,98,DFP-2E96824EE5,65,Development Start - Development Start - Miami / Florida - Related Urban Starts Work on $167M S. Miami Affordable Housing Venture,Development Start - Unknown - Sun Belt,DCL-20260622-012,1
2026-06-22,20260622-001313-0c1b6c9b,PRJ-20260622-0138,Disposition / Exit - Phoenix / Arizona - Wood Partners Sells Gilbert Apartments for $81.6M,100,2026-06-22 00:13:13,art_ee22a2f4fd623f8b,valid,Development Activity,GP / Capital Activity,repeat_penalized,55,open,Disposition / Exit - Phoenix / Arizona - Wood Partners Sells Gilbert Apartments for $81.6M,Disposition / Exit,Apartment,Apartment,Phoenix / Arizona,Phoenix,Unknown,Wood Partners,Wood Partners,Unknown,Unknown,Unknown,Unknown,Unknown,Sun Belt,,$81.6M; $81.6M; $81.6 million,,,,,,,,,,72,Useful Deal Signal,Underwriting benchmark,Wood Partners Sells Gilbert Apartments for $81.6M,Connect CRE Phoenix,https://www.connectcre.com/stories/wood-partners-sells-gilbert-apartments-for-81-6m/,97,DFP-F14D12988C,80,Disposition / Exit - Disposition / Exit - Phoenix / Arizona - Wood Partners Sells Gilbert Apartments for $81.6M,Disposition / Exit - Wood Partners - Sun Belt,DCL-20260622-013,1
2026-06-22,20260622-001313-0c1b6c9b,PRJ-20260622-0107,Office-to-Residential Conversion - New York City / New York - MRC Provides $480M in Financing for Office-to-Residential Conversion Project in Midtown Ma...,80,2026-06-22 00:13:13,art_77031ba6f597b20b,valid,GP / Capital Activity,,acceptable_repeat,74,open,Office-to-Residential Conversion - New York City / New York - MRC Provides $480M in Financing for Office-to-Residential Conversion Project in Midtown Ma...,Office-to-Residential Conversion,Office-to-Residential,Office-to-Residential Conversion,New York City / New York,New York City,Unknown,Unknown,Unknown,Unknown,Unknown,Unknown,Unknown,Unknown,New York,238 apartments,$480M; $480M; $480 million,$480M,,,,,,,,,71,Useful Deal Signal,Capital market signal,MRC Provides $480M in Financing for Office-to-Residential Conversion Project in Midtown Manhattan,REBusiness Online,https://rebusinessonline.com/mrc-provides-480m-in-financing-for-office-to-residential-conversion-project-in-midtown-manhattan/,100,DFP-3E6906130A,75,Office-to-Residential Conversion - Office-to-Residential Conversion - New York City / New York - MRC Provides $480M in Financing for Office-to-Residential Conversion Project in Midtown Ma...,Office-to-Residential Conversion - Unknown - New York,DCL-20260622-014,1
2026-06-22,20260622-001313-0c1b6c9b,PRJ-20260622-0153,Development Start - Tampa / Florida - Related Group Breaks Ground on 24-Story Apartment Tower in Downtown Tampa,80,2026-06-22 00:13:13,art_896fcafc617f53d9,valid,Development Activity,,acceptable_repeat,62,access_limited,Development Start - Tampa / Florida - Related Group Breaks Ground on 24-Story Apartment Tower in Downtown Tampa,Development Start,Apartment,Apartment,Tampa / Florida,Tampa,Unknown,Unknown,Unknown,related,Unknown,Unknown,related,Related Companies,Sun Belt,369 apartments,,,,,,,,,,,69,Useful Deal Signal,Pipeline / supply signal,Related Group Breaks Ground on 24-Story Apartment Tower in Downtown Tampa,REBusiness Online,https://rebusinessonline.com/related-group-breaks-ground-on-24-story-apartment-tower-in-downtown-tampa/,90,DFP-2119A6A3DB,65,Development Start - Development Start - Tampa / Florida - Related Group Breaks Ground on 24-Story Apartment Tower in Downtown Tampa,Development Start - Unknown - Sun Belt,DCL-20260622-015,1
2026-06-22,20260622-001313-0c1b6c9b,PRJ-20260622-0056,"Recapitalization - California - PEF Advisors, Freestone Capital Form JV to Recapitalize Affordable Properties",100,2026-06-22 00:13:13,art_f0e5befbb21a23aa,valid,Development Activity,GP / Capital Activity,repeat_penalized,5,open,"Recapitalization - California - PEF Advisors, Freestone Capital Form JV to Recapitalize Affordable Properties",Recapitalization,Affordable Housing,Affordable Housing,California,California,California,PEF Advisors,PEF Advisors,Unknown,Unknown,Unknown,Unknown,Unknown,California,,,,,,,,,,,,69,Useful Deal Signal,Capital market signal,"PEF Advisors, Freestone Capital Form JV to Recapitalize Affordable Properties",Connect CRE Orange County,https://www.connectcre.com/stories/pef-advisors-freestone-capital-form-jv-to-recapitalize-affordable-properties/,84,DFP-920342F693,70,"Recapitalization - Recapitalization - California - PEF Advisors, Freestone Capital Form JV to Recapitalize Affordable Properties",Recapitalization - PEF Advisors - California,DCL-20260622-016,1
2026-06-22,20260622-001313-0c1b6c9b,PRJ-20260622-0107,Office-to-Residential Conversion - New York City / New York - MRC Provides $480M in Financing for Office-to-Residential Conversion Project in Midtown Ma...,80,2026-06-22 00:13:13,art_a2d6a7ebf26609ef,valid,Development Activity,GP / Capital Activity,acceptable_repeat,74,open,"Acquisition - New York City / New York - Tredway Buys 168-Unit Affordable Seniors Housing Complex in Peekskill, New York, Plans Reh...",Acquisition,Affordable Housing,Affordable Housing,New York City / New York,New York City,Unknown,Unknown,Unknown,Unknown,Unknown,Unknown,Unknown,Unknown,New York,,$4.5 million,,$4.5 million,,,,,,,,65,Useful Deal Signal,Pricing benchmark,"Tredway Buys 168-Unit Affordable Seniors Housing Complex in Peekskill, New York, Plans Rehabilitation",REBusiness Online,https://rebusinessonline.com/tredway-buys-168-unit-affordable-seniors-housing-complex-in-peekskill-new-york-plans-rehabilitation/,99,DFP-FAB5C5DDBE,65,"Acquisition - Acquisition - New York City / New York - Tredway Buys 168-Unit Affordable Seniors Housing Complex in Peekskill, New York, Plans Reh...",Acquisition - Unknown - New York,DCL-20260622-017,1
2026-06-22,20260622-001313-0c1b6c9b,PRJ-20260622-0147,"General Project Signal - Miami / Florida - Kolter Multifamily Begins Construction on 386-Unit Apartment Community in Delray Beach, Fl...",80,2026-06-22 00:13:13,art_7d3d7023193f3f47,valid,Development Activity,GP / Capital Activity,acceptable_repeat,70,open,Construction Financing - Miami / Florida - 13th Floor Obtains $134M Construction Loan for Douglas Final Phase,Construction Financing,Apartment,Apartment,Miami / Florida,South Florida,Unknown,Unknown,Unknown,Unknown,Unknown,Unknown,Unknown,Unknown,Sun Belt,,$134M; $134M; $134 million,$134M,,,,,,,,,65,Useful Deal Signal,Capital market signal,13th Floor Obtains $134M Construction Loan for Douglas Final Phase,Connect CRE South Florida,https://www.connectcre.com/stories/13th-floor-obtains-134m-construction-loan-for-douglas-final-phase/,100,DFP-03F25A66BC,65,Construction Financing - Construction Financing - Miami / Florida - 13th Floor Obtains $134M Construction Loan for Douglas Final Phase,Construction Financing - Unknown - Sun Belt,DCL-20260622-018,1
2026-06-22,20260622-001313-0c1b6c9b,PRJ-20260622-0147,"General Project Signal - Miami / Florida - Kolter Multifamily Begins Construction on 386-Unit Apartment Community in Delray Beach, Fl...",80,2026-06-22 00:13:13,art_af9e29a139042877,valid,Development Activity,GP / Capital Activity; Market Intelligence,acceptable_repeat,66,open,"Construction Financing - Miami / Florida - Kolter Inks $91.7M Construction Loan, Starts Work on Delray Beach Rental Community",Construction Financing,Apartment,Apartment,Miami / Florida,South Florida,Unknown,Unknown,Unknown,Unknown,Unknown,Unknown,Unknown,Unknown,Sun Belt,,$91.7M; $91.7M; $91.7m,$91.7M,,,,,,,,,65,Useful Deal Signal,Capital market signal,"Kolter Inks $91.7M Construction Loan, Starts Work on Delray Beach Rental Community",Connect CRE South Florida,https://www.connectcre.com/stories/kolter-inks-91-7m-construction-loan-starts-work-on-delray-beach-rental-community/,100,DFP-C8080ED698,65,"Construction Financing - Construction Financing - Miami / Florida - Kolter Inks $91.7M Construction Loan, Starts Work on Delray Beach Rental Community",Construction Financing - Unknown - Sun Belt,DCL-20260622-019,1
2026-06-22,20260622-001313-0c1b6c9b,PRJ-20260622-0082,Entitlement / Permitting - Los Angeles / California - Developer retools plan for mixed-use project at 3800 W. 6th St. in Koreatown,80,2026-06-22 00:13:13,art_13659976df393fe0,valid,Development Activity,,repeat_penalized,58,access_limited,Entitlement / Permitting - Los Angeles / California - Construction begins for 47 apartments at 7337 Fountain Ave. in Hollywood,Entitlement / Permitting,BTR / Single-Family Rental,Affordable Housing,Los Angeles / California,Los Angeles,California,Unknown,Unknown,Unknown,Unknown,Unknown,Unknown,Unknown,Los Angeles,47 apartments,,,,,,,,,,permits,65,Useful Deal Signal,Entitlement / zoning watch,Construction begins for 47 apartments at 7337 Fountain Ave. in Hollywood,Urbanize LA,https://la.urbanize.city/post/construction-begins-47-apartments-7337-fountain-ave-hollywood,100,DFP-0A6D0D28C3,65,Entitlement / Permitting - Entitlement / Permitting - Los Angeles / California - Construction begins for 47 apartments at 7337 Fountain Ave. in Hollywood,Entitlement / Permitting - Unknown - Los Angeles,DCL-20260622-020,1
2026-06-22,20260622-001313-0c1b6c9b,PRJ-20260622-0082,Entitlement / Permitting - Los Angeles / California - Developer retools plan for mixed-use project at 3800 W. 6th St. in Koreatown,80,2026-06-22 00:13:13,art_a5ab5f3f9b82ba5b,valid,Development Activity,,repeat_penalized,58,access_limited,Entitlement / Permitting - Los Angeles / California - Developer retools plan for mixed-use project at 3800 W. 6th St. in Koreatown,Entitlement / Permitting,Mixed-Use Residential,Affordable Housing,Los Angeles / California,Los Angeles,California,Unknown,Unknown,Unknown,Unknown,Unknown,Unknown,Unknown,Los Angeles,219 apartments,,,,,,,,,,entitlement,65,Useful Deal Signal,Entitlement / zoning watch,Developer retools plan for mixed-use project at 3800 W. 6th St. in Koreatown,Urbanize LA,https://la.urbanize.city/post/developer-retools-plan-mixed-use-project-3800-w-6th-st-koreatown,100,DFP-7B0BA8F4D5,65,Entitlement / Permitting - Entitlement / Permitting - Los Angeles / California - Developer retools plan for mixed-use project at 3800 W. 6th St. in Koreatown,Entitlement / Permitting - Unknown - Los Angeles,DCL-20260622-021,1
2026-06-22,20260622-001313-0c1b6c9b,PRJ-20260622-0046,"Acquisition - Beverly Hills / California - Hawkins Way Capital Drops $28M on 81 East Third Street Apartments, Student Housing",80,2026-06-22 00:13:13,art_64207805f53007c7,valid,Development Activity,,acceptable_repeat,62,access_limited,Entitlement / Permitting - Beverly Hills / California - Infill housing in progress at 3676 S. Kelton Ave. in Palms,Entitlement / Permitting,Affordable Housing,Affordable Housing,Beverly Hills / California,Beverly Hills / California,Unknown,Unknown,Unknown,Unknown,Unknown,Unknown,Unknown,Unknown,California,27 apartments,,,,,,,,,,permit,65,Useful Deal Signal,Entitlement / zoning watch,Infill housing in progress at 3676 S. Kelton Ave. in Palms,Urbanize LA,https://la.urbanize.city/post/infill-housing-progress-3676-s-kelton-ave-palms,100,DFP-6158F41EE1,65,Entitlement / Permitting - Entitlement / Permitting - Beverly Hills / California - Infill housing in progress at 3676 S. Kelton Ave. in Palms,Entitlement / Permitting - Unknown - California,DCL-20260622-022,1
2026-06-22,20260622-001313-0c1b6c9b,PRJ-20260622-0040,Refinancing - Atlanta / Georgia - Red Oak Capital Holdings Completes $5.85M Core-Plus Bridge Loan for 68-Unit Suburban Atlan...,80,2026-06-22 00:13:13,art_8f48349e3b36503a,valid,Development Activity,GP / Capital Activity,acceptable_repeat,74,open,Refinancing - Atlanta / Georgia - Red Oak Capital Holdings Completes $5.85M Core-Plus Bridge Loan for 68-Unit Suburban Atlan...,Refinancing,Apartment,Apartment,Atlanta / Georgia,Atlanta,Unknown,Unknown,Unknown,Unknown,Unknown,Unknown,Unknown,Unknown,Los Angeles,,$5.85M; $5.85; $5.85m,$5.85M,,,,,,,,,65,Useful Deal Signal,Capital market signal,Red Oak Capital Holdings Completes $5.85M Core-Plus Bridge Loan for 68-Unit Suburban Atlanta Multifamily Community,Yield PRO,https://yieldpro.com/2026/06/britain-village-in-lawrenceville/,100,DFP-210D123CF8,65,Refinancing - Refinancing - Atlanta / Georgia - Red Oak Capital Holdings Completes $5.85M Core-Plus Bridge Loan for 68-Unit Suburban Atlan...,Refinancing - Unknown - Los Angeles,DCL-20260622-023,1
