run_date,run_id,run_timestamp,market,market_entry_score,timing_signal_count,opportunity_count,distress_signal_count,capital_flow_score,financing_stress_score,supply_pressure_score,institutional_activity_score,gp_activity_score,residential_sector_fit,woomi_strategic_fit,market_entry_window_label,recommended_entry_posture,key_entry_risks,key_entry_opportunities
2026-06-22,20260622-001313-0c1b6c9b,2026-06-22 00:13:13,California,82,4,6,2,100,76,45,100,81,90,100,Active Watch Window,Actively source opportunities,"financing stress and refinancing pressure; entitlement, zoning, permitting, and policy uncertainty",active opportunity radar signals; possible distress or recapitalization watch; capital-flow or institutional activity signal; core Woomi California / LA strategic relevance
2026-06-22,20260622-001313-0c1b6c9b,2026-06-22 00:13:13,Florida,76,3,2,1,100,59,100,100,64,80,75,Selective Entry Window,Monitor refinancing and distress pipeline,"supply, delivery, lease-up, or concession pressure",active opportunity radar signals; possible distress or recapitalization watch; capital-flow or institutional activity signal
2026-06-22,20260622-001313-0c1b6c9b,2026-06-22 00:13:13,National / Other,63,13,13,2,0,53,100,75,0,80,55,Early Signal / Prepare,Monitor refinancing and distress pipeline,"supply, delivery, lease-up, or concession pressure",active opportunity radar signals; possible distress or recapitalization watch
2026-06-22,20260622-001313-0c1b6c9b,2026-06-22 00:13:13,New York,60,1,1,0,100,0,45,100,60,65,55,Early Signal / Prepare,Prepare GP conversations,limited timing evidence,active opportunity radar signals; capital-flow or institutional activity signal
2026-06-22,20260622-001313-0c1b6c9b,2026-06-22 00:13:13,Seattle,52,2,2,0,100,0,45,100,0,65,75,Early Signal / Prepare,Prepare GP conversations,limited timing evidence,active opportunity radar signals; capital-flow or institutional activity signal
2026-06-22,20260622-001313-0c1b6c9b,2026-06-22 00:13:13,Los Angeles,30,0,0,0,100,0,45,100,0,90,100,Monitor Only,Monitor only,"entitlement, zoning, permitting, and policy uncertainty",capital-flow or institutional activity signal; core Woomi California / LA strategic relevance
2026-06-22,20260622-001313-0c1b6c9b,2026-06-22 00:13:13,Sun Belt,29,0,0,0,100,0,45,100,0,80,75,Not Attractive Now,Monitor only,limited timing evidence,capital-flow or institutional activity signal
2026-06-22,20260622-001313-0c1b6c9b,2026-06-22 00:13:13,Texas,29,0,0,0,100,0,45,100,0,80,75,Not Attractive Now,Monitor only,limited timing evidence,capital-flow or institutional activity signal
