run_date,run_id,run_timestamp,regime,residential_sector,executive_priority_score,executive_priority_rank,executive_attention_tier,management_message,recommended_owner,recommended_action_timing
2026-06-27,20260627-000844-ffc034be,2026-06-27 00:08:44,Developer Strategy Shift,Apartment,98,1,Tier 1 Executive Attention,"Developer strategy signals should be reviewed because they may reveal capability needs in product, operations, partnerships, or delivery model.",Strategy Team; Development Team; US Local Team,This Week
2026-06-27,20260627-000844-ffc034be,2026-06-27 00:08:44,Selective Capital Re-entry,Apartment,98,2,Tier 1 Executive Attention,Institutional capital movement should be tracked because it may indicate pricing discovery and partner activity.,Investment Team; Strategy Team; Executive Committee; US Local Team,This Week
2026-06-27,20260627-000844-ffc034be,2026-06-27 00:08:44,Financing Stress,Apartment,97,3,Tier 2 Strategic Review,"Debt market pressure should be reviewed because it may affect construction loan sizing, refinancing assumptions, and exit cap rates.",Finance / Treasury; Investment Team; Executive Committee; US Local Team,This Week
2026-06-27,20260627-000844-ffc034be,2026-06-27 00:08:44,Supply Pressure,Apartment,85,4,Tier 2 Strategic Review,"Supply and lease-up signals should be monitored because they may affect rent growth, vacancy, and development timing.",Investment Team; Development Team; US Local Team,This Week
2026-06-27,20260627-000844-ffc034be,2026-06-27 00:08:44,Policy / Entitlement Watch,Apartment,64,5,Tier 3 Monitoring,"Policy and entitlement signals should be monitored because they may affect approvals, zoning strategy, and local development feasibility.",Development Team; US Local Team; Strategy Team,Next IC / Strategy Meeting
2026-06-27,20260627-000844-ffc034be,2026-06-27 00:08:44,Construction Cost Pressure,Apartment,9,6,Background,"Construction cost signals should be reviewed because they may affect feasibility, contingencies, and value engineering.",Development Team; Investment Team; US Local Team,Background Tracking
