run_date,run_id,run_timestamp,regime,raw_score,normalized_score,final_score,strength_label,supporting_signals,interpretation
2026-06-08,20260608-230157-81fea293,2026-06-08 23:01:57,Selective Capital Re-entry,134,89,89,Very Strong,Institutional Flow articles: 21; Deal Size Signal articles: 10; Institutional player mentions: 11,"Institutional flow, deal-size, or major-player activity suggests capital-market re-engagement."
2026-06-08,20260608-230157-81fea293,2026-06-08 23:01:57,Supply Pressure,123,82,82,Very Strong,Supply Pressure articles: 5; Supply/vacancy/concession signals: 13; Supply matched-keyword articles: 6,"Supply, starts, deliveries, lease-up, vacancy, or concession signals are visible."
2026-06-08,20260608-230157-81fea293,2026-06-08 23:01:57,Financing Stress,121,81,81,Very Strong,Financing Risk articles: 24; Financing/cap-rate market signals: 4; Financing matched-keyword articles: 22,"Debt, rates, refinancing, or cap-rate pressure is visible enough to affect underwriting attention."
2026-06-08,20260608-230157-81fea293,2026-06-08 23:01:57,Policy / Entitlement Watch,100,67,67,Strong,Regulation Risk articles: 10; Policy matched-keyword articles: 10; California / Los Angeles focus count: 9,"Policy, zoning, permitting, entitlement, rent-control, or housing-production signals require monitoring."
2026-06-08,20260608-230157-81fea293,2026-06-08 23:01:57,Developer Strategy Shift,88,59,59,Moderate,Developer Strategy articles: 36; Developer matched-keyword articles: 14; Must Read articles: 36,"Developer behavior, product strategy, adaptive reuse, BTR, modular, or operating-model signals are visible."
2026-06-08,20260608-230157-81fea293,2026-06-08 23:01:57,Construction Cost Pressure,33,22,22,Weak,Cost Control articles: 1; Construction Cost Signal articles: 0; Cost matched-keyword articles: 4,"Cost-control, labor, materials, or construction pricing signals may affect project feasibility."
2026-06-08,20260608-230157-81fea293,2026-06-08 23:01:57,Stable Monitoring Environment,0,0,0,Not Detected,Highest active regime score before stable adjustment: 134; Monitor articles: 7,Stable Monitoring Environment is not a meaningful signal in this run.
