run_date,run_id,canonical_project_id,canonical_project_name,project_identity_confidence,run_timestamp,canonical_article_id,article_integrity_status,primary_display_section,secondary_display_sections,repeat_exposure_status,freshness_score,access_status,project_or_deal_name,deal_type,asset_type,residential_sector,market,city_or_submarket,state_or_region,gp_or_developer,canonical_gp_or_developer,institutional_partner,lender_or_debt_provider,canonical_lender_or_debt_provider,capital_partner,canonical_capital_partner,canonical_market,unit_count,dollar_amount,loan_amount,acquisition_price,development_cost,cap_rate,rent_growth,vacancy_rate,concession_signal,construction_start_or_delivery_timing,entitlement_or_permitting_stage,deal_signal_score,deal_priority_label,potential_woomi_use,source_article_title,source,url,relevance_score,deal_fingerprint_id,fingerprint_confidence,canonical_deal_name,canonical_event_name,duplicate_cluster_id,duplicate_count
2026-06-30,20260630-000528-e3d0faf1,PRJ-20260630-0122,General Project Signal - Other / Unknown - Greystone Provides HUD FHA Loan for Multifamily Property in Middlesex New Jersey,100,2026-06-30 00:05:28,art_e7009b8d108b73cd,valid,Development Activity,GP / Capital Activity,new_or_fresh,100,open,General Project Signal - Other / Unknown - Greystone Provides HUD FHA Loan for Multifamily Property in Middlesex New Jersey,General Project Signal,Multifamily,Multifamily,Other / Unknown,Unknown,Unknown,Greystone,Greystone,Unknown,Unknown,Unknown,Unknown,Unknown,Other / Unknown,,$47; $47,$47,,,,,,,,,50,Monitor,Capital market signal,Greystone Provides HUD FHA Loan for Multifamily Property in Middlesex New Jersey,Yield PRO,https://yieldpro.com/2026/06/the-view-at-middlesex/,80,DFP-3581D62D51,70,General Project Signal - General Project Signal - Other / Unknown - Greystone Provides HUD FHA Loan for Multifamily Property in Middlesex New Jersey,General Project Signal - Greystone - Other / Unknown,DCL-20260630-050,1
2026-06-30,20260630-000528-e3d0faf1,PRJ-20260630-0121,"BTR / Build-to-Rent - Other / Unknown - To Be Great, BTR Needs To Be Mid, Greystar Says",100,2026-06-30 00:05:28,art_eb066603dc237ca5,valid,Development Activity,Market Intelligence,new_or_fresh,88,access_limited,"BTR / Build-to-Rent - Other / Unknown - To Be Great, BTR Needs To Be Mid, Greystar Says",BTR / Build-to-Rent,BTR / Single-Family Rental,BTR / Single-Family Rental,Other / Unknown,Unknown,Unknown,Greystar,Greystar,Unknown,Unknown,Unknown,Unknown,Unknown,Other / Unknown,,,,,,,,,,,,49,Monitor,Pipeline / supply signal,"To Be Great, BTR Needs To Be Mid, Greystar Says",Bisnow,https://www.bisnow.com/london/news/build-to-rent/to-be-great-btr-needs-to-be-mid-greystar-says-135203,89,DFP-F944ECC158,60,"BTR / Build-to-Rent - BTR / Build-to-Rent - Other / Unknown - To Be Great, BTR Needs To Be Mid, Greystar Says",BTR / Build-to-Rent - Greystar - Other / Unknown,DCL-20260630-051,1
2026-06-30,20260630-000528-e3d0faf1,PRJ-20260630-0183,General Project Signal - Virginia - Bonaventure Raises $54M for Two Virginia Multifamily Properties,80,2026-06-30 00:05:28,art_a8a264d31e3a9163,valid,Article Feed,,new_or_fresh,100,open,General Project Signal - Virginia - Bonaventure Raises $54M for Two Virginia Multifamily Properties,General Project Signal,Apartment,Apartment,Virginia,Virginia,Unknown,Unknown,Unknown,Unknown,Unknown,Unknown,Unknown,Unknown,Virginia,,$54M; $54M; $54.2 million,$54.2 million,,,,,,,,,49,Monitor,Capital market signal,Bonaventure Raises $54M for Two Virginia Multifamily Properties,Commercial Observer,https://commercialobserver.com/2026/06/bonaventure-virginia-multifamily-dst/,84,DFP-F2FBBE326A,65,General Project Signal - General Project Signal - Virginia - Bonaventure Raises $54M for Two Virginia Multifamily Properties,General Project Signal - Unknown - Virginia,DCL-20260630-052,1
2026-06-30,20260630-000528-e3d0faf1,PRJ-20260630-0165,Development Start - Miami / Florida - Related Urban Starts Work on $167M S. Miami Affordable Housing Venture,80,2026-06-30 00:05:28,art_297515b4cfa33344,valid,Development Activity,,new_or_fresh,100,open,General Project Signal - Miami / Florida - Dezer Advancing Plan for 600 N. Miami Apartment Units,General Project Signal,Apartment,Apartment,Miami / Florida,South Florida,Unknown,Unknown,Unknown,Unknown,Unknown,Unknown,Unknown,Unknown,Sun Belt,269 apartments,,,,,,,,,,,49,Monitor,Underwriting benchmark,Dezer Advancing Plan for 600 N. Miami Apartment Units,Connect CRE Apartments,https://www.connectcre.com/stories/dezer-advancing-plan-for-600-n-miami-apartment-units/,83,DFP-C771F888AB,65,General Project Signal - General Project Signal - Miami / Florida - Dezer Advancing Plan for 600 N. Miami Apartment Units,General Project Signal - Unknown - Sun Belt,DCL-20260630-053,1
2026-06-30,20260630-000528-e3d0faf1,PRJ-20260630-0141,BTR / Build-to-Rent - Phoenix / Arizona - NexMetro Opens 108-Unit Avilla Foothills BTR Project in Metro Phoenix,80,2026-06-30 00:05:28,art_12ed30eec52da34b,valid,Development Activity,,new_or_fresh,100,open,BTR / Build-to-Rent - Phoenix / Arizona - NexMetro Opens 108-Unit Avilla Foothills BTR Project in Metro Phoenix,BTR / Build-to-Rent,BTR / Single-Family Rental,BTR / Single-Family Rental,Phoenix / Arizona,Phoenix,Unknown,Unknown,Unknown,Unknown,Unknown,Unknown,Unknown,Unknown,Sun Belt,,,,,,,,,,completed,,43,Monitor,Pipeline / supply signal,NexMetro Opens 108-Unit Avilla Foothills BTR Project in Metro Phoenix,REBusiness Online,https://rebusinessonline.com/nexmetro-opens-108-unit-avilla-foothills-btr-project-in-metro-phoenix/,77,DFP-7E230CC8D0,55,BTR / Build-to-Rent - BTR / Build-to-Rent - Phoenix / Arizona - NexMetro Opens 108-Unit Avilla Foothills BTR Project in Metro Phoenix,BTR / Build-to-Rent - Unknown - Sun Belt,DCL-20260630-054,1
2026-06-30,20260630-000528-e3d0faf1,PRJ-20260630-0102,"Entitlement / Permitting - New York City / New York - Rent Freeze Approved On All Stabilized Leases, Delivering On Mamdani Pledge",80,2026-06-30 00:05:28,art_2187089a13e85d3b,valid,Development Activity,,repeat_penalized,58,access_limited,"Entitlement / Permitting - New York City / New York - Rent Freeze Approved On All Stabilized Leases, Delivering On Mamdani Pledge",Entitlement / Permitting,Apartment,Apartment,New York City / New York,New York City,Unknown,Unknown,Unknown,Unknown,Unknown,Unknown,Unknown,Unknown,New York,,,,,,,,,,,Approved,42,Monitor,Entitlement / zoning watch,"Rent Freeze Approved On All Stabilized Leases, Delivering On Mamdani Pledge",Bisnow,https://www.bisnow.com/new-york/news/multifamily/rent-guidelines-board-rent-freeze-mamdani-135196,62,DFP-6ECBB4F17B,55,"Entitlement / Permitting - Entitlement / Permitting - New York City / New York - Rent Freeze Approved On All Stabilized Leases, Delivering On Mamdani Pledge",Entitlement / Permitting - Unknown - New York,DCL-20260630-055,1
2026-06-30,20260630-000528-e3d0faf1,PRJ-20260630-0130,General Project Signal - Other / Unknown - RocaPoint Partners and The Georgetown Company Adding 350 Apartments to Dunwoody Mixed-Use...,80,2026-06-30 00:05:28,art_c49101dd4881b591,valid,Development Activity,Market Intelligence,repeat_penalized,5,open,Development Start - Other / Unknown - Missing Middle Weakness,Development Start,Apartment,Apartment,Other / Unknown,Unknown,Unknown,Unknown,Unknown,Unknown,Unknown,Unknown,Unknown,Unknown,Other / Unknown,,,,,,,,,,,,41,Monitor,Pipeline / supply signal,Missing Middle Weakness,NAHB Eye on Housing - Multifamily,https://eyeonhousing.org/2026/01/missing-middle-weakness/,88,DFP-2F6D8F65F6,45,Development Start - Development Start - Other / Unknown - Missing Middle Weakness,Development Start - Unknown - Other / Unknown,DCL-20260630-056,1
2026-06-30,20260630-000528-e3d0faf1,PRJ-20260630-0165,Development Start - Miami / Florida - Related Urban Starts Work on $167M S. Miami Affordable Housing Venture,80,2026-06-30 00:05:28,art_58d2f3c5cddb4ea3,valid,Development Activity,GP / Capital Activity,repeat_penalized,55,open,General Project Signal - Miami / Florida - Miami-Dade County Sells Apartment Site for $10,General Project Signal,Affordable Housing,Affordable Housing,Miami / Florida,South Florida,Unknown,Unknown,Unknown,Unknown,Unknown,Unknown,Unknown,Unknown,Sun Belt,,$10 ; $10 ; $10 ,,,,,,,,,,41,Monitor,Underwriting benchmark,Miami-Dade County Sells Apartment Site for $10,Connect CRE South Florida,https://www.connectcre.com/stories/miami-dade-county-sells-apartment-site-for-10/,61,DFP-C6A3BF1355,65,General Project Signal - General Project Signal - Miami / Florida - Miami-Dade County Sells Apartment Site for $10,General Project Signal - Unknown - Sun Belt,DCL-20260630-057,1
2026-06-30,20260630-000528-e3d0faf1,PRJ-20260630-0130,General Project Signal - Other / Unknown - RocaPoint Partners and The Georgetown Company Adding 350 Apartments to Dunwoody Mixed-Use...,80,2026-06-30 00:05:28,art_d3352f073ea65931,valid,Development Activity,,new_or_fresh,100,open,General Project Signal - Other / Unknown - RocaPoint Partners and The Georgetown Company Adding 350 Apartments to Dunwoody Mixed-Use...,General Project Signal,Mixed-Use Residential,Mixed-Use Residential,Other / Unknown,Unknown,Unknown,Unknown,Unknown,Unknown,Unknown,Unknown,Unknown,Unknown,Other / Unknown,350 Apartments,,,,,,,,,,,39,Low Detail Signal,Underwriting benchmark,RocaPoint Partners and The Georgetown Company Adding 350 Apartments to Dunwoody Mixed-Use Project,Yield PRO,https://yieldpro.com/2026/06/campus-244/,84,DFP-1E3D6994E7,55,General Project Signal - General Project Signal - Other / Unknown - RocaPoint Partners and The Georgetown Company Adding 350 Apartments to Dunwoody Mixed-Use...,General Project Signal - Unknown - Other / Unknown,DCL-20260630-058,1
2026-06-30,20260630-000528-e3d0faf1,PRJ-20260630-0130,General Project Signal - Other / Unknown - RocaPoint Partners and The Georgetown Company Adding 350 Apartments to Dunwoody Mixed-Use...,80,2026-06-30 00:05:28,art_4fe1f300db25fc42,valid,Development Activity,GP / Capital Activity,new_or_fresh,100,open,JV / Partnership - Other / Unknown - RailField Partners Joint Venture Acquires Multifamily Apartment Community in DC Suburb,JV / Partnership,Apartment,Apartment,Other / Unknown,Unknown,Unknown,Unknown,Unknown,Unknown,Unknown,Unknown,Unknown,Unknown,Other / Unknown,,,,,,,,,,,,39,Low Detail Signal,GP partnership reference,RailField Partners Joint Venture Acquires Multifamily Apartment Community in DC Suburb,Yield PRO,https://yieldpro.com/2026/06/elme-watkins-mill/,84,DFP-74201C08CB,45,JV / Partnership - JV / Partnership - Other / Unknown - RailField Partners Joint Venture Acquires Multifamily Apartment Community in DC Suburb,JV / Partnership - Unknown - Other / Unknown,DCL-20260630-059,1
2026-06-30,20260630-000528-e3d0faf1,PRJ-20260630-0130,General Project Signal - Other / Unknown - RocaPoint Partners and The Georgetown Company Adding 350 Apartments to Dunwoody Mixed-Use...,80,2026-06-30 00:05:28,art_5997ca178cf755c0,valid,Development Activity,GP / Capital Activity,new_or_fresh,100,open,"JV / Partnership - Other / Unknown - Woodmont, Canoe Brook Complete 199-Unit Apartment Complex in Randolph, New Jersey",JV / Partnership,Apartment,Apartment,Other / Unknown,Unknown,Unknown,Unknown,Unknown,Unknown,Unknown,Unknown,Unknown,Unknown,Other / Unknown,,,,,,,,,,completed,,35,Low Detail Signal,GP partnership reference,"Woodmont, Canoe Brook Complete 199-Unit Apartment Complex in Randolph, New Jersey",REBusiness Online,https://rebusinessonline.com/woodmont-canoe-brook-complete-199-unit-apartment-complex-in-randolph-new-jersey/,72,DFP-8A9A107D3E,45,"JV / Partnership - JV / Partnership - Other / Unknown - Woodmont, Canoe Brook Complete 199-Unit Apartment Complex in Randolph, New Jersey",JV / Partnership - Unknown - Other / Unknown,DCL-20260630-060,1
2026-06-30,20260630-000528-e3d0faf1,PRJ-20260630-0130,General Project Signal - Other / Unknown - RocaPoint Partners and The Georgetown Company Adding 350 Apartments to Dunwoody Mixed-Use...,80,2026-06-30 00:05:28,art_903b1b4f1921b17b,valid,Development Activity,GP / Capital Activity,new_or_fresh,100,open,BTR / Build-to-Rent - Other / Unknown - ARK Homes for Rent Launches Pre-Leasing at New Build-to-Rent Multifamily Community in Knox...,BTR / Build-to-Rent,BTR / Single-Family Rental,BTR / Single-Family Rental,Other / Unknown,Unknown,Unknown,Unknown,Unknown,Unknown,Unknown,Unknown,Unknown,Unknown,Other / Unknown,,,,,,,,,,,,32,Low Detail Signal,Pipeline / supply signal,ARK Homes for Rent Launches Pre-Leasing at New Build-to-Rent Multifamily Community in Knoxville,Yield PRO,https://yieldpro.com/2026/06/the-reserve-at-three-ridges/,73,DFP-4E2F61AE9C,45,BTR / Build-to-Rent - BTR / Build-to-Rent - Other / Unknown - ARK Homes for Rent Launches Pre-Leasing at New Build-to-Rent Multifamily Community in Knox...,BTR / Build-to-Rent - Unknown - Other / Unknown,DCL-20260630-061,1
2026-06-30,20260630-000528-e3d0faf1,PRJ-20260630-0130,General Project Signal - Other / Unknown - RocaPoint Partners and The Georgetown Company Adding 350 Apartments to Dunwoody Mixed-Use...,80,2026-06-30 00:05:28,art_bbf68370d5e8064d,valid,Market Intelligence,,repeat_penalized,5,open,Development Start - Other / Unknown - First Quarter 2026 Multifamily Construction Data,Development Start,Multifamily,Multifamily,Other / Unknown,Unknown,Unknown,Unknown,Unknown,Unknown,Unknown,Unknown,Unknown,Unknown,Other / Unknown,,,,,,,,,,,,32,Low Detail Signal,Pipeline / supply signal,First Quarter 2026 Multifamily Construction Data,NAHB Eye on Housing - Multifamily,https://eyeonhousing.org/2026/05/first-quarter-2026-multifamily-construction-data/,63,DFP-53DEBBEA0C,45,Development Start - Development Start - Other / Unknown - First Quarter 2026 Multifamily Construction Data,Development Start - Unknown - Other / Unknown,DCL-20260630-062,1
2026-06-30,20260630-000528-e3d0faf1,PRJ-20260630-0130,General Project Signal - Other / Unknown - RocaPoint Partners and The Georgetown Company Adding 350 Apartments to Dunwoody Mixed-Use...,80,2026-06-30 00:05:28,art_695932dbcd227470,valid,Market Intelligence,,repeat_penalized,5,open,Development Start - Other / Unknown - Fourth Quarter 2025 Multifamily Construction Data,Development Start,Multifamily,Multifamily,Other / Unknown,Unknown,Unknown,Unknown,Unknown,Unknown,Unknown,Unknown,Unknown,Unknown,Other / Unknown,,,,,,,,,,,,32,Low Detail Signal,Pipeline / supply signal,Fourth Quarter 2025 Multifamily Construction Data,NAHB Eye on Housing - Multifamily,https://eyeonhousing.org/2026/03/fourth-quarter-2025-multifamily-construction-data/,63,DFP-B90543DC0D,45,Development Start - Development Start - Other / Unknown - Fourth Quarter 2025 Multifamily Construction Data,Development Start - Unknown - Other / Unknown,DCL-20260630-063,1
2026-06-30,20260630-000528-e3d0faf1,PRJ-20260630-0130,General Project Signal - Other / Unknown - RocaPoint Partners and The Georgetown Company Adding 350 Apartments to Dunwoody Mixed-Use...,80,2026-06-30 00:05:28,art_a18108b1d53a8afa,valid,Market Intelligence,,repeat_penalized,5,open,Development Start - Other / Unknown - Overall Housing Starts Inch Lower in 2025,Development Start,Multifamily,Multifamily,Other / Unknown,Unknown,Unknown,Unknown,Unknown,Unknown,Unknown,Unknown,Unknown,Unknown,Other / Unknown,,,,,,,,,,,,32,Low Detail Signal,Pipeline / supply signal,Overall Housing Starts Inch Lower in 2025,NAHB Eye on Housing - Multifamily,https://eyeonhousing.org/2026/02/overall-housing-starts-inch-lower-in-2025/,63,DFP-929C698B57,45,Development Start - Development Start - Other / Unknown - Overall Housing Starts Inch Lower in 2025,Development Start - Unknown - Other / Unknown,DCL-20260630-064,1
2026-06-30,20260630-000528-e3d0faf1,PRJ-20260630-0130,General Project Signal - Other / Unknown - RocaPoint Partners and The Georgetown Company Adding 350 Apartments to Dunwoody Mixed-Use...,80,2026-06-30 00:05:28,art_7836a522c6b8b1a5,valid,Market Intelligence,,repeat_penalized,5,open,Development Start - Other / Unknown - Third Quarter 2025 Multifamily Construction Data,Development Start,Multifamily,Multifamily,Other / Unknown,Unknown,Unknown,Unknown,Unknown,Unknown,Unknown,Unknown,Unknown,Unknown,Other / Unknown,,,,,,,,,,,,32,Low Detail Signal,Pipeline / supply signal,Third Quarter 2025 Multifamily Construction Data,NAHB Eye on Housing - Multifamily,https://eyeonhousing.org/2026/01/third-quarter-2025-multifamily-construction-data/,63,DFP-9635218EA1,45,Development Start - Development Start - Other / Unknown - Third Quarter 2025 Multifamily Construction Data,Development Start - Unknown - Other / Unknown,DCL-20260630-065,1
2026-06-30,20260630-000528-e3d0faf1,PRJ-20260630-0130,General Project Signal - Other / Unknown - RocaPoint Partners and The Georgetown Company Adding 350 Apartments to Dunwoody Mixed-Use...,80,2026-06-30 00:05:28,art_acda420b7719eb4c,valid,Development Activity,GP / Capital Activity,acceptable_repeat,70,open,Disposition / Exit - Other / Unknown - Veris Residential boosted apartment sales 34% in May: MSCI,Disposition / Exit,Apartment,Apartment,Other / Unknown,Unknown,Unknown,Unknown,Unknown,Unknown,Unknown,Unknown,Unknown,Unknown,Other / Unknown,,,,,,,,,,,,32,Low Detail Signal,Monitor only,Veris Residential boosted apartment sales 34% in May: MSCI,Multifamily Dive,https://www.multifamilydive.com/news/veris-reit-privatization-apartment-sales/823913/,73,DFP-DE08B6D308,45,Disposition / Exit - Disposition / Exit - Other / Unknown - Veris Residential boosted apartment sales 34% in May: MSCI,Disposition / Exit - Unknown - Other / Unknown,DCL-20260630-066,1
2026-06-30,20260630-000528-e3d0faf1,PRJ-20260630-0172,General Project Signal - National - Kinect Real Estate Partners Closes $127M Multifamily Opportunity Fund,80,2026-06-30 00:05:28,art_3514869da70907c3,valid,Development Activity,GP / Capital Activity,new_or_fresh,100,open,General Project Signal - National - Kinect Real Estate Partners Closes $127M Multifamily Opportunity Fund,General Project Signal,Multifamily,Multifamily,National,U.S.,Unknown,Unknown,Unknown,Unknown,Unknown,Unknown,Unknown,Unknown,National,,$127M; $126.5 million; $100 million,,,,,,,,,,31,Low Detail Signal,Underwriting benchmark,Kinect Real Estate Partners Closes $127M Multifamily Opportunity Fund,Yield PRO,https://yieldpro.com/2026/06/kinect-opportunity-fund-ii/,60,DFP-15A3E0751A,65,General Project Signal - General Project Signal - National - Kinect Real Estate Partners Closes $127M Multifamily Opportunity Fund,General Project Signal - Unknown - National,DCL-20260630-067,1
2026-06-30,20260630-000528-e3d0faf1,PRJ-20260630-0130,General Project Signal - Other / Unknown - RocaPoint Partners and The Georgetown Company Adding 350 Apartments to Dunwoody Mixed-Use...,80,2026-06-30 00:05:28,art_04cbffa23673da57,valid,Market Intelligence,,repeat_penalized,5,open,General Project Signal - Other / Unknown - Multifamily Absorption Rate Remains Below 50%,General Project Signal,Apartment,Apartment,Other / Unknown,Unknown,Unknown,Unknown,Unknown,Unknown,Unknown,Unknown,Unknown,Unknown,Other / Unknown,,,,,,,,,,completed,,27,Low Detail Signal,Monitor only,Multifamily Absorption Rate Remains Below 50%,NAHB Eye on Housing - Multifamily,https://eyeonhousing.org/2026/03/multifamily-absorption-rate-remains-below-50/,78,DFP-AE0C2C64AA,45,General Project Signal - General Project Signal - Other / Unknown - Multifamily Absorption Rate Remains Below 50%,General Project Signal - Unknown - Other / Unknown,DCL-20260630-068,1
2026-06-30,20260630-000528-e3d0faf1,PRJ-20260630-0130,General Project Signal - Other / Unknown - RocaPoint Partners and The Georgetown Company Adding 350 Apartments to Dunwoody Mixed-Use...,80,2026-06-30 00:05:28,art_d4039cdfbf50dd7d,valid,Market Intelligence,,repeat_penalized,5,open,Disposition / Exit - Other / Unknown - NAHB HBGI: Micro Markets Lone Bright Spot for Single-Family Building in Fourth Quarter,Disposition / Exit,Multifamily,Multifamily,Other / Unknown,Unknown,Unknown,Unknown,Unknown,Unknown,Unknown,Unknown,Unknown,Unknown,Other / Unknown,,,,,,,,,,,,26,Low Detail Signal,Monitor only,NAHB HBGI: Micro Markets Lone Bright Spot for Single-Family Building in Fourth Quarter,NAHB Eye on Housing - Multifamily,https://eyeonhousing.org/2026/03/nahb-hbgi-micro-markets-lone-bright-spot-for-single-family-building-in-fourth-quarter/,57,DFP-1563B53CA0,45,Disposition / Exit - Disposition / Exit - Other / Unknown - NAHB HBGI: Micro Markets Lone Bright Spot for Single-Family Building in Fourth Quarter,Disposition / Exit - Unknown - Other / Unknown,DCL-20260630-069,1
2026-06-30,20260630-000528-e3d0faf1,PRJ-20260630-0130,General Project Signal - Other / Unknown - RocaPoint Partners and The Georgetown Company Adding 350 Apartments to Dunwoody Mixed-Use...,80,2026-06-30 00:05:28,art_162dc9bd4d0c6981,valid,Development Activity,GP / Capital Activity; Market Intelligence,new_or_fresh,100,open,Operational / Property Management Tech - Other / Unknown - Beyond efficiency: How leading multifamily operators are putting AI to work,Operational / Property Management Tech,Multifamily,Multifamily,Other / Unknown,Unknown,Unknown,Unknown,Unknown,Unknown,Unknown,Unknown,Unknown,Unknown,Other / Unknown,,,,,,,,,,,,24,Low Detail Signal,Monitor only,Beyond efficiency: How leading multifamily operators are putting AI to work,Multifamily Dive,https://www.multifamilydive.com/spons/beyond-efficiency-how-leading-multifamily-operators-are-putting-ai-to-work/823603/,51,DFP-045C73BFDB,45,Operational / Property Management Tech - Operational / Property Management Tech - Other / Unknown - Beyond efficiency: How leading multifamily operators are putting AI to work,Operational / Property Management Tech - Unknown - Other / Unknown,DCL-20260630-070,1
