run_date,run_id,run_timestamp,market,market_entry_score,timing_signal_count,opportunity_count,distress_signal_count,capital_flow_score,financing_stress_score,supply_pressure_score,institutional_activity_score,gp_activity_score,residential_sector_fit,woomi_strategic_fit,market_entry_window_label,recommended_entry_posture,key_entry_risks,key_entry_opportunities
2026-06-30,20260630-000528-e3d0faf1,2026-06-30 00:05:28,California,82,5,7,2,100,72,45,100,77,90,100,Active Watch Window,Actively source opportunities,"financing stress and refinancing pressure; entitlement, zoning, permitting, and policy uncertainty",active opportunity radar signals; possible distress or recapitalization watch; capital-flow or institutional activity signal; core Woomi California / LA strategic relevance
2026-06-30,20260630-000528-e3d0faf1,2026-06-30 00:05:28,Seattle,70,1,1,1,100,66,45,100,0,65,75,Selective Entry Window,Monitor refinancing and distress pipeline,financing stress and refinancing pressure,active opportunity radar signals; possible distress or recapitalization watch; capital-flow or institutional activity signal
2026-06-30,20260630-000528-e3d0faf1,2026-06-30 00:05:28,National / Other,66,11,17,1,0,100,100,83,0,80,55,Selective Entry Window,Monitor refinancing and distress pipeline,"financing stress and refinancing pressure; supply, delivery, lease-up, or concession pressure",active opportunity radar signals; possible distress or recapitalization watch
2026-06-30,20260630-000528-e3d0faf1,2026-06-30 00:05:28,Sun Belt,54,1,1,0,100,0,45,100,0,80,75,Early Signal / Prepare,Prepare GP conversations,limited timing evidence,active opportunity radar signals; capital-flow or institutional activity signal
2026-06-30,20260630-000528-e3d0faf1,2026-06-30 00:05:28,Florida,47,0,1,0,100,0,45,100,60,80,75,Monitor Only,Prepare GP conversations,limited timing evidence,active opportunity radar signals; capital-flow or institutional activity signal
2026-06-30,20260630-000528-e3d0faf1,2026-06-30 00:05:28,New York,46,0,2,0,100,0,45,100,78,65,55,Monitor Only,Prepare GP conversations,limited timing evidence,active opportunity radar signals; capital-flow or institutional activity signal
2026-06-30,20260630-000528-e3d0faf1,2026-06-30 00:05:28,Los Angeles,34,0,0,0,100,0,45,100,66,90,100,Monitor Only,Prepare GP conversations,"entitlement, zoning, permitting, and policy uncertainty",capital-flow or institutional activity signal; core Woomi California / LA strategic relevance
2026-06-30,20260630-000528-e3d0faf1,2026-06-30 00:05:28,Texas,33,0,0,0,100,0,45,100,74,80,75,Monitor Only,Prepare GP conversations,limited timing evidence,capital-flow or institutional activity signal
