run_date,run_id,run_timestamp,submarket_name,parent_market,article_count,deal_count,entitlement_signal_count,opportunity_count,distress_signal_count,timing_signal_count,dominant_residential_sector,dominant_deal_type,dominant_entitlement_signal,site_strategy_theme,submarket_opportunity_score,submarket_risk_score,execution_complexity_score,woomi_site_strategy_relevance,recommended_submarket_action,key_evidence
2026-06-30,20260630-000528-e3d0faf1,2026-06-30 00:05:28,New York,New York,5,5,1,5,1,3,Apartment,JV / Partnership,Entitlement Approval,Downtown infill,100,52,20,Strategic watch submarket,Monitor entitlement precedent,"Citigroup Refis East Village Apartment Building With $45M CMBS Loan; Entitlement / Permitting - New York City / New York - Rent Freeze Approved On All Stabilized Leases, Delivering On Mamdani Pledge; General Project Signal - New York - Midwood Files New Plans for One Bromfield Site in Downtown Crossing; Historic Queens Bowling Alley Trades for $45M to Multifamily JV; Horizon Storage Acquires Jefferson Valley Facility"
2026-06-30,20260630-000528-e3d0faf1,2026-06-30 00:05:28,Los Angeles,Los Angeles,10,8,5,1,0,0,Affordable Housing,General Project Signal,Entitlement Approval,Mixed-use corridor,100,44,58,High relevance to Woomi site strategy,Monitor entitlement precedent,100 rental townhomes deput at 1771 Blake Ave. in Frogtown; Affordable housing fully-framed at 4129 Centinela Ave. in Del Rey; Affordable housing on the rise at 1405 S. Broadway in DTLA; City Planning Commission votes in favor of new zoning rules near three G Line stops; Developer revises plan for housing complex at 3984 S. Meier Street
2026-06-30,20260630-000528-e3d0faf1,2026-06-30 00:05:28,Miami,Florida,7,6,0,6,0,4,Apartment,Development Start,General Entitlement Signal,General submarket monitoring,100,0,20,Strategic watch submarket,Review potential acquisition pipeline,Acquisition - Miami / Florida - Pembroke Pines Rental Asset Trades for $80.5M; Developer Begins Work on 476-Unit Delray Beach Rental Community; Developer Planning 220-Unit Homestead-Area Rental Community; Development Start - Miami / Florida - Developer Begins Work on 476-Unit Delray Beach Rental Community; Development Start - Miami / Florida - Related Urban Starts Work on $167M S. Miami Affordable Housing Venture
2026-06-30,20260630-000528-e3d0faf1,2026-06-30 00:05:28,Phoenix,Arizona,5,5,0,5,0,6,Apartment,Acquisition,General Entitlement Signal,General submarket monitoring,100,0,20,Strategic watch submarket,Review potential acquisition pipeline,Acquisition - Phoenix / Arizona - Alliance Sells Phoenix Apartments for $81.4M; Acquisition - Phoenix / Arizona - Rise48 Equity Acquires 108-Unit Multifamily Property in North Phoenix; Acquisition - Phoenix / Arizona - Tide Equities Sells Phoenix Rental Asset for $41M; Acquisition - Phoenix / Arizona - Tides Equites Sells Apartment Complex in Phoenix for $41M; Alliance Sells Phoenix Apartments for $81.4M
2026-06-30,20260630-000528-e3d0faf1,2026-06-30 00:05:28,Dallas,Texas,2,2,0,2,0,0,Apartment,JV / Partnership,General Entitlement Signal,General submarket monitoring,73,0,20,Strategic watch submarket,Review potential acquisition pipeline,Dallas Greenlights $200M Oak Lawn Residential Tower; General Project Signal - Dallas / Texas - Dallas Greenlights $200M Oak Lawn Residential Tower; JPI Acquires Multifamily Development Site for 393-Unit Dallas Apartment Community Projec; JV / Partnership - Dallas / Texas - JPI Acquires Multifamily Development Site for 393-Unit Dallas Apartment Community Projec
2026-06-30,20260630-000528-e3d0faf1,2026-06-30 00:05:28,Riverside,Inland Empire,3,3,0,1,0,0,Apartment,Disposition / Exit,General Entitlement Signal,General submarket monitoring,71,0,30,High relevance to Woomi site strategy,Review potential acquisition pipeline,C&C Development Opens Affordable Housing in Irvine; Disposition / Exit - Riverside / California - Elme Communities selloff hits a snag; Disposition / Exit - Riverside / California - REIT's Liquidation Plan Upended After $280M Sale Falls Through; Elme Communities selloff hits a snag; JV / Partnership - Riverside / California - C&C Development Opens Affordable Housing in Irvine
2026-06-30,20260630-000528-e3d0faf1,2026-06-30 00:05:28,DTLA,Los Angeles,1,1,0,1,0,0,Affordable Housing,General Project Signal,General Entitlement Signal,Downtown infill,64,0,30,High relevance to Woomi site strategy,Review potential acquisition pipeline,Affordable housing on the rise at 1405 S. Broadway in DTLA; General Project Signal - Los Angeles / California - Affordable housing on the rise at 1405 S. Broadway in DTLA
2026-06-30,20260630-000528-e3d0faf1,2026-06-30 00:05:28,Seattle,Seattle,3,1,0,1,1,1,Affordable Housing,Construction Financing,General Entitlement Signal,General submarket monitoring,60,51,20,Strategic watch submarket,Review potential acquisition pipeline,"Construction Financing - Seattle - Great Expectations Receives Construction Financing for 102-Unit Affordable Housing Project...; Great Expectations Receives Construction Financing for 102-Unit Affordable Housing Project Addison in Puyallup, Washington; MG Properties Buys Two Multifamily Communities in Gresham; PEF Advisors, Freestone Capital Form JV to Recapitalize Affordable Properties"
2026-06-30,20260630-000528-e3d0faf1,2026-06-30 00:05:28,Tampa,Florida,1,1,0,1,1,1,Mixed-Use Residential,Construction Financing,General Entitlement Signal,Mixed-use corridor,56,46,20,Strategic watch submarket,Track local GP / sponsor activity,Affinius Provides $135M Construction Loan in St. Petersburg for Mixed-Use Tower; Construction Financing - Tampa / Florida - Affinius Provides $135M Construction Loan in St. Petersburg for Mixed-Use Tower
2026-06-30,20260630-000528-e3d0faf1,2026-06-30 00:05:28,Irvine,Orange County,1,1,0,1,0,0,Affordable Housing,JV / Partnership,General Entitlement Signal,General submarket monitoring,55,0,30,High relevance to Woomi site strategy,Monitor only,C&C Development Opens Affordable Housing in Irvine; JV / Partnership - Riverside / California - C&C Development Opens Affordable Housing in Irvine
2026-06-30,20260630-000528-e3d0faf1,2026-06-30 00:05:28,Queens,New York,1,1,0,1,0,0,Multifamily,JV / Partnership,General Entitlement Signal,General submarket monitoring,53,0,20,Strategic watch submarket,Track local GP / sponsor activity,Historic Queens Bowling Alley Trades for $45M to Multifamily JV; JV / Partnership - New York City / New York - Historic Queens Bowling Alley Trades for $45M to Multifamily JV
2026-06-30,20260630-000528-e3d0faf1,2026-06-30 00:05:28,California,National / Other,0,6,0,0,0,0,Apartment,Disposition / Exit,General Entitlement Signal,Hospital-adjacent,48,0,20,Strategic watch submarket,Track local GP / sponsor activity,Disposition / Exit - California - Former Bank Branch Positioned as Development Opportunity in Garden Grove Sale; Disposition / Exit - California - Yorba Linda Parking Lot Sells for Townhome Redevelopment; Disposition / Exit - San Francisco / California - San Francisco Hospitality Group Divests Boutique Hotel in Japantown; General Project Signal - California - New-Construction San Diego Apartments Score $53M Bridge Loan; General Project Signal - California - Newsom Signs Bill Putting $11B Housing Bond on November Ballot
2026-06-30,20260630-000528-e3d0faf1,2026-06-30 00:05:28,Houston,Texas,2,1,0,1,0,1,Apartment,General Project Signal,General Entitlement Signal,General submarket monitoring,48,0,20,Strategic watch submarket,Monitor only,"General Project Signal - Houston / Texas - Sueba USA Completes 353-Unit Apartment Community in Katy, Texas; Sueba USA Completes 353-Unit Apartment Community in Katy, Texas; Tides Equites Sells Apartment Complex in Phoenix for $41M"
2026-06-30,20260630-000528-e3d0faf1,2026-06-30 00:05:28,Nashville,Southeast,1,1,0,1,0,1,BTR / Single-Family Rental,BTR / Build-to-Rent,General Entitlement Signal,General submarket monitoring,46,0,20,Strategic watch submarket,Monitor only,BTR / Build-to-Rent - Nashville / Tennessee - Midwestern markets emerge as hotspots for rental momentum; Midwestern markets emerge as hotspots for rental momentum
2026-06-30,20260630-000528-e3d0faf1,2026-06-30 00:05:28,Atlanta,Southeast,2,1,0,1,0,0,Mixed-Use Residential,General Project Signal,General Entitlement Signal,Mixed-use corridor,43,0,20,General monitoring,Monitor only,Developer Duo Adding 350 Apartments to Dunwoody Mixed-Use Project; General Project Signal - Atlanta / Georgia - Developer Duo Adding 350 Apartments to Dunwoody Mixed-Use Project; Portman Targeting Duluth for Mixed-Use Project
2026-06-30,20260630-000528-e3d0faf1,2026-06-30 00:05:28,Austin,Texas,3,1,0,1,0,0,Mixed-Use Residential,General Project Signal,General Entitlement Signal,Mixed-use corridor,43,0,20,General monitoring,Track local GP / sponsor activity,Construction Begins on Apartments at Cedar Park Mixed-Use Venue; Forman Provides Loan to Kickstart Marble Falls Mixed-Use Project; General Project Signal - Austin / Texas - Forman Provides Loan to Kickstart Marble Falls Mixed-Use Project; Midwestern markets emerge as hotspots for rental momentum
2026-06-30,20260630-000528-e3d0faf1,2026-06-30 00:05:28,San Francisco,National / Other,0,2,1,0,0,0,Apartment,General Project Signal,Entitlement Approval,General submarket monitoring,34,11,20,General monitoring,Monitor entitlement precedent,"Entitlement / Permitting - San Francisco / California - Renovation Plans Filed For Storied 2100 Jackson Street, San Francisco; General Project Signal - San Francisco / California - Concrete Rising For 1123 Sutter Street, San Francisco"
2026-06-30,20260630-000528-e3d0faf1,2026-06-30 00:05:28,"Washington, D.C.",National / Other,0,1,1,0,0,0,Apartment,Office-to-Residential Conversion,Office-to-Residential Conversion,Downtown infill; Office conversion corridor,30,11,35,General monitoring,Monitor entitlement precedent,Office-to-Residential Conversion - Washington DC - Starwood Quietly Reveals Plans For Conversion In Downtown D.C.
2026-06-30,20260630-000528-e3d0faf1,2026-06-30 00:05:28,Other / Unknown,National / Other,0,0,1,0,0,0,Multifamily,General Project Signal,CEQA / Environmental Review,General submarket monitoring,18,44,30,General monitoring,Monitor entitlement precedent,Beyond efficiency: How leading multifamily operators are putting AI to work
2026-06-30,20260630-000528-e3d0faf1,2026-06-30 00:05:28,San Diego,National / Other,0,2,0,0,0,0,Apartment,Acquisition,General Entitlement Signal,General submarket monitoring,16,0,20,Low relevance,Track local GP / sponsor activity,Acquisition - California - MG Properties Buys Two Multifamily Apartments Communities in Gresham Oregon; Acquisition - California - MG Properties Buys Two Multifamily Communities in Gresham
2026-06-30,20260630-000528-e3d0faf1,2026-06-30 00:05:28,Culver City,Los Angeles,1,0,0,0,0,0,Mixed-Use Residential,General Project Signal,General Entitlement Signal,Mixed-use corridor,12,0,30,Low relevance,Monitor only,Developer revises plan for housing complex at 3984 S. Meier Street
2026-06-30,20260630-000528-e3d0faf1,2026-06-30 00:05:28,Downtown Los Angeles,Los Angeles,1,0,0,0,0,0,Affordable Housing,General Project Signal,General Entitlement Signal,Downtown infill,12,0,30,Low relevance,Monitor only,Affordable housing on the rise at 1405 S. Broadway in DTLA
2026-06-30,20260630-000528-e3d0faf1,2026-06-30 00:05:28,Orange County,Orange County,4,0,0,0,0,0,Affordable Housing,General Project Signal,General Entitlement Signal,General submarket monitoring,12,0,30,Low relevance,Track local GP / sponsor activity,"C&C Development Opens Affordable Housing in Irvine; Former Bank Branch Positioned as Development Opportunity in Garden Grove Sale; PEF Advisors, Freestone Capital Form JV to Recapitalize Affordable Properties; Yorba Linda Parking Lot Sells for Townhome Redevelopment"
2026-06-30,20260630-000528-e3d0faf1,2026-06-30 00:05:28,Santa Monica,Los Angeles,1,0,0,0,0,0,Apartment,General Project Signal,General Entitlement Signal,General submarket monitoring,12,0,30,Low relevance,Monitor only,Six homes pitched for 1533 Euclid Street in Santa Monica
2026-06-30,20260630-000528-e3d0faf1,2026-06-30 00:05:28,Watts,Los Angeles,1,0,0,0,0,0,Multifamily,General Project Signal,General Entitlement Signal,University-adjacent,12,0,30,Low relevance,Monitor only,JPI Expands Into Durham With Planned $150M Multifamily Complex
2026-06-30,20260630-000528-e3d0faf1,2026-06-30 00:05:28,Manhattan,New York,1,1,0,0,0,0,Apartment,Refinancing,General Entitlement Signal,General submarket monitoring,8,0,20,Low relevance,Track local GP / sponsor activity,Citigroup Refis East Village Apartment Building With $45M CMBS Loan; Refinancing - New York City / New York - Citigroup Refis East Village Apartment Building With $45M CMBS Loan
2026-06-30,20260630-000528-e3d0faf1,2026-06-30 00:05:28,Raleigh,Southeast,1,1,0,0,0,0,Multifamily,Acquisition,General Entitlement Signal,University-adjacent,8,0,20,Low relevance,Track local GP / sponsor activity,Acquisition - Sun Belt - JPI Expands Into Durham With Planned $150M Multifamily Complex; JPI Expands Into Durham With Planned $150M Multifamily Complex
2026-06-30,20260630-000528-e3d0faf1,2026-06-30 00:05:28,Southeast,National / Other,0,1,0,0,0,0,Student Housing,General Project Signal,General Entitlement Signal,University-adjacent,8,0,20,Low relevance,Track local GP / sponsor activity,"General Project Signal - Florida - Gilbane, CBRE Investment Begin Leasing 703-Bed Student Housing Development Near University..."
2026-06-30,20260630-000528-e3d0faf1,2026-06-30 00:05:28,U.S.,National / Other,0,1,0,0,0,0,Multifamily,General Project Signal,General Entitlement Signal,General submarket monitoring,8,0,20,Low relevance,Monitor only,General Project Signal - National - Kinect Real Estate Partners Closes $127M Multifamily Opportunity Fund
2026-06-30,20260630-000528-e3d0faf1,2026-06-30 00:05:28,Virginia,National / Other,0,1,0,0,0,0,Apartment,General Project Signal,General Entitlement Signal,General submarket monitoring,8,0,20,Low relevance,Monitor only,General Project Signal - Virginia - Bonaventure Raises $54M for Two Virginia Multifamily Properties
2026-06-30,20260630-000528-e3d0faf1,2026-06-30 00:05:28,Fort Worth,Texas,1,0,0,0,0,0,Apartment,General Project Signal,General Entitlement Signal,General submarket monitoring,0,0,20,Low relevance,Monitor only,Dallas Greenlights $200M Oak Lawn Residential Tower
2026-06-30,20260630-000528-e3d0faf1,2026-06-30 00:05:28,Jersey City,New York,1,0,0,0,0,0,Apartment,General Project Signal,General Entitlement Signal,General submarket monitoring,0,0,20,Low relevance,Track local GP / sponsor activity,Veris Residential boosted apartment sales 34% in May: MSCI
2026-06-30,20260630-000528-e3d0faf1,2026-06-30 00:05:28,Orlando,Florida,1,0,0,0,0,0,General Residential,General Project Signal,General Entitlement Signal,University-adjacent,0,0,20,Low relevance,Monitor only,CP Group Brings Occupancy at Central Florida Office Campus to 93 Percent
