run_date,run_id,canonical_project_id,canonical_project_name,project_identity_confidence,run_timestamp,project_or_deal_name,deal_type,asset_type,residential_sector,market,city_or_submarket,state_or_region,gp_or_developer,canonical_gp_or_developer,institutional_partner,lender_or_debt_provider,canonical_lender_or_debt_provider,capital_partner,canonical_capital_partner,canonical_market,unit_count,dollar_amount,loan_amount,acquisition_price,development_cost,cap_rate,rent_growth,vacancy_rate,concession_signal,construction_start_or_delivery_timing,entitlement_or_permitting_stage,deal_signal_score,deal_priority_label,potential_woomi_use,source_article_title,source,url,relevance_score,deal_fingerprint_id,fingerprint_confidence,canonical_deal_name,canonical_event_name,duplicate_cluster_id,duplicate_count
2026-05-28,20260528-230155-27f9735b,PRJ-20260528-0061,"Office-to-Residential Conversion - Sun Belt - Portman to Bring 30,000 SF Food Hall to Savona Mill Redevelopment in Charlotte",80,2026-05-28 23:01:55,"Office-to-Residential Conversion - Sun Belt - Portman to Bring 30,000 SF Food Hall to Savona Mill Redevelopment in Charlotte",Office-to-Residential Conversion,Office-to-Residential,Office-to-Residential Conversion,Sun Belt,Charlotte,Sun Belt,Unknown,Unknown,Unknown,Unknown,Unknown,Unknown,Unknown,Sun Belt,319 apartments,,,,,,,,,,,61,Useful Deal Signal,Construction strategy reference,"Portman to Bring 30,000 SF Food Hall to Savona Mill Redevelopment in Charlotte",REBusiness Online,https://rebusinessonline.com/portman-to-bring-30000-sf-food-hall-to-savona-mill-redevelopment-in-charlotte/,100,DFP-CF3D5B7544,65,"Office-to-Residential Conversion - Office-to-Residential Conversion - Sun Belt - Portman to Bring 30,000 SF Food Hall to Savona Mill Redevelopment in Charlotte",Office-to-Residential Conversion - Unknown - Sun Belt,DCL-20260528-028,1
2026-05-28,20260528-230155-27f9735b,PRJ-20260528-0116,Office-to-Residential Conversion - Other / Unknown - Milwaukee Office-to-Multifamily Redevelopment Conversion Project Secures $114M Rehabilitat...,80,2026-05-28 23:01:55,BTR / Build-to-Rent - Other / Unknown - SIP Ventures Served as Strategic Advisor to Forest Creek Partners in Closing of $15M Recap...,BTR / Build-to-Rent,BTR / Single-Family Rental,BTR / Single-Family Rental,Other / Unknown,Unknown,Unknown,Unknown,Unknown,Unknown,Unknown,Unknown,Unknown,Unknown,Other / Unknown,92 units,$15M; $15 million; $15m,,,,,,,,,,57,Monitor,Pipeline / supply signal,SIP Ventures Served as Strategic Advisor to Forest Creek Partners in Closing of $15M Recapitalization of Phase I at Villages at Forest Creek,Yield PRO,https://yieldpro.com/2026/05/villages-at-forest-creek/,89,DFP-2A6C4B9C7B,65,BTR / Build-to-Rent - BTR / Build-to-Rent - Other / Unknown - SIP Ventures Served as Strategic Advisor to Forest Creek Partners in Closing of $15M Recap...,BTR / Build-to-Rent - Unknown - Other / Unknown,DCL-20260528-029,1
2026-05-28,20260528-230155-27f9735b,PRJ-20260528-0057,Acquisition - California - Bascom Arizona Ventures Continues Acquisition Spree Acquires Off-Market Tucson Multifamily...,80,2026-05-28 23:01:55,"Recapitalization - California - PEF Advisors, Freestone Capital Form JV to Recapitalize Affordable Properties",Recapitalization,Affordable Housing,Affordable Housing,California,California,California,Unknown,Unknown,Unknown,Unknown,Unknown,Unknown,Unknown,California,,,,,,,,,,,,57,Monitor,Capital market signal,"PEF Advisors, Freestone Capital Form JV to Recapitalize Affordable Properties",Connect CRE Orange County,https://www.connectcre.com/stories/pef-advisors-freestone-capital-form-jv-to-recapitalize-affordable-properties/,84,DFP-5DF80115A9,55,"Recapitalization - Recapitalization - California - PEF Advisors, Freestone Capital Form JV to Recapitalize Affordable Properties",Recapitalization - Unknown - California,DCL-20260528-030,1
2026-05-28,20260528-230155-27f9735b,PRJ-20260528-0057,Acquisition - California - Bascom Arizona Ventures Continues Acquisition Spree Acquires Off-Market Tucson Multifamily...,80,2026-05-28 23:01:55,Acquisition - California - Slatt Capital Arranges Acquisition Financing for Rohnert Park Hospitality Assets,Acquisition,Unknown Residential,General Residential,California,California,California,Unknown,Unknown,Unknown,Unknown,Unknown,Unknown,Unknown,California,,$12; $12,$12,$12,,,,,,,,56,Monitor,Pricing benchmark,Slatt Capital Arranges Acquisition Financing for Rohnert Park Hospitality Assets,Connect CRE California,https://www.connectcre.com/stories/486158-2/,50,DFP-0A88BEF968,65,Acquisition - Acquisition - California - Slatt Capital Arranges Acquisition Financing for Rohnert Park Hospitality Assets,Acquisition - Unknown - California,DCL-20260528-031,1
2026-05-28,20260528-230155-27f9735b,PRJ-20260528-0097,"Construction Financing - New York - Dwight Mortgage Trust Lends $55M on Rockland County, N.Y., Multifamily Development",80,2026-05-28 23:01:55,Disposition / Exit - New York - Coastal NJ Apartments and Retail Sell in 1031 Exchange,Disposition / Exit,Apartment,Apartment,New York,New York,New York,Unknown,Unknown,Unknown,Unknown,Unknown,Unknown,Unknown,New York,,$19.35; $19.35; $18 million,,,,,,,,,,56,Monitor,Underwriting benchmark,Coastal NJ Apartments and Retail Sell in 1031 Exchange,Connect CRE Apartments,https://www.connectcre.com/stories/coastal-nj-apartments-and-retail-sell-in-1031-exchange/,86,DFP-6CB6AB2006,65,Disposition / Exit - Disposition / Exit - New York - Coastal NJ Apartments and Retail Sell in 1031 Exchange,Disposition / Exit - Unknown - New York,DCL-20260528-032,1
2026-05-28,20260528-230155-27f9735b,PRJ-20260528-0119,Disposition / Exit - Sun Belt - Institutional Property Advisors Brokers Southeast Phoenix Multifamily Asset Sale,80,2026-05-28 23:01:55,General Project Signal - Sun Belt - Empire Group Starts Work on $170M Phoenix Apartment Tower,General Project Signal,Apartment,Apartment,Sun Belt,Phoenix,Sun Belt,Unknown,Unknown,Unknown,Unknown,Unknown,Unknown,Unknown,Sun Belt,,$170M; $170M; $131.2 million,$131.2 million,,$170m,,,,,,,55,Monitor,Capital market signal,Empire Group Starts Work on $170M Phoenix Apartment Tower,Connect CRE Phoenix,https://www.connectcre.com/stories/empire-group-starts-work-on-170m-phoenix-apartment-tower/,100,DFP-FB9C628FF2,65,General Project Signal - General Project Signal - Sun Belt - Empire Group Starts Work on $170M Phoenix Apartment Tower,General Project Signal - Unknown - Sun Belt,DCL-20260528-033,1
2026-05-28,20260528-230155-27f9735b,PRJ-20260528-0088,Construction Financing - Sun Belt - Alta Developers Lands $91.8M Construction Loan for Miami Apartments,80,2026-05-28 23:01:55,Disposition / Exit - Sun Belt - Grand Peaks Sells Miami-Area Apartments for $65.5M,Disposition / Exit,Apartment,Apartment,Sun Belt,Miami,Sun Belt,Unknown,Unknown,Unknown,Unknown,Unknown,Unknown,Unknown,Sun Belt,,$65.5M; $65.5M; $65.5 million,,,,,,,,,,54,Monitor,Underwriting benchmark,Grand Peaks Sells Miami-Area Apartments for $65.5M,Connect CRE South Florida,https://www.connectcre.com/stories/grand-peaks-sells-miami-area-apartments-for-65-5m/,80,DFP-996C9E64B4,65,Disposition / Exit - Disposition / Exit - Sun Belt - Grand Peaks Sells Miami-Area Apartments for $65.5M,Disposition / Exit - Unknown - Sun Belt,DCL-20260528-034,1
2026-05-28,20260528-230155-27f9735b,PRJ-20260528-0088,Construction Financing - Sun Belt - Alta Developers Lands $91.8M Construction Loan for Miami Apartments,80,2026-05-28 23:01:55,Acquisition - Sun Belt - Miami Apartments Trade for $109.9M,Acquisition,Apartment,Apartment,Sun Belt,Miami,Sun Belt,Unknown,Unknown,Unknown,Unknown,Unknown,Unknown,Unknown,Sun Belt,,$109.9M; $109.9M; $110 million,,$110 million,,,,,,broke ground,,51,Monitor,Pricing benchmark,Miami Apartments Trade for $109.9M,Connect CRE South Florida,https://www.connectcre.com/stories/miami-apartments-trade-for-109-9m/,61,DFP-C2F4DF8322,65,Acquisition - Acquisition - Sun Belt - Miami Apartments Trade for $109.9M,Acquisition - Unknown - Sun Belt,DCL-20260528-035,1
2026-05-28,20260528-230155-27f9735b,PRJ-20260528-0045,Entitlement / Permitting - Sun Belt - Cambridge Properties Bringing New Life to Aging Charlotte Center,80,2026-05-28 23:01:55,General Project Signal - Sun Belt - Insignia Pursuing Embassy Row Redevelopment,General Project Signal,Apartment,Apartment,Sun Belt,Atlanta,Sun Belt,Unknown,Unknown,Unknown,Unknown,Unknown,Unknown,Unknown,Sun Belt,"1,068 apartments",,,,,,,,,,,51,Monitor,Underwriting benchmark,Insignia Pursuing Embassy Row Redevelopment,Connect CRE Atlanta,https://www.connectcre.com/stories/insignia-pursuing-embassy-row-redevelopment/,89,DFP-FB3F20D8F2,65,General Project Signal - General Project Signal - Sun Belt - Insignia Pursuing Embassy Row Redevelopment,General Project Signal - Unknown - Sun Belt,DCL-20260528-036,1
2026-05-28,20260528-230155-27f9735b,PRJ-20260528-0116,Office-to-Residential Conversion - Other / Unknown - Milwaukee Office-to-Multifamily Redevelopment Conversion Project Secures $114M Rehabilitat...,80,2026-05-28 23:01:55,Office-to-Residential Conversion - Other / Unknown - Milwaukee Office-to-Multifamily Redevelopment Conversion Project Secures $114M Rehabilitat...,Office-to-Residential Conversion,Office-to-Residential,Multifamily,Other / Unknown,Unknown,Unknown,Unknown,Unknown,Unknown,Unknown,Unknown,Unknown,Unknown,Other / Unknown,,$114M; $114 million; $16.6 million,$114M,,,,,,,,,51,Monitor,Capital market signal,Milwaukee Office-to-Multifamily Redevelopment Conversion Project Secures $114M Rehabilitation Loan,Yield PRO,https://yieldpro.com/2026/05/100-east-wisconsin/,99,DFP-C37AE5CA0C,55,Office-to-Residential Conversion - Office-to-Residential Conversion - Other / Unknown - Milwaukee Office-to-Multifamily Redevelopment Conversion Project Secures $114M Rehabilitat...,Office-to-Residential Conversion - Unknown - Other / Unknown,DCL-20260528-037,1
2026-05-28,20260528-230155-27f9735b,PRJ-20260528-0116,Office-to-Residential Conversion - Other / Unknown - Milwaukee Office-to-Multifamily Redevelopment Conversion Project Secures $114M Rehabilitat...,80,2026-05-28 23:01:55,Office-to-Residential Conversion - Other / Unknown - Dwight Capital Finances $114M Multifamily HUD Loan in Wisconsin,Office-to-Residential Conversion,Office-to-Residential,Apartment,Other / Unknown,Unknown,Unknown,Unknown,Unknown,Unknown,Unknown,Unknown,Unknown,Unknown,Other / Unknown,,$114M; $114M; $114 million,$114M,,,,,,,,,50,Monitor,Capital market signal,Dwight Capital Finances $114M Multifamily HUD Loan in Wisconsin,Connect CRE Apartments,https://www.connectcre.com/stories/dwight-capital-finances-114m-multifamily-hud-loan-in-wisconsin/,97,DFP-6EC5EE9400,55,Office-to-Residential Conversion - Office-to-Residential Conversion - Other / Unknown - Dwight Capital Finances $114M Multifamily HUD Loan in Wisconsin,Office-to-Residential Conversion - Unknown - Other / Unknown,DCL-20260528-038,1
2026-05-28,20260528-230155-27f9735b,PRJ-20260528-0081,Modular / Construction Innovation - Los Angeles - Modular housing manufacturing proposed for city-owned site at 10901 S. Clovis St. in South...,80,2026-05-28 23:01:55,General Project Signal - Los Angeles - Renderings revealed: Arts District towers at 2143 E. Violet Street,General Project Signal,Mixed-Use Residential,Affordable Housing,Los Angeles,Los Angeles,California,Unknown,Unknown,Unknown,Unknown,Unknown,Unknown,Unknown,Los Angeles,77 units,,,,,,,,,,,49,Monitor,Entitlement / zoning watch,Renderings revealed: Arts District towers at 2143 E. Violet Street,Urbanize LA,https://la.urbanize.city/post/renderings-revealed-arts-district-towers-2143-e-violet-street,61,DFP-771DCE4EC1,65,General Project Signal - General Project Signal - Los Angeles - Renderings revealed: Arts District towers at 2143 E. Violet Street,General Project Signal - Unknown - Los Angeles,DCL-20260528-039,1
2026-05-28,20260528-230155-27f9735b,PRJ-20260528-0116,Office-to-Residential Conversion - Other / Unknown - Milwaukee Office-to-Multifamily Redevelopment Conversion Project Secures $114M Rehabilitat...,80,2026-05-28 23:01:55,"JV / Partnership - Other / Unknown - Scion Group, Ares Management Corp. partner for $910M student housing buy",JV / Partnership,Student Housing,Student Housing,Other / Unknown,Unknown,Unknown,Unknown,Unknown,ares,Unknown,Unknown,ares,ares,Other / Unknown,,$910M; $910M; $910m,,,,,,,,,,48,Monitor,GP partnership reference,"Scion Group, Ares Management Corp. partner for $910M student housing buy",Multifamily Dive,https://www.multifamilydive.com/news/scion-ares-management-student-housing-buy/821123/,57,DFP-8510FE41CD,55,"JV / Partnership - JV / Partnership - Other / Unknown - Scion Group, Ares Management Corp. partner for $910M student housing buy",JV / Partnership - Unknown - Other / Unknown,DCL-20260528-040,1
2026-05-28,20260528-230155-27f9735b,PRJ-20260528-0081,Modular / Construction Innovation - Los Angeles - Modular housing manufacturing proposed for city-owned site at 10901 S. Clovis St. in South...,80,2026-05-28 23:01:55,Modular / Construction Innovation - Los Angeles - Modular housing manufacturing proposed for city-owned site at 10901 S. Clovis St. in South...,Modular / Construction Innovation,Unknown Residential,Affordable Housing,Los Angeles,Los Angeles,California,Unknown,Unknown,Unknown,Unknown,Unknown,Unknown,Unknown,Los Angeles,,,,,,,,,,,,47,Monitor,Entitlement / zoning watch,Modular housing manufacturing proposed for city-owned site at 10901 S. Clovis St. in South LA,Urbanize LA,https://la.urbanize.city/post/modular-housing-manufacturing-proposed-city-owned-site-10901-s-clovis-st-south-la,67,DFP-A3E6D451C9,55,Modular / Construction Innovation - Modular / Construction Innovation - Los Angeles - Modular housing manufacturing proposed for city-owned site at 10901 S. Clovis St. in South...,Modular / Construction Innovation - Unknown - Los Angeles,DCL-20260528-041,1
2026-05-28,20260528-230155-27f9735b,PRJ-20260528-0119,Disposition / Exit - Sun Belt - Institutional Property Advisors Brokers Southeast Phoenix Multifamily Asset Sale,80,2026-05-28 23:01:55,BTR / Build-to-Rent - Sun Belt - Work Begins on 94-Unit Scottsdale Luxury BTR Community,BTR / Build-to-Rent,BTR / Single-Family Rental,BTR / Single-Family Rental,Sun Belt,Phoenix,Sun Belt,Unknown,Unknown,Unknown,Unknown,Unknown,Unknown,Unknown,Sun Belt,,,,,,,,,,,,46,Monitor,Pipeline / supply signal,Work Begins on 94-Unit Scottsdale Luxury BTR Community,Connect CRE Phoenix,https://www.connectcre.com/stories/work-begins-on-94-unit-luxury-btr-community/,85,DFP-546EFB363D,55,BTR / Build-to-Rent - BTR / Build-to-Rent - Sun Belt - Work Begins on 94-Unit Scottsdale Luxury BTR Community,BTR / Build-to-Rent - Unknown - Sun Belt,DCL-20260528-042,1
2026-05-28,20260528-230155-27f9735b,PRJ-20260528-0045,Entitlement / Permitting - Sun Belt - Cambridge Properties Bringing New Life to Aging Charlotte Center,80,2026-05-28 23:01:55,Entitlement / Permitting - Sun Belt - Cambridge Properties Bringing New Life to Aging Charlotte Center,Entitlement / Permitting,Apartment,Apartment,Sun Belt,Atlanta,Sun Belt,Unknown,Unknown,Unknown,Unknown,Unknown,Unknown,Unknown,Sun Belt,,,,,,,,,,,permit,44,Monitor,Entitlement / zoning watch,Cambridge Properties Bringing New Life to Aging Charlotte Center,Connect CRE Charlotte,https://www.connectcre.com/stories/cambridge-properties-bringing-new-life-to-aging-center/,70,DFP-F59A9F56DA,55,Entitlement / Permitting - Entitlement / Permitting - Sun Belt - Cambridge Properties Bringing New Life to Aging Charlotte Center,Entitlement / Permitting - Unknown - Sun Belt,DCL-20260528-043,1
2026-05-28,20260528-230155-27f9735b,PRJ-20260528-0127,Office-to-Residential Conversion - Southeast - JBG Smith Begins Office-to-Residential Conversion Project in Metro D.C.,80,2026-05-28 23:01:55,Office-to-Residential Conversion - Southeast - JBG Smith Begins Office-to-Residential Conversion Project in Metro D.C.,Office-to-Residential Conversion,Office-to-Residential,Office-to-Residential Conversion,Southeast,Southeast,Southeast,Unknown,Unknown,Unknown,Unknown,Unknown,Unknown,Unknown,Southeast,,,,,,,,,,,,44,Monitor,Construction strategy reference,JBG Smith Begins Office-to-Residential Conversion Project in Metro D.C.,REBusiness Online,https://rebusinessonline.com/jbg-smith-begins-office-to-residential-conversion-project-in-metro-d-c/,79,DFP-3B0F08460B,55,Office-to-Residential Conversion - Office-to-Residential Conversion - Southeast - JBG Smith Begins Office-to-Residential Conversion Project in Metro D.C.,Office-to-Residential Conversion - Unknown - Southeast,DCL-20260528-044,1
2026-05-28,20260528-230155-27f9735b,PRJ-20260528-0045,Entitlement / Permitting - Sun Belt - Cambridge Properties Bringing New Life to Aging Charlotte Center,80,2026-05-28 23:01:55,Refinancing - Sun Belt - Georgia Tech Student Housing Investors Ink Refi,Refinancing,Student Housing,Student Housing,Sun Belt,Atlanta,Sun Belt,Unknown,Unknown,Unknown,Unknown,Unknown,Unknown,Unknown,Sun Belt,,,,,,,,,,,,44,Monitor,Capital market signal,Georgia Tech Student Housing Investors Ink Refi,Connect CRE Atlanta,https://www.connectcre.com/stories/georgia-tech-student-housing-investors-ink-refi/,68,DFP-8A2A84B303,55,Refinancing - Refinancing - Sun Belt - Georgia Tech Student Housing Investors Ink Refi,Refinancing - Unknown - Sun Belt,DCL-20260528-045,1
2026-05-28,20260528-230155-27f9735b,PRJ-20260528-0064,Disposition / Exit - Sun Belt - Institutional Property Advisors Closes Sale and Arranges Financing for a 458-Unit Multifam...,80,2026-05-28 23:01:55,Disposition / Exit - Sun Belt - Institutional Property Advisors Closes Sale and Arranges Financing for a 458-Unit Multifam...,Disposition / Exit,Multifamily,Multifamily,Sun Belt,Dallas,Sun Belt,Unknown,Unknown,Unknown,Unknown,Unknown,Unknown,Unknown,Sun Belt,,,,,,,,,,,,43,Monitor,Monitor only,Institutional Property Advisors Closes Sale and Arranges Financing for a 458-Unit Multifamily Property in Suburban Dallas,Yield PRO,https://yieldpro.com/2026/05/reserve-at-spring-creek/,77,DFP-F22DE23F69,55,Disposition / Exit - Disposition / Exit - Sun Belt - Institutional Property Advisors Closes Sale and Arranges Financing for a 458-Unit Multifam...,Disposition / Exit - Unknown - Sun Belt,DCL-20260528-046,1
2026-05-28,20260528-230155-27f9735b,PRJ-20260528-0123,Acquisition - Seattle - TMR Investments Acquires Multifamily Property VIVE Apartments in Seattle’s Ballard Neighbo...,80,2026-05-28 23:01:55,Acquisition - Seattle - TMR Investments Acquires Multifamily Property VIVE Apartments in Seattle’s Ballard Neighbo...,Acquisition,Apartment,Apartment,Seattle,Seattle,Seattle,Unknown,Unknown,Unknown,Unknown,Unknown,Unknown,Unknown,Seattle,,,,,,,,,,,,42,Monitor,Monitor only,TMR Investments Acquires Multifamily Property VIVE Apartments in Seattle’s Ballard Neighborhood,Yield PRO,https://yieldpro.com/2026/05/vive-apartments/,62,DFP-0992947F47,55,Acquisition - Acquisition - Seattle - TMR Investments Acquires Multifamily Property VIVE Apartments in Seattle’s Ballard Neighbo...,Acquisition - Unknown - Seattle,DCL-20260528-047,1
2026-05-28,20260528-230155-27f9735b,PRJ-20260528-0116,Office-to-Residential Conversion - Other / Unknown - Milwaukee Office-to-Multifamily Redevelopment Conversion Project Secures $114M Rehabilitat...,80,2026-05-28 23:01:55,Development Start - Other / Unknown - Missing Middle Weakness,Development Start,Apartment,Apartment,Other / Unknown,Unknown,Unknown,Unknown,Unknown,Unknown,Unknown,Unknown,Unknown,Unknown,Other / Unknown,,,,,,,,,,,,41,Monitor,Pipeline / supply signal,Missing Middle Weakness,NAHB Eye on Housing - Multifamily,https://eyeonhousing.org/2026/01/missing-middle-weakness/,88,DFP-2F6D8F65F6,45,Development Start - Development Start - Other / Unknown - Missing Middle Weakness,Development Start - Unknown - Other / Unknown,DCL-20260528-048,1
2026-05-28,20260528-230155-27f9735b,PRJ-20260528-0147,Development Start - National - Multifamily starts rose again in April,80,2026-05-28 23:01:55,Development Start - National - Multifamily starts rose again in April,Development Start,Apartment,Apartment,National,U.S.,Unknown,Unknown,Unknown,Unknown,Unknown,Unknown,Unknown,Unknown,National,,,,,,,,,,,,40,Monitor,Pipeline / supply signal,Multifamily starts rose again in April,Multifamily Dive,https://www.multifamilydive.com/news/multifamily-starts-april-hud-census/820982/,86,DFP-C050CB07F0,55,Development Start - Development Start - National - Multifamily starts rose again in April,Development Start - Unknown - National,DCL-20260528-049,1
2026-05-28,20260528-230155-27f9735b,PRJ-20260528-0116,Office-to-Residential Conversion - Other / Unknown - Milwaukee Office-to-Multifamily Redevelopment Conversion Project Secures $114M Rehabilitat...,80,2026-05-28 23:01:55,General Project Signal - Other / Unknown - Colibri Commons Affordable Housing Opens in East Palo Alto,General Project Signal,Affordable Housing,Affordable Housing,Other / Unknown,Unknown,Unknown,Unknown,Unknown,Unknown,Unknown,Unknown,Unknown,Unknown,Other / Unknown,136 apartments,,,,,,,,,,,39,Low Detail Signal,Underwriting benchmark,Colibri Commons Affordable Housing Opens in East Palo Alto,SF YIMBY,https://sfyimby.com/2026/05/colibri-commons-affordable-housing-opens-in-east-palo-alto.html,82,DFP-51A9A06C3F,55,General Project Signal - General Project Signal - Other / Unknown - Colibri Commons Affordable Housing Opens in East Palo Alto,General Project Signal - Unknown - Other / Unknown,DCL-20260528-050,1
2026-05-28,20260528-230155-27f9735b,PRJ-20260528-0119,Disposition / Exit - Sun Belt - Institutional Property Advisors Brokers Southeast Phoenix Multifamily Asset Sale,80,2026-05-28 23:01:55,Disposition / Exit - Sun Belt - Institutional Property Advisors Brokers Southeast Phoenix Multifamily Asset Sale,Disposition / Exit,Multifamily,Multifamily,Sun Belt,Phoenix,Sun Belt,Unknown,Unknown,Unknown,Unknown,Unknown,Unknown,Unknown,Sun Belt,,,,,,,,,,,,38,Low Detail Signal,Monitor only,Institutional Property Advisors Brokers Southeast Phoenix Multifamily Asset Sale,Yield PRO,https://yieldpro.com/2026/05/alta-rise/,62,DFP-4B041CC0FC,55,Disposition / Exit - Disposition / Exit - Sun Belt - Institutional Property Advisors Brokers Southeast Phoenix Multifamily Asset Sale,Disposition / Exit - Unknown - Sun Belt,DCL-20260528-051,1
2026-05-28,20260528-230155-27f9735b,PRJ-20260528-0116,Office-to-Residential Conversion - Other / Unknown - Milwaukee Office-to-Multifamily Redevelopment Conversion Project Secures $114M Rehabilitat...,80,2026-05-28 23:01:55,Disposition / Exit - Other / Unknown - 'Clicking On All Cylinders': Chicago Multifamily Sales Up 117%,Disposition / Exit,Multifamily,Multifamily,Other / Unknown,Unknown,Unknown,Unknown,Unknown,Unknown,Unknown,Unknown,Unknown,Unknown,Other / Unknown,,$4B; $1.9B; $4b,,,,,,,,start in 2026,,37,Low Detail Signal,Underwriting benchmark,'Clicking On All Cylinders': Chicago Multifamily Sales Up 117%,Bisnow,https://www.bisnow.com/chicago/news/multifamily/chicago-multifamily-investment-sales-up-116-year-over-year-134731,59,DFP-2494399CF2,55,Disposition / Exit - Disposition / Exit - Other / Unknown - 'Clicking On All Cylinders': Chicago Multifamily Sales Up 117%,Disposition / Exit - Unknown - Other / Unknown,DCL-20260528-052,1
2026-05-28,20260528-230155-27f9735b,PRJ-20260528-0116,Office-to-Residential Conversion - Other / Unknown - Milwaukee Office-to-Multifamily Redevelopment Conversion Project Secures $114M Rehabilitat...,80,2026-05-28 23:01:55,Entitlement / Permitting - Other / Unknown - Shorter Apartment Construction Time in 2024,Entitlement / Permitting,Apartment,Apartment,Other / Unknown,Unknown,Unknown,Unknown,Unknown,Unknown,Unknown,Unknown,Unknown,Unknown,Other / Unknown,,,,,,,,,,,permit,37,Low Detail Signal,Entitlement / zoning watch,Shorter Apartment Construction Time in 2024,NAHB Eye on Housing - Multifamily,https://eyeonhousing.org/2025/10/shorter-apartment-construction-time-in-2024/,76,DFP-57A3A9A4F0,45,Entitlement / Permitting - Entitlement / Permitting - Other / Unknown - Shorter Apartment Construction Time in 2024,Entitlement / Permitting - Unknown - Other / Unknown,DCL-20260528-053,1
2026-05-28,20260528-230155-27f9735b,PRJ-20260528-0116,Office-to-Residential Conversion - Other / Unknown - Milwaukee Office-to-Multifamily Redevelopment Conversion Project Secures $114M Rehabilitat...,80,2026-05-28 23:01:55,Entitlement / Permitting - Other / Unknown - Builders Stay Cautious as Single-Family Permits Weaken,Entitlement / Permitting,Multifamily,Multifamily,Other / Unknown,Unknown,Unknown,Unknown,Unknown,Unknown,Unknown,Unknown,Unknown,Unknown,Other / Unknown,,,,,,,,,,,permitting,33,Low Detail Signal,Entitlement / zoning watch,Builders Stay Cautious as Single-Family Permits Weaken,NAHB Eye on Housing - Multifamily,https://eyeonhousing.org/2025/10/builders-stay-cautious-as-single-family-permits-weaken/,66,DFP-C96F67339E,45,Entitlement / Permitting - Entitlement / Permitting - Other / Unknown - Builders Stay Cautious as Single-Family Permits Weaken,Entitlement / Permitting - Unknown - Other / Unknown,DCL-20260528-054,1
2026-05-28,20260528-230155-27f9735b,PRJ-20260528-0116,Office-to-Residential Conversion - Other / Unknown - Milwaukee Office-to-Multifamily Redevelopment Conversion Project Secures $114M Rehabilitat...,80,2026-05-28 23:01:55,Development Start - Other / Unknown - First Quarter 2026 Multifamily Construction Data,Development Start,Multifamily,Multifamily,Other / Unknown,Unknown,Unknown,Unknown,Unknown,Unknown,Unknown,Unknown,Unknown,Unknown,Other / Unknown,,,,,,,,,,,,32,Low Detail Signal,Pipeline / supply signal,First Quarter 2026 Multifamily Construction Data,NAHB Eye on Housing - Multifamily,https://eyeonhousing.org/2026/05/first-quarter-2026-multifamily-construction-data/,63,DFP-53DEBBEA0C,45,Development Start - Development Start - Other / Unknown - First Quarter 2026 Multifamily Construction Data,Development Start - Unknown - Other / Unknown,DCL-20260528-055,1
