run_date,run_id,run_timestamp,regime,raw_score,normalized_score,final_score,strength_label,supporting_signals,interpretation
2026-05-28,20260528-230155-27f9735b,2026-05-28 23:01:55,Selective Capital Re-entry,134,89,89,Very Strong,Institutional Flow articles: 19; Deal Size Signal articles: 5; Institutional player mentions: 10,"Institutional flow, deal-size, or major-player activity suggests capital-market re-engagement."
2026-05-28,20260528-230155-27f9735b,2026-05-28 23:01:55,Supply Pressure,130,87,87,Very Strong,Supply Pressure articles: 5; Supply/vacancy/concession signals: 8; Supply matched-keyword articles: 6,"Supply, starts, deliveries, lease-up, vacancy, or concession signals are visible."
2026-05-28,20260528-230155-27f9735b,2026-05-28 23:01:55,Financing Stress,121,81,81,Very Strong,Financing Risk articles: 24; Financing/cap-rate market signals: 6; Financing matched-keyword articles: 26,"Debt, rates, refinancing, or cap-rate pressure is visible enough to affect underwriting attention."
2026-05-28,20260528-230155-27f9735b,2026-05-28 23:01:55,Policy / Entitlement Watch,100,67,67,Strong,Regulation Risk articles: 6; Policy matched-keyword articles: 8; California / Los Angeles focus count: 16,"Policy, zoning, permitting, entitlement, rent-control, or housing-production signals require monitoring."
2026-05-28,20260528-230155-27f9735b,2026-05-28 23:01:55,Developer Strategy Shift,88,59,59,Moderate,Developer Strategy articles: 35; Developer matched-keyword articles: 13; Must Read articles: 37,"Developer behavior, product strategy, adaptive reuse, BTR, modular, or operating-model signals are visible."
2026-05-28,20260528-230155-27f9735b,2026-05-28 23:01:55,Construction Cost Pressure,4,3,3,Not Detected,Cost Control articles: 0; Construction Cost Signal articles: 0; Cost matched-keyword articles: 1,Construction Cost Pressure is not a meaningful signal in this run.
2026-05-28,20260528-230155-27f9735b,2026-05-28 23:01:55,Stable Monitoring Environment,0,0,0,Not Detected,Highest active regime score before stable adjustment: 134; Monitor articles: 4,Stable Monitoring Environment is not a meaningful signal in this run.
