run_date,run_id,run_timestamp,regime,residential_sector,executive_priority_score,executive_priority_rank,executive_attention_tier,management_message,recommended_owner,recommended_action_timing
2026-05-21,20260521-230148-97d5f8bd,2026-05-21 23:01:48,Financing Stress,Apartment,100,1,Tier 1 Executive Attention,"Debt market pressure should be reviewed because it may affect construction loan sizing, refinancing assumptions, and exit cap rates.",Finance / Treasury; Investment Team; Executive Committee; US Local Team,This Week
2026-05-21,20260521-230148-97d5f8bd,2026-05-21 23:01:48,Policy / Entitlement Watch,Apartment,100,2,Tier 1 Executive Attention,"Policy and entitlement signals should be monitored because they may affect approvals, zoning strategy, and local development feasibility.",Development Team; US Local Team; Strategy Team,This Week
2026-05-21,20260521-230148-97d5f8bd,2026-05-21 23:01:48,Selective Capital Re-entry,Apartment,100,3,Tier 2 Strategic Review,Institutional capital movement should be tracked because it may indicate pricing discovery and partner activity.,Investment Team; Strategy Team; Executive Committee; US Local Team,This Week
2026-05-21,20260521-230148-97d5f8bd,2026-05-21 23:01:48,Supply Pressure,Apartment,100,4,Tier 2 Strategic Review,"Supply and lease-up signals should be monitored because they may affect rent growth, vacancy, and development timing.",Investment Team; Development Team; US Local Team,This Week
2026-05-21,20260521-230148-97d5f8bd,2026-05-21 23:01:48,Developer Strategy Shift,Apartment,98,5,Tier 3 Monitoring,"Developer strategy signals should be reviewed because they may reveal capability needs in product, operations, partnerships, or delivery model.",Strategy Team; Development Team; US Local Team,This Week
2026-05-21,20260521-230148-97d5f8bd,2026-05-21 23:01:48,Construction Cost Pressure,Apartment,48,6,Tier 3 Monitoring,"Construction cost signals should be reviewed because they may affect feasibility, contingencies, and value engineering.",Development Team; Investment Team; US Local Team,Monthly Monitoring
