run_date,run_id,run_timestamp,market,market_entry_score,timing_signal_count,opportunity_count,distress_signal_count,capital_flow_score,financing_stress_score,supply_pressure_score,institutional_activity_score,gp_activity_score,residential_sector_fit,woomi_strategic_fit,market_entry_window_label,recommended_entry_posture,key_entry_risks,key_entry_opportunities
2026-06-01,20260601-230146-450c13c8,2026-06-01 23:01:46,California,81,9,8,4,100,100,45,100,80,90,100,Active Watch Window,Actively source opportunities,"financing stress and refinancing pressure; entitlement, zoning, permitting, and policy uncertainty",active opportunity radar signals; possible distress or recapitalization watch; capital-flow or institutional activity signal; core Woomi California / LA strategic relevance
2026-06-01,20260601-230146-450c13c8,2026-06-01 23:01:46,New York,67,2,2,1,100,55,45,100,49,65,55,Selective Entry Window,Monitor refinancing and distress pipeline,limited timing evidence,active opportunity radar signals; possible distress or recapitalization watch; capital-flow or institutional activity signal
2026-06-01,20260601-230146-450c13c8,2026-06-01 23:01:46,National / Other,41,9,11,0,0,0,100,56,0,80,55,Monitor Only,Prepare GP conversations,"supply, delivery, lease-up, or concession pressure",active opportunity radar signals
2026-06-01,20260601-230146-450c13c8,2026-06-01 23:01:46,Los Angeles,30,0,0,0,100,0,45,100,0,90,100,Monitor Only,Monitor only,"entitlement, zoning, permitting, and policy uncertainty",capital-flow or institutional activity signal; core Woomi California / LA strategic relevance
2026-06-01,20260601-230146-450c13c8,2026-06-01 23:01:46,Florida,29,0,0,0,100,0,45,100,0,80,75,Not Attractive Now,Monitor only,limited timing evidence,capital-flow or institutional activity signal
2026-06-01,20260601-230146-450c13c8,2026-06-01 23:01:46,Sun Belt,29,0,0,0,100,0,45,100,0,80,75,Not Attractive Now,Monitor only,limited timing evidence,capital-flow or institutional activity signal
2026-06-01,20260601-230146-450c13c8,2026-06-01 23:01:46,Seattle,28,0,0,0,100,0,45,100,0,65,75,Not Attractive Now,Monitor only,limited timing evidence,capital-flow or institutional activity signal
2026-06-01,20260601-230146-450c13c8,2026-06-01 23:01:46,Texas,25,0,0,0,82,0,45,82,0,80,75,Not Attractive Now,Monitor only,limited timing evidence,capital-flow or institutional activity signal
