run_date,run_id,run_timestamp,regime,raw_score,normalized_score,final_score,strength_label,supporting_signals,interpretation
2026-06-16,20260616-014320-175168dd,2026-06-16 01:43:20,Selective Capital Re-entry,134,89,89,Very Strong,Institutional Flow articles: 17; Deal Size Signal articles: 10; Institutional player mentions: 9,"Institutional flow, deal-size, or major-player activity suggests capital-market re-engagement."
2026-06-16,20260616-014320-175168dd,2026-06-16 01:43:20,Financing Stress,103,69,69,Strong,Financing Risk articles: 16; Financing/cap-rate market signals: 1; Financing matched-keyword articles: 12,"Debt, rates, refinancing, or cap-rate pressure is visible enough to affect underwriting attention."
2026-06-16,20260616-014320-175168dd,2026-06-16 01:43:20,Developer Strategy Shift,88,59,59,Moderate,Developer Strategy articles: 37; Developer matched-keyword articles: 15; Must Read articles: 31,"Developer behavior, product strategy, adaptive reuse, BTR, modular, or operating-model signals are visible."
2026-06-16,20260616-014320-175168dd,2026-06-16 01:43:20,Policy / Entitlement Watch,83,55,55,Moderate,Regulation Risk articles: 3; Policy matched-keyword articles: 8; California / Los Angeles focus count: 5,"Policy, zoning, permitting, entitlement, rent-control, or housing-production signals require monitoring."
2026-06-16,20260616-014320-175168dd,2026-06-16 01:43:20,Supply Pressure,44,29,29,Weak,Supply Pressure articles: 0; Supply/vacancy/concession signals: 8; Supply matched-keyword articles: 0,"Supply, starts, deliveries, lease-up, vacancy, or concession signals are visible."
2026-06-16,20260616-014320-175168dd,2026-06-16 01:43:20,Construction Cost Pressure,38,25,25,Weak,Cost Control articles: 2; Construction Cost Signal articles: 0; Cost matched-keyword articles: 1,"Cost-control, labor, materials, or construction pricing signals may affect project feasibility."
2026-06-16,20260616-014320-175168dd,2026-06-16 01:43:20,Stable Monitoring Environment,0,0,0,Not Detected,Highest active regime score before stable adjustment: 134; Monitor articles: 6,Stable Monitoring Environment is not a meaningful signal in this run.
