run_date,run_id,run_timestamp,regime,raw_score,normalized_score,final_score,strength_label,supporting_signals,interpretation
2026-07-18,20260718-235559-a40a5f93,2026-07-18 23:55:59,Selective Capital Re-entry,134,89,89,Very Strong,Institutional Flow articles: 24; Deal Size Signal articles: 9; Institutional player mentions: 12,"Institutional flow, deal-size, or major-player activity suggests capital-market re-engagement."
2026-07-18,20260718-235559-a40a5f93,2026-07-18 23:55:59,Supply Pressure,123,82,82,Very Strong,Supply Pressure articles: 5; Supply/vacancy/concession signals: 10; Supply matched-keyword articles: 6,"Supply, starts, deliveries, lease-up, vacancy, or concession signals are visible."
2026-07-18,20260718-235559-a40a5f93,2026-07-18 23:55:59,Financing Stress,121,81,81,Very Strong,Financing Risk articles: 22; Financing/cap-rate market signals: 4; Financing matched-keyword articles: 22,"Debt, rates, refinancing, or cap-rate pressure is visible enough to affect underwriting attention."
2026-07-18,20260718-235559-a40a5f93,2026-07-18 23:55:59,Policy / Entitlement Watch,94,63,63,Strong,Regulation Risk articles: 7; Policy matched-keyword articles: 11; California / Los Angeles focus count: 2,"Policy, zoning, permitting, entitlement, rent-control, or housing-production signals require monitoring."
2026-07-18,20260718-235559-a40a5f93,2026-07-18 23:55:59,Developer Strategy Shift,88,59,59,Moderate,Developer Strategy articles: 38; Developer matched-keyword articles: 9; Must Read articles: 42,"Developer behavior, product strategy, adaptive reuse, BTR, modular, or operating-model signals are visible."
2026-07-18,20260718-235559-a40a5f93,2026-07-18 23:55:59,Construction Cost Pressure,21,14,14,Not Detected,Cost Control articles: 1; Construction Cost Signal articles: 0; Cost matched-keyword articles: 1,Construction Cost Pressure is not a meaningful signal in this run.
2026-07-18,20260718-235559-a40a5f93,2026-07-18 23:55:59,Stable Monitoring Environment,0,0,0,Not Detected,Highest active regime score before stable adjustment: 134; Monitor articles: 1,Stable Monitoring Environment is not a meaningful signal in this run.
