run_date,run_id,run_timestamp,regime,raw_score,normalized_score,final_score,strength_label,supporting_signals,interpretation
2026-06-02,20260602-010310-89150adf,2026-06-02 01:03:10,Selective Capital Re-entry,134,89,89,Very Strong,Institutional Flow articles: 18; Deal Size Signal articles: 6; Institutional player mentions: 6,"Institutional flow, deal-size, or major-player activity suggests capital-market re-engagement."
2026-06-02,20260602-010310-89150adf,2026-06-02 01:03:10,Financing Stress,103,69,69,Strong,Financing Risk articles: 14; Financing/cap-rate market signals: 1; Financing matched-keyword articles: 11,"Debt, rates, refinancing, or cap-rate pressure is visible enough to affect underwriting attention."
2026-06-02,20260602-010310-89150adf,2026-06-02 01:03:10,Policy / Entitlement Watch,100,67,67,Strong,Regulation Risk articles: 7; Policy matched-keyword articles: 9; California / Los Angeles focus count: 4,"Policy, zoning, permitting, entitlement, rent-control, or housing-production signals require monitoring."
2026-06-02,20260602-010310-89150adf,2026-06-02 01:03:10,Supply Pressure,95,63,63,Strong,Supply Pressure articles: 3; Supply/vacancy/concession signals: 6; Supply matched-keyword articles: 3,"Supply, starts, deliveries, lease-up, vacancy, or concession signals are visible."
2026-06-02,20260602-010310-89150adf,2026-06-02 01:03:10,Developer Strategy Shift,88,59,59,Moderate,Developer Strategy articles: 27; Developer matched-keyword articles: 8; Must Read articles: 27,"Developer behavior, product strategy, adaptive reuse, BTR, modular, or operating-model signals are visible."
2026-06-02,20260602-010310-89150adf,2026-06-02 01:03:10,Construction Cost Pressure,8,5,5,Not Detected,Cost Control articles: 0; Construction Cost Signal articles: 0; Cost matched-keyword articles: 2,Construction Cost Pressure is not a meaningful signal in this run.
2026-06-02,20260602-010310-89150adf,2026-06-02 01:03:10,Stable Monitoring Environment,0,0,0,Not Detected,Highest active regime score before stable adjustment: 134; Monitor articles: 3,Stable Monitoring Environment is not a meaningful signal in this run.
