run_date,run_id,run_timestamp,regime,raw_score,normalized_score,final_score,strength_label,supporting_signals,interpretation
2026-05-25,20260525-230212-45b2fe12,2026-05-25 23:02:12,Selective Capital Re-entry,134,89,89,Very Strong,Institutional Flow articles: 19; Deal Size Signal articles: 10; Institutional player mentions: 17,"Institutional flow, deal-size, or major-player activity suggests capital-market re-engagement."
2026-05-25,20260525-230212-45b2fe12,2026-05-25 23:02:12,Supply Pressure,127,85,85,Very Strong,Supply Pressure articles: 5; Supply/vacancy/concession signals: 5; Supply matched-keyword articles: 5,"Supply, starts, deliveries, lease-up, vacancy, or concession signals are visible."
2026-05-25,20260525-230212-45b2fe12,2026-05-25 23:02:12,Financing Stress,121,81,81,Very Strong,Financing Risk articles: 20; Financing/cap-rate market signals: 5; Financing matched-keyword articles: 21,"Debt, rates, refinancing, or cap-rate pressure is visible enough to affect underwriting attention."
2026-05-25,20260525-230212-45b2fe12,2026-05-25 23:02:12,Policy / Entitlement Watch,100,67,67,Strong,Regulation Risk articles: 6; Policy matched-keyword articles: 10; California / Los Angeles focus count: 14,"Policy, zoning, permitting, entitlement, rent-control, or housing-production signals require monitoring."
2026-05-25,20260525-230212-45b2fe12,2026-05-25 23:02:12,Developer Strategy Shift,88,59,59,Moderate,Developer Strategy articles: 37; Developer matched-keyword articles: 21; Must Read articles: 39,"Developer behavior, product strategy, adaptive reuse, BTR, modular, or operating-model signals are visible."
2026-05-25,20260525-230212-45b2fe12,2026-05-25 23:02:12,Construction Cost Pressure,37,25,25,Weak,Cost Control articles: 1; Construction Cost Signal articles: 0; Cost matched-keyword articles: 5,"Cost-control, labor, materials, or construction pricing signals may affect project feasibility."
2026-05-25,20260525-230212-45b2fe12,2026-05-25 23:02:12,Stable Monitoring Environment,0,0,0,Not Detected,Highest active regime score before stable adjustment: 134; Monitor articles: 6,Stable Monitoring Environment is not a meaningful signal in this run.
