run_date,run_id,run_timestamp,deal_fingerprint_id,duplicate_cluster_id,fingerprint_confidence,canonical_project_name,canonical_deal_name,canonical_event_name,deal_type,market,residential_sector,canonical_gp_or_developer,canonical_lender_or_debt_provider,unit_count,dollar_amount,loan_amount,source_count,article_count,duplicate_count,sources,article_titles,markets_detected,highest_deal_signal_score
2026-07-07,20260707-000948-c1f40a65,2026-07-07 00:09:48,DFP-BB73BB97D4,DCL-20260707-002,90,Disposition / Exit - California - Yorba Linda Parking Lot Sells for Townhome Redevelopment,Disposition / Exit - Disposition / Exit - California - Yorba Linda Parking Lot Sells for Townhome Redevelopment,Disposition / Exit - CBRE - California,Disposition / Exit,California,Apartment,CBRE,CBRE,,$8.12; $8.12,,1,1,1,Connect CRE Orange County,Yorba Linda Parking Lot Sells for Townhome Redevelopment,California,89
2026-07-07,20260707-000948-c1f40a65,2026-07-07 00:09:48,DFP-5508FCE9F0,DCL-20260707-009,90,Disposition / Exit - California - Former Bank Branch Positioned as Development Opportunity in Garden Grove Sale,Disposition / Exit - Disposition / Exit - California - Former Bank Branch Positioned as Development Opportunity in Garden Grove Sale,Disposition / Exit - CBRE - California,Disposition / Exit,California,General Residential,CBRE,CBRE,,$11 million; $1; $11 million,,1,1,1,Connect CRE Orange County,Former Bank Branch Positioned as Development Opportunity in Garden Grove Sale,California,74
2026-07-07,20260707-000948-c1f40a65,2026-07-07 00:09:48,DFP-EF88F65E96,DCL-20260707-004,90,Disposition / Exit - Seattle - CBRE Arranges $24M Sale of 87-UnitMultiffamily Apartment Property in Seattle,Disposition / Exit - Disposition / Exit - Seattle - CBRE Arranges $24M Sale of 87-UnitMultiffamily Apartment Property in Seattle,Disposition / Exit - CBRE - Seattle,Disposition / Exit,Seattle,Apartment,CBRE,CBRE,,$24M; $24.1 million; $24m,$24m,1,1,1,Yield PRO,CBRE Arranges $24M Sale of 87-UnitMultiffamily Apartment Property in Seattle,Seattle,81
2026-07-07,20260707-000948-c1f40a65,2026-07-07 00:09:48,DFP-C9AF8EBD2C,DCL-20260707-003,90,General Project Signal - California - Northmarq Secures Fannie Mae DUS Financing for National City Apartments,General Project Signal - General Project Signal - California - Northmarq Secures Fannie Mae DUS Financing for National City Apartments,General Project Signal - Fannie Mae - California,General Project Signal,California,Apartment,Fannie Mae,Fannie Mae,,$13.275 million; $13.275 million,$13.275 million,1,1,1,Connect CRE California,Northmarq Secures Fannie Mae DUS Financing for National City Apartments,California,83
2026-07-07,20260707-000948-c1f40a65,2026-07-07 00:09:48,DFP-04852D3CF0,DCL-20260707-001,90,Refinancing - California - KIRE Group Receives $13.3M Loan for Refinancing of Multifamily Property Near San Diego,Refinancing - Refinancing - California - KIRE Group Receives $13.3M Loan for Refinancing of Multifamily Property Near San Diego,Refinancing - Fannie Mae - Fannie Mae - California,Refinancing,California,Apartment,Fannie Mae,Fannie Mae,,$13.3M; $13.3M; $13.3 million,$13.3M,1,1,1,REBusiness Online,KIRE Group Receives $13.3M Loan for Refinancing of Multifamily Property Near San Diego,California,93
2026-07-07,20260707-000948-c1f40a65,2026-07-07 00:09:48,DFP-57DB0FC8DC,DCL-20260707-025,80,Acquisition - Phoenix / Arizona - Alliance Sells Phoenix Apartments for $81.4M,Acquisition - Acquisition - Phoenix / Arizona - Alliance Sells Phoenix Apartments for $81.4M,Acquisition - Alliance Residential - Sun Belt,Acquisition,Phoenix / Arizona,Apartment,Alliance Residential,Unknown,,$81.4M; $81.4M; $81.4 million,,1,1,1,Connect CRE Phoenix,Alliance Sells Phoenix Apartments for $81.4M,Phoenix / Arizona,64
2026-07-07,20260707-000948-c1f40a65,2026-07-07 00:09:48,DFP-D2A594283B,DCL-20260707-006,80,Acquisition - Other / Unknown - Northmarq Arranges $14.3M Acquisition Loan for Kansas Multifamily Property,Acquisition - Acquisition - Other / Unknown - Northmarq Arranges $14.3M Acquisition Loan for Kansas Multifamily Property,Acquisition - Freddie Mac - Other / Unknown,Acquisition,Other / Unknown,Apartment,Freddie Mac,Freddie Mac,,$14.3M; $14.3M; $14.3 million,$14.3M,1,1,1,REBusiness Online,Northmarq Arranges $14.3M Acquisition Loan for Kansas Multifamily Property,Other / Unknown,75
2026-07-07,20260707-000948-c1f40a65,2026-07-07 00:09:48,DFP-369B7BD515,DCL-20260707-017,80,"Acquisition - Other / Unknown - JLL Brokers Sale of 33,140 SF Retail Center in Chicago’s Lincoln Park","Acquisition - Acquisition - Other / Unknown - JLL Brokers Sale of 33,140 SF Retail Center in Chicago’s Lincoln Park",Acquisition - JLL - Other / Unknown,Acquisition,Other / Unknown,Mixed-Use Residential,JLL,JLL,,$1 billion,,1,1,1,REBusiness Online,"JLL Brokers Sale of 33,140 SF Retail Center in Chicago’s Lincoln Park",Other / Unknown,66
2026-07-07,20260707-000948-c1f40a65,2026-07-07 00:09:48,DFP-966D4B6366,DCL-20260707-011,80,Acquisition - New York City / New York - Marcus & Millichap Brokers $3.8M Sale of Brooklyn Apartment Building,Acquisition - Acquisition - New York City / New York - Marcus & Millichap Brokers $3.8M Sale of Brooklyn Apartment Building,Acquisition - Marcus & Millichap - New York,Acquisition,New York City / New York,Apartment,Marcus & Millichap,Unknown,,$3.8M; $3.8M; $3.8 million,,1,1,1,REBusiness Online,Marcus & Millichap Brokers $3.8M Sale of Brooklyn Apartment Building,New York City / New York,73
2026-07-07,20260707-000948-c1f40a65,2026-07-07 00:09:48,DFP-4D0058AABC,DCL-20260707-031,80,Acquisition - Miami / Florida - Pembroke Pines Rental Asset Trades for $80.5M,Acquisition - Acquisition - Miami / Florida - Pembroke Pines Rental Asset Trades for $80.5M,Acquisition - Waterton - Sun Belt,Acquisition,Miami / Florida,Apartment,Waterton,Unknown,,$80.5M; $80.5M; $80.5 million,,1,1,1,Connect CRE South Florida,Pembroke Pines Rental Asset Trades for $80.5M,Miami / Florida,62
2026-07-07,20260707-000948-c1f40a65,2026-07-07 00:09:48,DFP-A491147BC8,DCL-20260707-030,80,General Project Signal - Houston / Texas - Fairfield Completes 14-Story Houston Multifamily Tower,General Project Signal - General Project Signal - Houston / Texas - Fairfield Completes 14-Story Houston Multifamily Tower,General Project Signal - Fairfield Residential - Houston / Texas,General Project Signal,Houston / Texas,Apartment,Fairfield Residential,Unknown,,$77.4 million,$77.4 million,1,1,1,Connect CRE Texas,Fairfield Completes 14-Story Houston Multifamily Tower,Houston / Texas,63
2026-07-07,20260707-000948-c1f40a65,2026-07-07 00:09:48,DFP-F956553AEB,DCL-20260707-034,80,General Project Signal - Dallas / Texas - JPI to Start Work on $90M Austin Apartment Project,General Project Signal - General Project Signal - Dallas / Texas - JPI to Start Work on $90M Austin Apartment Project,General Project Signal - JPI - Los Angeles,General Project Signal,Dallas / Texas,Mixed-Use Residential,JPI,Unknown,,$90M; $90M; $90 million,,1,1,1,Connect CRE Texas,JPI to Start Work on $90M Austin Apartment Project,Dallas / Texas,60
2026-07-07,20260707-000948-c1f40a65,2026-07-07 00:09:48,DFP-90985C0644,DCL-20260707-005,80,Office-to-Residential Conversion - Los Angeles / California - New details for plans to convert L.A. World Trade center into affordable housing,Office-to-Residential Conversion - Office-to-Residential Conversion - Los Angeles / California - New details for plans to convert L.A. World Trade center into affordable housing,Office-to-Residential Conversion - Kennedy Wilson - Los Angeles,Office-to-Residential Conversion,Los Angeles / California,Affordable Housing,Kennedy Wilson,Unknown,"4,000 homes",,,1,1,1,Urbanize LA,New details for plans to convert L.A. World Trade center into affordable housing,Los Angeles / California,81
2026-07-07,20260707-000948-c1f40a65,2026-07-07 00:09:48,DFP-166D245E9E,DCL-20260707-007,80,"Refinancing - Other / Unknown - JLL Provides $13.5M Agency Refinancing of Apartment Complex in Scarborough, Maine","Refinancing - Refinancing - Other / Unknown - JLL Provides $13.5M Agency Refinancing of Apartment Complex in Scarborough, Maine",Refinancing - JLL - Fannie Mae - Other / Unknown,Refinancing,Other / Unknown,Apartment,JLL,Fannie Mae,,$13.5M; $13.5M; $13.5 million,$13.5M,1,1,1,REBusiness Online,"JLL Provides $13.5M Agency Refinancing of Apartment Complex in Scarborough, Maine",Other / Unknown,75
2026-07-07,20260707-000948-c1f40a65,2026-07-07 00:09:48,DFP-57441C7FBC,DCL-20260707-013,80,Refinancing - Other / Unknown - Affinius Capital Supplies $180M for Jersey City Multifamily Tower,Refinancing - Refinancing - Other / Unknown - Affinius Capital Supplies $180M for Jersey City Multifamily Tower,Refinancing - JLL - walker & dunlop - Other / Unknown,Refinancing,Other / Unknown,Apartment,JLL,walker & dunlop,,$180M; $180M; $180m,,1,1,1,Commercial Observer,Affinius Capital Supplies $180M for Jersey City Multifamily Tower,Other / Unknown,73
2026-07-07,20260707-000948-c1f40a65,2026-07-07 00:09:48,DFP-8CECC39563,DCL-20260707-010,75,Acquisition - Georgia - Cushman & Wakefield Brokers $87M Sale of Apartment Community in Augusta,Acquisition - Acquisition - Georgia - Cushman & Wakefield Brokers $87M Sale of Apartment Community in Augusta,Acquisition - Unknown - Georgia,Acquisition,Georgia,Apartment,Unknown,cushman,,$87M; $87M; $87 million,,1,1,1,REBusiness Online,Cushman & Wakefield Brokers $87M Sale of Apartment Community in Augusta,Georgia,73
2026-07-07,20260707-000948-c1f40a65,2026-07-07 00:09:48,DFP-B43C70FF98,DCL-20260707-028,75,Acquisition - Atlanta / Georgia - Waypoint Pays $87M for Augusta Rental Asset,Acquisition - Acquisition - Atlanta / Georgia - Waypoint Pays $87M for Augusta Rental Asset,Acquisition - Unknown - Los Angeles,Acquisition,Atlanta / Georgia,Apartment,Unknown,cushman,,$87M; $87M; $87 million,,1,1,1,Connect CRE Apartments,Waypoint Pays $87M for Augusta Rental Asset,Atlanta / Georgia,63
2026-07-07,20260707-000948-c1f40a65,2026-07-07 00:09:48,DFP-6ED13BA76E,DCL-20260707-008,75,Acquisition - Sun Belt - RREAF Holdings CEO Kip Sowden Drives Southeast Real Estate,Acquisition - Acquisition - Sun Belt - RREAF Holdings CEO Kip Sowden Drives Southeast Real Estate,Acquisition - Unknown - Sun Belt,Acquisition,Sun Belt,Multifamily,Unknown,Unknown,"23,000 units",$4.8 billion,,1,1,1,Commercial Observer,RREAF Holdings CEO Kip Sowden Drives Southeast Real Estate,Sun Belt,74
2026-07-07,20260707-000948-c1f40a65,2026-07-07 00:09:48,DFP-FCF9676ECA,DCL-20260707-012,75,Development Start - Miami / Florida - Developer Begins Work on 476-Unit Delray Beach Rental Community,Development Start - Development Start - Miami / Florida - Developer Begins Work on 476-Unit Delray Beach Rental Community,Development Start - Unknown - Sun Belt,Development Start,Miami / Florida,Apartment,Unknown,wells fargo,,$120 million; $41.84 million,$120 million,1,1,1,Connect CRE South Florida,Developer Begins Work on 476-Unit Delray Beach Rental Community,Miami / Florida,73
2026-07-07,20260707-000948-c1f40a65,2026-07-07 00:09:48,DFP-A9436E3AA7,DCL-20260707-015,75,Disposition / Exit - Georgia - Cushman & Wakefield Brokers $87M Sale of Mason Augusta Apartment Community,Disposition / Exit - Disposition / Exit - Georgia - Cushman & Wakefield Brokers $87M Sale of Mason Augusta Apartment Community,Disposition / Exit - Unknown - Georgia,Disposition / Exit,Georgia,Apartment,Unknown,cushman,,$87M; $87 million; $188,,1,1,1,Yield PRO,Cushman & Wakefield Brokers $87M Sale of Mason Augusta Apartment Community,Georgia,69
2026-07-07,20260707-000948-c1f40a65,2026-07-07 00:09:48,DFP-F835DA1862,DCL-20260707-014,75,Disposition / Exit - Los Angeles / California - 45-Unit Garden Apartment Property Trades in LA’s Palms Neighborhood,Disposition / Exit - Disposition / Exit - Los Angeles / California - 45-Unit Garden Apartment Property Trades in LA’s Palms Neighborhood,Disposition / Exit - Unknown - Los Angeles,Disposition / Exit,Los Angeles / California,Apartment,Unknown,northmarq,,$13.125 million; $13.125 million,,1,1,1,Connect CRE,45-Unit Garden Apartment Property Trades in LA’s Palms Neighborhood,Los Angeles / California,69
2026-07-07,20260707-000948-c1f40a65,2026-07-07 00:09:48,DFP-AE21E024AD,DCL-20260707-018,75,Disposition / Exit - New York City / New York - Aimco Liquidates Last of Its NYC Portfolio in $23M Sale,Disposition / Exit - Disposition / Exit - New York City / New York - Aimco Liquidates Last of Its NYC Portfolio in $23M Sale,Disposition / Exit - Unknown - New York,Disposition / Exit,New York City / New York,Apartment,Unknown,Unknown,72 apartments,$23M; $23M; $23m,,1,1,1,Commercial Observer,Aimco Liquidates Last of Its NYC Portfolio in $23M Sale,New York City / New York,66
2026-07-07,20260707-000948-c1f40a65,2026-07-07 00:09:48,DFP-FF9B46AFBA,DCL-20260707-019,75,Disposition / Exit - New York City / New York - Ariel Closes Sale of Upper West Side Section 8 Apartments,Disposition / Exit - Disposition / Exit - New York City / New York - Ariel Closes Sale of Upper West Side Section 8 Apartments,Disposition / Exit - Unknown - New York,Disposition / Exit,New York City / New York,Affordable Housing,Unknown,Unknown,8 Apartments,$75; $75,,1,1,1,Connect CRE,Ariel Closes Sale of Upper West Side Section 8 Apartments,New York City / New York,65
2026-07-07,20260707-000948-c1f40a65,2026-07-07 00:09:48,DFP-AADFD2328C,DCL-20260707-023,75,"General Project Signal - New York City / New York - Revised Plan for Pacific Park Development Could Bring 5,600 Multifamily Apartment Units to...","General Project Signal - General Project Signal - New York City / New York - Revised Plan for Pacific Park Development Could Bring 5,600 Multifamily Apartment Units to...",General Project Signal - Unknown - New York,General Project Signal,New York City / New York,Apartment,Unknown,Unknown,"5,600 apartments",$5; $5,,1,1,1,Yield PRO,"Revised Plan for Pacific Park Development Could Bring 5,600 Multifamily Apartment Units to Downtown Brooklyn",New York City / New York,65
2026-07-07,20260707-000948-c1f40a65,2026-07-07 00:09:48,DFP-94BC2F861A,DCL-20260707-026,75,JV / Partnership - Los Angeles / California - L.A. City Council approves $2-billion Fourth & Central development,JV / Partnership - JV / Partnership - Los Angeles / California - L.A. City Council approves $2-billion Fourth & Central development,JV / Partnership - Unknown - Los Angeles,JV / Partnership,Los Angeles / California,Affordable Housing,Unknown,Unknown,262 units,$2; $2; $2,,1,1,1,Urbanize LA,L.A. City Council approves $2-billion Fourth & Central development,Los Angeles / California,64
2026-07-07,20260707-000948-c1f40a65,2026-07-07 00:09:48,DFP-69631B2324,DCL-20260707-036,75,"JV / Partnership - Los Angeles / California - Redwood West, Panattoni Team to Acquire Long Beach’s The Pike","JV / Partnership - JV / Partnership - Los Angeles / California - Redwood West, Panattoni Team to Acquire Long Beach’s The Pike",JV / Partnership - Unknown - Los Angeles,JV / Partnership,Los Angeles / California,General Residential,Unknown,northmarq,,$50 million,,1,1,1,Connect CRE California,"Redwood West, Panattoni Team to Acquire Long Beach’s The Pike",Los Angeles / California,59
2026-07-07,20260707-000948-c1f40a65,2026-07-07 00:09:48,DFP-257416C9D1,DCL-20260707-027,70,Acquisition - Dallas / Texas - IPA Negotiates Sale of 201-Unit Apartment Complex Near Downtown Dallas,Acquisition - Acquisition - Dallas / Texas - IPA Negotiates Sale of 201-Unit Apartment Complex Near Downtown Dallas,Acquisition - IPA - Los Angeles,Acquisition,Dallas / Texas,Apartment,IPA,Unknown,,,,1,1,1,REBusiness Online,IPA Negotiates Sale of 201-Unit Apartment Complex Near Downtown Dallas,Dallas / Texas,63
2026-07-07,20260707-000948-c1f40a65,2026-07-07 00:09:48,DFP-E983945E82,DCL-20260707-054,70,Disposition / Exit - Other / Unknown - Marcus & Millichap Arranges $4M Sale and Financing of Multifamily Asset in Northern New Je...,Disposition / Exit - Disposition / Exit - Other / Unknown - Marcus & Millichap Arranges $4M Sale and Financing of Multifamily Asset in Northern New Je...,Disposition / Exit - Marcus & Millichap - Other / Unknown,Disposition / Exit,Other / Unknown,Multifamily,Marcus & Millichap,Unknown,,$4M; $4 million; $235,$4M,1,1,1,Yield PRO,Marcus & Millichap Arranges $4M Sale and Financing of Multifamily Asset in Northern New Jersey,Other / Unknown,50
2026-07-07,20260707-000948-c1f40a65,2026-07-07 00:09:48,DFP-2417E09057,DCL-20260707-043,70,Disposition / Exit - Sun Belt - Marcus & Millichap Brokers Sale and Financing of Multifamily Asset in the Great Smoky Moun...,Disposition / Exit - Disposition / Exit - Sun Belt - Marcus & Millichap Brokers Sale and Financing of Multifamily Asset in the Great Smoky Moun...,Disposition / Exit - Marcus & Millichap - Sun Belt,Disposition / Exit,Sun Belt,Multifamily,Marcus & Millichap,Unknown,,,,1,1,1,Yield PRO,Marcus & Millichap Brokers Sale and Financing of Multifamily Asset in the Great Smoky Mountains,Sun Belt,55
2026-07-07,20260707-000948-c1f40a65,2026-07-07 00:09:48,DFP-7E53B37DC9,DCL-20260707-048,70,"Office-to-Residential Conversion - Los Angeles / California - Kennedy Wilson, Jamison To Convert LA World Trade Center In 4,000-Unit Affordable Housing...","Office-to-Residential Conversion - Office-to-Residential Conversion - Los Angeles / California - Kennedy Wilson, Jamison To Convert LA World Trade Center In 4,000-Unit Affordable Housing...",Office-to-Residential Conversion - Kennedy Wilson - Los Angeles,Office-to-Residential Conversion,Los Angeles / California,Affordable Housing,Kennedy Wilson,Unknown,,,,1,1,1,Bisnow,"Kennedy Wilson, Jamison To Convert LA World Trade Center In 4,000-Unit Affordable Housing Push",Los Angeles / California,54
2026-07-07,20260707-000948-c1f40a65,2026-07-07 00:09:48,DFP-920342F693,DCL-20260707-016,70,"Recapitalization - California - PEF Advisors, Freestone Capital Form JV to Recapitalize Affordable Properties","Recapitalization - Recapitalization - California - PEF Advisors, Freestone Capital Form JV to Recapitalize Affordable Properties",Recapitalization - PEF Advisors - California,Recapitalization,California,Affordable Housing,PEF Advisors,Unknown,,,,1,1,1,Connect CRE Orange County,"PEF Advisors, Freestone Capital Form JV to Recapitalize Affordable Properties",California,69
2026-07-07,20260707-000948-c1f40a65,2026-07-07 00:09:48,DFP-2F4DF00559,DCL-20260707-038,65,Acquisition - Atlanta / Georgia - Trinity Property Consultants Acquires 300-Unit Sandy Springs Georgia Apartment Complex,Acquisition - Acquisition - Atlanta / Georgia - Trinity Property Consultants Acquires 300-Unit Sandy Springs Georgia Apartment Complex,Acquisition - Unknown - Los Angeles,Acquisition,Atlanta / Georgia,Apartment,Unknown,Unknown,,$53 million; $53 million,,1,1,1,Yield PRO,Trinity Property Consultants Acquires 300-Unit Sandy Springs Georgia Apartment Complex,Atlanta / Georgia,57
2026-07-07,20260707-000948-c1f40a65,2026-07-07 00:09:48,DFP-BBDB341572,DCL-20260707-042,65,"Acquisition - Atlanta / Georgia - Mission Properties Adding 247 Apartment Units, Retail to Charlotte-Area Portfolio","Acquisition - Acquisition - Atlanta / Georgia - Mission Properties Adding 247 Apartment Units, Retail to Charlotte-Area Portfolio",Acquisition - Unknown - Los Angeles,Acquisition,Atlanta / Georgia,Apartment,Unknown,Unknown,,$7.4 million; $7.4 million,,1,1,1,Connect CRE Apartments,"Mission Properties Adding 247 Apartment Units, Retail to Charlotte-Area Portfolio",Atlanta / Georgia,55
2026-07-07,20260707-000948-c1f40a65,2026-07-07 00:09:48,DFP-32B30C099D,DCL-20260707-040,65,Construction Financing - New York City / New York - Grubb Properties Seals $377M in Financing for Financial District Resi Tower,Construction Financing - Construction Financing - New York City / New York - Grubb Properties Seals $377M in Financing for Financial District Resi Tower,Construction Financing - Unknown - New York,Construction Financing,New York City / New York,Multifamily,Unknown,Unknown,,$377M; $377M; $300 million,$377M,1,1,1,Commercial Observer,Grubb Properties Seals $377M in Financing for Financial District Resi Tower,New York City / New York,56
2026-07-07,20260707-000948-c1f40a65,2026-07-07 00:09:48,DFP-A4047DEB11,DCL-20260707-029,65,Construction Financing - Other / Unknown - LCOR Secures $192.5M Construction Loan for Biscayne Bay Multifamily Apartments,Construction Financing - Construction Financing - Other / Unknown - LCOR Secures $192.5M Construction Loan for Biscayne Bay Multifamily Apartments,Construction Financing - Unknown - Other / Unknown,Construction Financing,Other / Unknown,Apartment,Unknown,Unknown,544 apartments,$192.5M; $192.5 million; $49 million,$192.5M,1,1,1,Yield PRO,LCOR Secures $192.5M Construction Loan for Biscayne Bay Multifamily Apartments,Other / Unknown,63
2026-07-07,20260707-000948-c1f40a65,2026-07-07 00:09:48,DFP-22EE1ED222,DCL-20260707-032,65,Construction Financing - Miami / Florida - LCOR Inks $192.5M Construction Loan for Biscayne Bay Apartments,Construction Financing - Construction Financing - Miami / Florida - LCOR Inks $192.5M Construction Loan for Biscayne Bay Apartments,Construction Financing - Unknown - Sun Belt,Construction Financing,Miami / Florida,Apartment,Unknown,Unknown,,$192.5M; $192.5M; $192.5 million,$192.5M,1,1,1,Connect CRE South Florida,LCOR Inks $192.5M Construction Loan for Biscayne Bay Apartments,Miami / Florida,61
2026-07-07,20260707-000948-c1f40a65,2026-07-07 00:09:48,DFP-FE369D1FF6,DCL-20260707-033,65,Disposition / Exit - Los Angeles / California - LA City Council Approves $2-Billion Fourth & Central Mixed-Use Project,Disposition / Exit - Disposition / Exit - Los Angeles / California - LA City Council Approves $2-Billion Fourth & Central Mixed-Use Project,Disposition / Exit - Unknown - Los Angeles,Disposition / Exit,Los Angeles / California,Mixed-Use Residential,Unknown,Unknown,,$2; $2; $2,,1,1,1,Connect CRE California,LA City Council Approves $2-Billion Fourth & Central Mixed-Use Project,Los Angeles / California,61
2026-07-07,20260707-000948-c1f40a65,2026-07-07 00:09:48,DFP-39F0083CF5,DCL-20260707-041,65,Disposition / Exit - Phoenix / Arizona - Denver Apartment Venture Trades at Steep Loss,Disposition / Exit - Disposition / Exit - Phoenix / Arizona - Denver Apartment Venture Trades at Steep Loss,Disposition / Exit - Unknown - Sun Belt,Disposition / Exit,Phoenix / Arizona,Apartment,Unknown,Unknown,,$30 million; $63 million; $30 million,,1,1,1,Connect CRE,Denver Apartment Venture Trades at Steep Loss,Phoenix / Arizona,56
2026-07-07,20260707-000948-c1f40a65,2026-07-07 00:09:48,DFP-0BA7C3E8E6,DCL-20260707-020,65,Entitlement / Permitting - Beverly Hills / California - 23 homes slated for 227 N. Swall Drive in Beverly Hills,Entitlement / Permitting - Entitlement / Permitting - Beverly Hills / California - 23 homes slated for 227 N. Swall Drive in Beverly Hills,Entitlement / Permitting - Unknown - California,Entitlement / Permitting,Beverly Hills / California,Affordable Housing,Unknown,Unknown,23 homes,,,1,1,1,Urbanize LA,23 homes slated for 227 N. Swall Drive in Beverly Hills,Beverly Hills / California,65
2026-07-07,20260707-000948-c1f40a65,2026-07-07 00:09:48,DFP-C5D140963A,DCL-20260707-037,65,"Entitlement / Permitting - California - Preliminary Permits For Affordable Housing in North Natomas, Sacramento","Entitlement / Permitting - Entitlement / Permitting - California - Preliminary Permits For Affordable Housing in North Natomas, Sacramento",Entitlement / Permitting - Unknown - California,Entitlement / Permitting,California,Affordable Housing,Unknown,Unknown,140 units,,,1,1,1,SF YIMBY,"Preliminary Permits For Affordable Housing in North Natomas, Sacramento",California,58
2026-07-07,20260707-000948-c1f40a65,2026-07-07 00:09:48,DFP-0B5A6FA875,DCL-20260707-021,65,Entitlement / Permitting - Los Angeles / California - 62 apartments underway at 11103 Hartsook Ave. in North Hollywood,Entitlement / Permitting - Entitlement / Permitting - Los Angeles / California - 62 apartments underway at 11103 Hartsook Ave. in North Hollywood,Entitlement / Permitting - Unknown - Los Angeles,Entitlement / Permitting,Los Angeles / California,Apartment,Unknown,Unknown,62 apartments,,,1,1,1,Urbanize LA,62 apartments underway at 11103 Hartsook Ave. in North Hollywood,Los Angeles / California,65
2026-07-07,20260707-000948-c1f40a65,2026-07-07 00:09:48,DFP-E915F015CA,DCL-20260707-022,65,Entitlement / Permitting - Los Angeles / California - City Council upholds approval of mixed-use project at 1410 Main St. in Venice,Entitlement / Permitting - Entitlement / Permitting - Los Angeles / California - City Council upholds approval of mixed-use project at 1410 Main St. in Venice,Entitlement / Permitting - Unknown - Los Angeles,Entitlement / Permitting,Los Angeles / California,Affordable Housing,Unknown,Unknown,20 apartments,,,1,1,1,Urbanize LA,City Council upholds approval of mixed-use project at 1410 Main St. in Venice,Los Angeles / California,65
2026-07-07,20260707-000948-c1f40a65,2026-07-07 00:09:48,DFP-D6DFEEF551,DCL-20260707-047,65,"General Project Signal - Santa Monica / California - SB 79 takes effect, Measure ULA to remain, and more","General Project Signal - General Project Signal - Santa Monica / California - SB 79 takes effect, Measure ULA to remain, and more",General Project Signal - Unknown - California,General Project Signal,Santa Monica / California,Apartment,Unknown,Unknown,,$93,,1,1,1,Urbanize LA,"SB 79 takes effect, Measure ULA to remain, and more",Santa Monica / California,55
