run_date,run_id,run_timestamp,deal_fingerprint_id,duplicate_cluster_id,fingerprint_confidence,canonical_project_name,canonical_deal_name,canonical_event_name,deal_type,market,residential_sector,canonical_gp_or_developer,canonical_lender_or_debt_provider,unit_count,dollar_amount,loan_amount,source_count,article_count,duplicate_count,sources,article_titles,markets_detected,highest_deal_signal_score
2026-07-07,20260707-235900-c117bd3d,2026-07-07 23:59:00,DFP-879CECC4A4,DCL-20260707-025,65,Refinancing - Seattle - Gantry Secures $40M for Suburban Portland MF Assets,Refinancing - Refinancing - Seattle - Gantry Secures $40M for Suburban Portland MF Assets,Refinancing - Unknown - Seattle,Refinancing,Seattle,Apartment,Unknown,Unknown,,$40M; $40M; $20 million,$40M,1,1,1,Connect CRE,Gantry Secures $40M for Suburban Portland MF Assets,Seattle,64
2026-07-07,20260707-235900-c117bd3d,2026-07-07 23:59:00,DFP-B52EDC87BD,DCL-20260707-037,55,Construction Financing - Other / Unknown - Bravo Property Trust Lends $68M on New Jersey Waterfront Apartments,Construction Financing - Construction Financing - Other / Unknown - Bravo Property Trust Lends $68M on New Jersey Waterfront Apartments,Construction Financing - Unknown - Other / Unknown,Construction Financing,Other / Unknown,Apartment,Unknown,Unknown,,$68M; $68M; $68 million,$68M,1,1,1,Commercial Observer,Bravo Property Trust Lends $68M on New Jersey Waterfront Apartments,Other / Unknown,55
2026-07-07,20260707-235900-c117bd3d,2026-07-07 23:59:00,DFP-7EBBA487B2,DCL-20260707-033,55,Development Start - California - KTGY and SHAC Mark Announce Groundbreaking of 11 El Camino Real in San Carlos California,Development Start - Development Start - California - KTGY and SHAC Mark Announce Groundbreaking of 11 El Camino Real in San Carlos California,Development Start - Unknown - California,Development Start,California,Apartment,Unknown,Unknown,,,,1,1,1,Yield PRO,KTGY and SHAC Mark Announce Groundbreaking of 11 El Camino Real in San Carlos California,California,58
2026-07-07,20260707-235900-c117bd3d,2026-07-07 23:59:00,DFP-A243760600,DCL-20260707-056,55,Development Start - Dallas / Texas - JVP Begins Work on 110K-SF Office Building at Frisco’s The Mix,Development Start - Development Start - Dallas / Texas - JVP Begins Work on 110K-SF Office Building at Frisco’s The Mix,Development Start - Unknown - Los Angeles,Development Start,Dallas / Texas,Mixed-Use Residential,Unknown,Unknown,,,,1,1,1,Connect CRE Texas,JVP Begins Work on 110K-SF Office Building at Frisco’s The Mix,Dallas / Texas,38
2026-07-07,20260707-235900-c117bd3d,2026-07-07 23:59:00,DFP-CC7AC3449E,DCL-20260707-054,55,"Development Start - Texas - Core Spaces Advancing 2,201-Bed Texas A&M Student Housing Venture","Development Start - Development Start - Texas - Core Spaces Advancing 2,201-Bed Texas A&M Student Housing Venture",Development Start - Unknown - Texas,Development Start,Texas,Student Housing,Unknown,Unknown,,,,1,1,1,Connect CRE Texas,"Core Spaces Advancing 2,201-Bed Texas A&M Student Housing Venture",Texas,40
2026-07-07,20260707-235900-c117bd3d,2026-07-07 23:59:00,DFP-A7878F2700,DCL-20260707-058,55,Disposition / Exit - Los Angeles / California - Affordable for-sale housing proposed at 9019 Long Beach Blvd. in South Gate,Disposition / Exit - Disposition / Exit - Los Angeles / California - Affordable for-sale housing proposed at 9019 Long Beach Blvd. in South Gate,Disposition / Exit - Unknown - Los Angeles,Disposition / Exit,Los Angeles / California,Affordable Housing,Unknown,Unknown,,,,1,1,1,Urbanize LA,Affordable for-sale housing proposed at 9019 Long Beach Blvd. in South Gate,Los Angeles / California,36
2026-07-07,20260707-235900-c117bd3d,2026-07-07 23:59:00,DFP-B882660890,DCL-20260707-049,55,"Entitlement / Permitting - San Francisco / California - Renderings Revealed for 230 Anza Street, San Francisco","Entitlement / Permitting - Entitlement / Permitting - San Francisco / California - Renderings Revealed for 230 Anza Street, San Francisco",Entitlement / Permitting - Unknown - California,Entitlement / Permitting,San Francisco / California,Apartment,Unknown,Unknown,,,,1,1,1,SF YIMBY,"Renderings Revealed for 230 Anza Street, San Francisco",San Francisco / California,46
2026-07-07,20260707-235900-c117bd3d,2026-07-07 23:59:00,DFP-F37B482185,DCL-20260707-050,55,General Project Signal - Other / Unknown - Milhaus Receives Approval to Develop Kansas City Affordable Apartments,General Project Signal - General Project Signal - Other / Unknown - Milhaus Receives Approval to Develop Kansas City Affordable Apartments,General Project Signal - Unknown - Other / Unknown,General Project Signal,Other / Unknown,Affordable Housing,Unknown,Unknown,194 units,,,1,1,1,Connect CRE,Milhaus Receives Approval to Develop Kansas City Affordable Apartments,Other / Unknown,45
2026-07-07,20260707-235900-c117bd3d,2026-07-07 23:59:00,DFP-3ACCB4F19B,DCL-20260707-042,55,JV / Partnership - Riverside / California - C&C Development Opens Affordable Housing in Irvine,JV / Partnership - JV / Partnership - Riverside / California - C&C Development Opens Affordable Housing in Irvine,JV / Partnership - Unknown - California,JV / Partnership,Riverside / California,Affordable Housing,Unknown,Unknown,,,,1,1,1,Connect CRE Orange County,C&C Development Opens Affordable Housing in Irvine,Riverside / California,52
2026-07-07,20260707-235900-c117bd3d,2026-07-07 23:59:00,DFP-C22869AD6B,DCL-20260707-048,55,JV / Partnership - New York City / New York - Partnership Underway on 320-Unit Affordable Housing Project in Queens,JV / Partnership - JV / Partnership - New York City / New York - Partnership Underway on 320-Unit Affordable Housing Project in Queens,JV / Partnership - Unknown - New York,JV / Partnership,New York City / New York,Affordable Housing,Unknown,Unknown,,,,1,1,1,REBusiness Online,Partnership Underway on 320-Unit Affordable Housing Project in Queens,New York City / New York,47
2026-07-07,20260707-235900-c117bd3d,2026-07-07 23:59:00,DFP-0EF4EBBB63,DCL-20260707-051,55,Office-to-Residential Conversion - New York City / New York - Structural columns buckle on 21st floor of Manhattan adaptive reuse project,Office-to-Residential Conversion - Office-to-Residential Conversion - New York City / New York - Structural columns buckle on 21st floor of Manhattan adaptive reuse project,Office-to-Residential Conversion - Unknown - New York,Office-to-Residential Conversion,New York City / New York,Office-to-Residential Conversion,Unknown,Unknown,,,,1,1,1,Construction Dive,Structural columns buckle on 21st floor of Manhattan adaptive reuse project,New York City / New York,44
2026-07-07,20260707-235900-c117bd3d,2026-07-07 23:59:00,DFP-E8C582BBE3,DCL-20260707-052,55,Office-to-Residential Conversion - Other / Unknown - SSH Real Estate Begins Leasing 186-Unit Multifamily Redevelopment in Downtown Philadelphia,Office-to-Residential Conversion - Office-to-Residential Conversion - Other / Unknown - SSH Real Estate Begins Leasing 186-Unit Multifamily Redevelopment in Downtown Philadelphia,Office-to-Residential Conversion - Unknown - Other / Unknown,Office-to-Residential Conversion,Other / Unknown,Office-to-Residential Conversion,Unknown,Unknown,,$1; $1,,1,1,1,REBusiness Online,SSH Real Estate Begins Leasing 186-Unit Multifamily Redevelopment in Downtown Philadelphia,Other / Unknown,43
2026-07-07,20260707-235900-c117bd3d,2026-07-07 23:59:00,DFP-2F6D8F65F6,DCL-20260707-053,45,Development Start - Other / Unknown - Missing Middle Weakness,Development Start - Development Start - Other / Unknown - Missing Middle Weakness,Development Start - Unknown - Other / Unknown,Development Start,Other / Unknown,Apartment,Unknown,Unknown,,,,1,1,1,NAHB Eye on Housing - Multifamily,Missing Middle Weakness,Other / Unknown,41
2026-07-07,20260707-235900-c117bd3d,2026-07-07 23:59:00,DFP-53DEBBEA0C,DCL-20260707-059,45,Development Start - Other / Unknown - First Quarter 2026 Multifamily Construction Data,Development Start - Development Start - Other / Unknown - First Quarter 2026 Multifamily Construction Data,Development Start - Unknown - Other / Unknown,Development Start,Other / Unknown,Multifamily,Unknown,Unknown,,,,1,1,1,NAHB Eye on Housing - Multifamily,First Quarter 2026 Multifamily Construction Data,Other / Unknown,32
2026-07-07,20260707-235900-c117bd3d,2026-07-07 23:59:00,DFP-B90543DC0D,DCL-20260707-060,45,Development Start - Other / Unknown - Fourth Quarter 2025 Multifamily Construction Data,Development Start - Development Start - Other / Unknown - Fourth Quarter 2025 Multifamily Construction Data,Development Start - Unknown - Other / Unknown,Development Start,Other / Unknown,Multifamily,Unknown,Unknown,,,,1,1,1,NAHB Eye on Housing - Multifamily,Fourth Quarter 2025 Multifamily Construction Data,Other / Unknown,32
2026-07-07,20260707-235900-c117bd3d,2026-07-07 23:59:00,DFP-929C698B57,DCL-20260707-061,45,Development Start - Other / Unknown - Overall Housing Starts Inch Lower in 2025,Development Start - Development Start - Other / Unknown - Overall Housing Starts Inch Lower in 2025,Development Start - Unknown - Other / Unknown,Development Start,Other / Unknown,Multifamily,Unknown,Unknown,,,,1,1,1,NAHB Eye on Housing - Multifamily,Overall Housing Starts Inch Lower in 2025,Other / Unknown,32
2026-07-07,20260707-235900-c117bd3d,2026-07-07 23:59:00,DFP-9635218EA1,DCL-20260707-062,45,Development Start - Other / Unknown - Third Quarter 2025 Multifamily Construction Data,Development Start - Development Start - Other / Unknown - Third Quarter 2025 Multifamily Construction Data,Development Start - Unknown - Other / Unknown,Development Start,Other / Unknown,Multifamily,Unknown,Unknown,,,,1,1,1,NAHB Eye on Housing - Multifamily,Third Quarter 2025 Multifamily Construction Data,Other / Unknown,32
2026-07-07,20260707-235900-c117bd3d,2026-07-07 23:59:00,DFP-1563B53CA0,DCL-20260707-064,45,Disposition / Exit - Other / Unknown - NAHB HBGI: Micro Markets Lone Bright Spot for Single-Family Building in Fourth Quarter,Disposition / Exit - Disposition / Exit - Other / Unknown - NAHB HBGI: Micro Markets Lone Bright Spot for Single-Family Building in Fourth Quarter,Disposition / Exit - Unknown - Other / Unknown,Disposition / Exit,Other / Unknown,Multifamily,Unknown,Unknown,,,,1,1,1,NAHB Eye on Housing - Multifamily,NAHB HBGI: Micro Markets Lone Bright Spot for Single-Family Building in Fourth Quarter,Other / Unknown,26
2026-07-07,20260707-235900-c117bd3d,2026-07-07 23:59:00,DFP-AE0C2C64AA,DCL-20260707-063,45,General Project Signal - Other / Unknown - Multifamily Absorption Rate Remains Below 50%,General Project Signal - General Project Signal - Other / Unknown - Multifamily Absorption Rate Remains Below 50%,General Project Signal - Unknown - Other / Unknown,General Project Signal,Other / Unknown,Apartment,Unknown,Unknown,,,,1,1,1,NAHB Eye on Housing - Multifamily,Multifamily Absorption Rate Remains Below 50%,Other / Unknown,27
2026-07-07,20260707-235900-c117bd3d,2026-07-07 23:59:00,DFP-2B25BDC3A2,DCL-20260707-057,45,"JV / Partnership - Other / Unknown - Tidemark, BOD Holdings Complete 135-Unit Multifamily Project in Somersworth, New Hampshire","JV / Partnership - JV / Partnership - Other / Unknown - Tidemark, BOD Holdings Complete 135-Unit Multifamily Project in Somersworth, New Hampshire",JV / Partnership - Unknown - Other / Unknown,JV / Partnership,Other / Unknown,Apartment,Unknown,Unknown,,,,1,1,1,REBusiness Online,"Tidemark, BOD Holdings Complete 135-Unit Multifamily Project in Somersworth, New Hampshire",Other / Unknown,38
