run_date,run_id,run_timestamp,deal_fingerprint_id,duplicate_cluster_id,fingerprint_confidence,canonical_project_name,canonical_deal_name,canonical_event_name,deal_type,market,residential_sector,canonical_gp_or_developer,canonical_lender_or_debt_provider,unit_count,dollar_amount,loan_amount,source_count,article_count,duplicate_count,sources,article_titles,markets_detected,highest_deal_signal_score
2026-07-07,20260707-235900-c117bd3d,2026-07-07 23:59:00,DFP-83B387F4E2,DCL-20260707-004,100,General Project Signal - Florida - Walker & Dunlop Arranges $232M Financing for Workforce Housing Portfolio,General Project Signal - General Project Signal - Florida - Walker & Dunlop Arranges $232M Financing for Workforce Housing Portfolio,General Project Signal - Walker & Dunlop - Florida,General Project Signal,Florida,Affordable Housing,Walker & Dunlop,walker & dunlop,"1,585 units",$232M; $232; $232m,$232M,1,1,1,Yield PRO,Walker & Dunlop Arranges $232M Financing for Workforce Housing Portfolio,Florida,81
2026-07-07,20260707-235900-c117bd3d,2026-07-07 23:59:00,DFP-5F7E3990AC,DCL-20260707-002,90,"Acquisition - Atlanta / Georgia - Northmarq Arranges $25.5M Sale of Manufactured Housing Community in Duluth, Minnesota","Acquisition - Acquisition - Atlanta / Georgia - Northmarq Arranges $25.5M Sale of Manufactured Housing Community in Duluth, Minnesota",Acquisition - Freddie Mac - Los Angeles,Acquisition,Atlanta / Georgia,Manufactured Housing,Freddie Mac,Freddie Mac,,$25.5M; $25.5M; $25.5 million,$25.5m,1,1,1,REBusiness Online,"Northmarq Arranges $25.5M Sale of Manufactured Housing Community in Duluth, Minnesota",Atlanta / Georgia,85
2026-07-07,20260707-235900-c117bd3d,2026-07-07 23:59:00,DFP-BB73BB97D4,DCL-20260707-001,90,Disposition / Exit - California - Yorba Linda Parking Lot Sells for Townhome Redevelopment,Disposition / Exit - Disposition / Exit - California - Yorba Linda Parking Lot Sells for Townhome Redevelopment,Disposition / Exit - CBRE - California,Disposition / Exit,California,Apartment,CBRE,CBRE,,$8.12; $8.12,,1,1,1,Connect CRE Orange County,Yorba Linda Parking Lot Sells for Townhome Redevelopment,California,89
2026-07-07,20260707-235900-c117bd3d,2026-07-07 23:59:00,DFP-5508FCE9F0,DCL-20260707-012,90,Disposition / Exit - California - Former Bank Branch Positioned as Development Opportunity in Garden Grove Sale,Disposition / Exit - Disposition / Exit - California - Former Bank Branch Positioned as Development Opportunity in Garden Grove Sale,Disposition / Exit - CBRE - California,Disposition / Exit,California,General Residential,CBRE,CBRE,,$11 million; $1; $11 million,,1,1,1,Connect CRE Orange County,Former Bank Branch Positioned as Development Opportunity in Garden Grove Sale,California,74
2026-07-07,20260707-235900-c117bd3d,2026-07-07 23:59:00,DFP-C9AF8EBD2C,DCL-20260707-003,90,General Project Signal - California - Northmarq Secures Fannie Mae DUS Financing for National City Apartments,General Project Signal - General Project Signal - California - Northmarq Secures Fannie Mae DUS Financing for National City Apartments,General Project Signal - Fannie Mae - California,General Project Signal,California,Apartment,Fannie Mae,Fannie Mae,,$13.275 million; $13.275 million,$13.275 million,1,1,1,Connect CRE California,Northmarq Secures Fannie Mae DUS Financing for National City Apartments,California,83
2026-07-07,20260707-235900-c117bd3d,2026-07-07 23:59:00,DFP-773C26BD64,DCL-20260707-009,90,JV / Partnership - National - JLL Arranges Trophy Seniors Housing Portfolio Sale,JV / Partnership - JV / Partnership - National - JLL Arranges Trophy Seniors Housing Portfolio Sale,JV / Partnership - JLL - National,JV / Partnership,National,Senior Housing,JLL,JLL,344 units,,,1,1,1,Connect CRE,JLL Arranges Trophy Seniors Housing Portfolio Sale,National,75
2026-07-07,20260707-235900-c117bd3d,2026-07-07 23:59:00,DFP-57DB0FC8DC,DCL-20260707-023,80,Acquisition - Phoenix / Arizona - Alliance Sells Phoenix Apartments for $81.4M,Acquisition - Acquisition - Phoenix / Arizona - Alliance Sells Phoenix Apartments for $81.4M,Acquisition - Alliance Residential - Sun Belt,Acquisition,Phoenix / Arizona,Apartment,Alliance Residential,Unknown,,$81.4M; $81.4M; $81.4 million,,1,1,1,Connect CRE Phoenix,Alliance Sells Phoenix Apartments for $81.4M,Phoenix / Arizona,64
2026-07-07,20260707-235900-c117bd3d,2026-07-07 23:59:00,DFP-B0B29026B7,DCL-20260707-032,80,Acquisition - Atlanta / Georgia - CBRE Arranges Sale of 16-Story Moore Office Building in Nashville,Acquisition - Acquisition - Atlanta / Georgia - CBRE Arranges Sale of 16-Story Moore Office Building in Nashville,Acquisition - CBRE - Los Angeles,Acquisition,Atlanta / Georgia,General Residential,CBRE,CBRE,,,,1,1,1,REBusiness Online,CBRE Arranges Sale of 16-Story Moore Office Building in Nashville,Atlanta / Georgia,59
2026-07-07,20260707-235900-c117bd3d,2026-07-07 23:59:00,DFP-C0C501891F,DCL-20260707-011,80,Acquisition - New York - JLL Capital Markets Arranges Sale of 421-Unit Trophy Apartment Community in Affluent West...,Acquisition - Acquisition - New York - JLL Capital Markets Arranges Sale of 421-Unit Trophy Apartment Community in Affluent West...,Acquisition - Kennedy Wilson - New York,Acquisition,New York,Apartment,Kennedy Wilson,JLL,,,,1,1,1,Yield PRO,JLL Capital Markets Arranges Sale of 421-Unit Trophy Apartment Community in Affluent West Harrison Submarket,New York,74
2026-07-07,20260707-235900-c117bd3d,2026-07-07 23:59:00,DFP-4D0058AABC,DCL-20260707-026,80,Acquisition - Miami / Florida - Pembroke Pines Rental Asset Trades for $80.5M,Acquisition - Acquisition - Miami / Florida - Pembroke Pines Rental Asset Trades for $80.5M,Acquisition - Waterton - Sun Belt,Acquisition,Miami / Florida,Apartment,Waterton,Unknown,,$80.5M; $80.5M; $80.5 million,,1,1,1,Connect CRE South Florida,Pembroke Pines Rental Asset Trades for $80.5M,Miami / Florida,62
2026-07-07,20260707-235900-c117bd3d,2026-07-07 23:59:00,DFP-4535EC72AA,DCL-20260707-006,80,"Acquisition - Dallas / Texas - IPA Arranges Sale of 250-Unit Alta Firewheel Apartments in Garland, Texas","Acquisition - Acquisition - Dallas / Texas - IPA Arranges Sale of 250-Unit Alta Firewheel Apartments in Garland, Texas",Acquisition - Wood Partners - Los Angeles,Acquisition,Dallas / Texas,Apartment,Wood Partners,Unknown,250 units,,,1,1,1,REBusiness Online,"IPA Arranges Sale of 250-Unit Alta Firewheel Apartments in Garland, Texas",Dallas / Texas,77
2026-07-07,20260707-235900-c117bd3d,2026-07-07 23:59:00,DFP-34FBAA2573,DCL-20260707-035,80,Disposition / Exit - National - Berkadia Hires C&W’s Blake Okland as Chief Revenue Officer,Disposition / Exit - Disposition / Exit - National - Berkadia Hires C&W’s Blake Okland as Chief Revenue Officer,Disposition / Exit - Berkadia - National,Disposition / Exit,National,Multifamily,Berkadia,Berkadia,,,,1,1,1,Commercial Observer,Berkadia Hires C&W’s Blake Okland as Chief Revenue Officer,National,56
2026-07-07,20260707-235900-c117bd3d,2026-07-07 23:59:00,DFP-442538C4EC,DCL-20260707-031,80,Disposition / Exit - Florida - Marcus & Millichap Arranges $4.6M Sale of Multifamily Asset in Daytona Beach Area,Disposition / Exit - Disposition / Exit - Florida - Marcus & Millichap Arranges $4.6M Sale of Multifamily Asset in Daytona Beach Area,Disposition / Exit - Marcus & Millichap - Florida,Disposition / Exit,Florida,Multifamily,Marcus & Millichap,Unknown,,$4.6M; $4.6 million; $4.6m,$4.6M,1,1,1,Yield PRO,Marcus & Millichap Arranges $4.6M Sale of Multifamily Asset in Daytona Beach Area,Florida,60
2026-07-07,20260707-235900-c117bd3d,2026-07-07 23:59:00,DFP-72ABDDB5C1,DCL-20260707-007,80,Entitlement / Permitting - Santa Monica / California - Fresh renderings for mixed-use project at 2716 Ocean Park Blvd. in Santa Monica,Entitlement / Permitting - Entitlement / Permitting - Santa Monica / California - Fresh renderings for mixed-use project at 2716 Ocean Park Blvd. in Santa Monica,Entitlement / Permitting - High Street Residential - California,Entitlement / Permitting,Santa Monica / California,Mixed-Use Residential,High Street Residential,Unknown,400 homes,,,1,1,1,Urbanize LA,Fresh renderings for mixed-use project at 2716 Ocean Park Blvd. in Santa Monica,Santa Monica / California,77
2026-07-07,20260707-235900-c117bd3d,2026-07-07 23:59:00,DFP-90985C0644,DCL-20260707-005,80,Office-to-Residential Conversion - Los Angeles / California - New details for plans to convert L.A. World Trade center into affordable housing,Office-to-Residential Conversion - Office-to-Residential Conversion - Los Angeles / California - New details for plans to convert L.A. World Trade center into affordable housing,Office-to-Residential Conversion - Kennedy Wilson - Los Angeles,Office-to-Residential Conversion,Los Angeles / California,Affordable Housing,Kennedy Wilson,Unknown,"4,000 homes",,,1,1,1,Urbanize LA,New details for plans to convert L.A. World Trade center into affordable housing,Los Angeles / California,81
2026-07-07,20260707-235900-c117bd3d,2026-07-07 23:59:00,DFP-2687E3C5CF,DCL-20260707-010,80,Refinancing - Other / Unknown - Affinius Capital Provides $188M Refi for N.J. Mixed-Use Apartment Complex,Refinancing - Refinancing - Other / Unknown - Affinius Capital Provides $188M Refi for N.J. Mixed-Use Apartment Complex,Refinancing - PCCP - cushman - Other / Unknown,Refinancing,Other / Unknown,Mixed-Use Residential,PCCP,cushman,,$188M; $188M; $188m,$188m,1,1,1,Commercial Observer,Affinius Capital Provides $188M Refi for N.J. Mixed-Use Apartment Complex,Other / Unknown,75
2026-07-07,20260707-235900-c117bd3d,2026-07-07 23:59:00,DFP-FCF9676ECA,DCL-20260707-013,75,Development Start - Miami / Florida - Developer Begins Work on 476-Unit Delray Beach Rental Community,Development Start - Development Start - Miami / Florida - Developer Begins Work on 476-Unit Delray Beach Rental Community,Development Start - Unknown - Sun Belt,Development Start,Miami / Florida,Apartment,Unknown,wells fargo,,$120 million; $41.84 million,$120 million,1,1,1,Connect CRE South Florida,Developer Begins Work on 476-Unit Delray Beach Rental Community,Miami / Florida,73
2026-07-07,20260707-235900-c117bd3d,2026-07-07 23:59:00,DFP-4D0E972DF8,DCL-20260707-015,75,Disposition / Exit - Los Angeles / California - 45-Unit Garden Apartment Property Trades in LA’s Palms Neighborhood,Disposition / Exit - Disposition / Exit - Los Angeles / California - 45-Unit Garden Apartment Property Trades in LA’s Palms Neighborhood,Disposition / Exit - Unknown - Los Angeles,Disposition / Exit,Los Angeles / California,Apartment,Unknown,northmarq,,$13.125; $13.125,,1,1,1,Connect CRE Apartments,45-Unit Garden Apartment Property Trades in LA’s Palms Neighborhood,Los Angeles / California,69
2026-07-07,20260707-235900-c117bd3d,2026-07-07 23:59:00,DFP-69B2C26FDB,DCL-20260707-016,75,Disposition / Exit - Atlanta / Georgia - Northmarq Arranges $25.5M Sale of Minnesota Manufactured Housing Park,Disposition / Exit - Disposition / Exit - Atlanta / Georgia - Northmarq Arranges $25.5M Sale of Minnesota Manufactured Housing Park,Disposition / Exit - Unknown - Los Angeles,Disposition / Exit,Atlanta / Georgia,Manufactured Housing,Unknown,northmarq,,$25.5M; $25.5; $25.5m,,1,1,1,Yield PRO,Northmarq Arranges $25.5M Sale of Minnesota Manufactured Housing Park,Atlanta / Georgia,69
2026-07-07,20260707-235900-c117bd3d,2026-07-07 23:59:00,DFP-1CAFF87681,DCL-20260707-017,75,Disposition / Exit - Atlanta / Georgia - Northmarq’s Mid-Atlantic Team Completes $26M Sale of Manufactured Home Community,Disposition / Exit - Disposition / Exit - Atlanta / Georgia - Northmarq’s Mid-Atlantic Team Completes $26M Sale of Manufactured Home Community,Disposition / Exit - Unknown - Los Angeles,Disposition / Exit,Atlanta / Georgia,Manufactured Housing,Unknown,northmarq,,$26M; $26M; $25.5,,1,1,1,Connect CRE,Northmarq’s Mid-Atlantic Team Completes $26M Sale of Manufactured Home Community,Atlanta / Georgia,69
2026-07-07,20260707-235900-c117bd3d,2026-07-07 23:59:00,DFP-FF9B46AFBA,DCL-20260707-024,75,Disposition / Exit - New York City / New York - Ariel Closes Sale of Upper West Side Section 8 Apartments,Disposition / Exit - Disposition / Exit - New York City / New York - Ariel Closes Sale of Upper West Side Section 8 Apartments,Disposition / Exit - Unknown - New York,Disposition / Exit,New York City / New York,Affordable Housing,Unknown,Unknown,8 Apartments,$75; $75,,1,1,1,Connect CRE Apartments,Ariel Closes Sale of Upper West Side Section 8 Apartments,New York City / New York,64
2026-07-07,20260707-235900-c117bd3d,2026-07-07 23:59:00,DFP-407E0A2A47,DCL-20260707-030,75,General Project Signal - New York - Meridian Arranges 10-Year Refi Loan for Kew Gardens Apartments,General Project Signal - General Project Signal - New York - Meridian Arranges 10-Year Refi Loan for Kew Gardens Apartments,General Project Signal - Unknown - New York,General Project Signal,New York,Apartment,Unknown,jpmorgan,,$16; $16,$16,1,1,1,Connect CRE,Meridian Arranges 10-Year Refi Loan for Kew Gardens Apartments,New York,61
2026-07-07,20260707-235900-c117bd3d,2026-07-07 23:59:00,DFP-743CC0F74B,DCL-20260707-020,70,Acquisition - Los Angeles / California - How Alliance Residential navigated the sales market to buy 2K apartments since December,Acquisition - Acquisition - Los Angeles / California - How Alliance Residential navigated the sales market to buy 2K apartments since December,Acquisition - Alliance Residential - Los Angeles,Acquisition,Los Angeles / California,Apartment,Alliance Residential,Unknown,,,,1,1,1,Multifamily Dive,How Alliance Residential navigated the sales market to buy 2K apartments since December,Los Angeles / California,65
2026-07-07,20260707-235900-c117bd3d,2026-07-07 23:59:00,DFP-D5033783A8,DCL-20260707-008,70,JV / Partnership - Other / Unknown - Developers Close on Parcel for South Weymouth Naval Air Station Redevelopment,JV / Partnership - JV / Partnership - Other / Unknown - Developers Close on Parcel for South Weymouth Naval Air Station Redevelopment,JV / Partnership - Brookfield - Other / Unknown,JV / Partnership,Other / Unknown,Apartment,Brookfield,Unknown,,$65,,1,1,1,Connect CRE,Developers Close on Parcel for South Weymouth Naval Air Station Redevelopment,Other / Unknown,75
2026-07-07,20260707-235900-c117bd3d,2026-07-07 23:59:00,DFP-7DE7318768,DCL-20260707-036,70,Refinancing - Other / Unknown - PCCP Provides $80M Loan for the Refinance of a 343-Unit Class A Apartment Property in Beth...,Refinancing - Refinancing - Other / Unknown - PCCP Provides $80M Loan for the Refinance of a 343-Unit Class A Apartment Property in Beth...,Refinancing - PCCP - Other / Unknown,Refinancing,Other / Unknown,Apartment,PCCP,Unknown,,$80M; $80 million; $80m,$80M,1,1,1,Yield PRO,PCCP Provides $80M Loan for the Refinance of a 343-Unit Class A Apartment Property in Bethesda Maryland,Other / Unknown,56
2026-07-07,20260707-235900-c117bd3d,2026-07-07 23:59:00,DFP-97CCEFA663,DCL-20260707-027,65,Acquisition - New York City / New York - Nuveen Buys Pair of Upper West Side Multifamily Properties for $75M,Acquisition - Acquisition - New York City / New York - Nuveen Buys Pair of Upper West Side Multifamily Properties for $75M,Acquisition - Unknown - New York,Acquisition,New York City / New York,Apartment,Unknown,Unknown,,$75M; $75M; $75m,,1,1,1,Commercial Observer,Nuveen Buys Pair of Upper West Side Multifamily Properties for $75M,New York City / New York,61
2026-07-07,20260707-235900-c117bd3d,2026-07-07 23:59:00,DFP-50B2153A68,DCL-20260707-034,65,BTR / Build-to-Rent - Phoenix / Arizona - Cavan Cos. Closes Largest Single-Asset Build-for-Rent Multifamily Sale in Phoenix,BTR / Build-to-Rent - BTR / Build-to-Rent - Phoenix / Arizona - Cavan Cos. Closes Largest Single-Asset Build-for-Rent Multifamily Sale in Phoenix,BTR / Build-to-Rent - Unknown - Sun Belt,BTR / Build-to-Rent,Phoenix / Arizona,BTR / Single-Family Rental,Unknown,Unknown,,$112.5 million; $112.5 million,,1,1,1,Yield PRO,Cavan Cos. Closes Largest Single-Asset Build-for-Rent Multifamily Sale in Phoenix,Phoenix / Arizona,56
2026-07-07,20260707-235900-c117bd3d,2026-07-07 23:59:00,DFP-22EE1ED222,DCL-20260707-028,65,Construction Financing - Miami / Florida - LCOR Inks $192.5M Construction Loan for Biscayne Bay Apartments,Construction Financing - Construction Financing - Miami / Florida - LCOR Inks $192.5M Construction Loan for Biscayne Bay Apartments,Construction Financing - Unknown - Sun Belt,Construction Financing,Miami / Florida,Apartment,Unknown,Unknown,,$192.5M; $192.5M; $192.5 million,$192.5M,1,1,1,Connect CRE South Florida,LCOR Inks $192.5M Construction Loan for Biscayne Bay Apartments,Miami / Florida,61
2026-07-07,20260707-235900-c117bd3d,2026-07-07 23:59:00,DFP-FE369D1FF6,DCL-20260707-029,65,Disposition / Exit - Los Angeles / California - LA City Council Approves $2-Billion Fourth & Central Mixed-Use Project,Disposition / Exit - Disposition / Exit - Los Angeles / California - LA City Council Approves $2-Billion Fourth & Central Mixed-Use Project,Disposition / Exit - Unknown - Los Angeles,Disposition / Exit,Los Angeles / California,Mixed-Use Residential,Unknown,Unknown,,$2; $2; $2,,1,1,1,Connect CRE California,LA City Council Approves $2-Billion Fourth & Central Mixed-Use Project,Los Angeles / California,61
2026-07-07,20260707-235900-c117bd3d,2026-07-07 23:59:00,DFP-39F0083CF5,DCL-20260707-040,65,Disposition / Exit - Phoenix / Arizona - Denver Apartment Venture Trades at Steep Loss,Disposition / Exit - Disposition / Exit - Phoenix / Arizona - Denver Apartment Venture Trades at Steep Loss,Disposition / Exit - Unknown - Sun Belt,Disposition / Exit,Phoenix / Arizona,Apartment,Unknown,Unknown,,$30 million; $63 million; $30 million,,1,1,1,Connect CRE Apartments,Denver Apartment Venture Trades at Steep Loss,Phoenix / Arizona,54
2026-07-07,20260707-235900-c117bd3d,2026-07-07 23:59:00,DFP-0BA7C3E8E6,DCL-20260707-021,65,Entitlement / Permitting - Beverly Hills / California - 23 homes slated for 227 N. Swall Drive in Beverly Hills,Entitlement / Permitting - Entitlement / Permitting - Beverly Hills / California - 23 homes slated for 227 N. Swall Drive in Beverly Hills,Entitlement / Permitting - Unknown - California,Entitlement / Permitting,Beverly Hills / California,Affordable Housing,Unknown,Unknown,23 homes,,,1,1,1,Urbanize LA,23 homes slated for 227 N. Swall Drive in Beverly Hills,Beverly Hills / California,65
2026-07-07,20260707-235900-c117bd3d,2026-07-07 23:59:00,DFP-E915F015CA,DCL-20260707-022,65,Entitlement / Permitting - Los Angeles / California - City Council upholds approval of mixed-use project at 1410 Main St. in Venice,Entitlement / Permitting - Entitlement / Permitting - Los Angeles / California - City Council upholds approval of mixed-use project at 1410 Main St. in Venice,Entitlement / Permitting - Unknown - Los Angeles,Entitlement / Permitting,Los Angeles / California,Affordable Housing,Unknown,Unknown,20 apartments,,,1,1,1,Urbanize LA,City Council upholds approval of mixed-use project at 1410 Main St. in Venice,Los Angeles / California,65
2026-07-07,20260707-235900-c117bd3d,2026-07-07 23:59:00,DFP-D6DFEEF551,DCL-20260707-039,65,"General Project Signal - Santa Monica / California - SB 79 takes effect, Measure ULA to remain, and more","General Project Signal - General Project Signal - Santa Monica / California - SB 79 takes effect, Measure ULA to remain, and more",General Project Signal - Unknown - California,General Project Signal,Santa Monica / California,Apartment,Unknown,Unknown,,$93,,1,1,1,Urbanize LA,"SB 79 takes effect, Measure ULA to remain, and more",Santa Monica / California,55
2026-07-07,20260707-235900-c117bd3d,2026-07-07 23:59:00,DFP-AD925F8C52,DCL-20260707-047,65,General Project Signal - Florida - Trevato Breaks Ground on $120M Multifamily Development at Former Water Park in Jacksonvill...,General Project Signal - General Project Signal - Florida - Trevato Breaks Ground on $120M Multifamily Development at Former Water Park in Jacksonvill...,General Project Signal - Unknown - Florida,General Project Signal,Florida,Affordable Housing,Unknown,Unknown,,$120M; $120M; $120 million,,1,1,1,REBusiness Online,Trevato Breaks Ground on $120M Multifamily Development at Former Water Park in Jacksonville Beach,Florida,49
2026-07-07,20260707-235900-c117bd3d,2026-07-07 23:59:00,DFP-C95C5E873A,DCL-20260707-038,65,General Project Signal - Los Angeles / California - Mixed-use affordable housing slated for 9700 W. Venice Blvd. in Palms,General Project Signal - General Project Signal - Los Angeles / California - Mixed-use affordable housing slated for 9700 W. Venice Blvd. in Palms,General Project Signal - Unknown - Los Angeles,General Project Signal,Los Angeles / California,Affordable Housing,Unknown,Unknown,490 apartments,,,1,1,1,Urbanize LA,Mixed-use affordable housing slated for 9700 W. Venice Blvd. in Palms,Los Angeles / California,55
2026-07-07,20260707-235900-c117bd3d,2026-07-07 23:59:00,DFP-5F98FB3565,DCL-20260707-043,65,General Project Signal - Atlanta / Georgia - Developer Duo Adding 350 Apartments to Dunwoody Mixed-Use Project,General Project Signal - General Project Signal - Atlanta / Georgia - Developer Duo Adding 350 Apartments to Dunwoody Mixed-Use Project,General Project Signal - Unknown - Los Angeles,General Project Signal,Atlanta / Georgia,Mixed-Use Residential,Unknown,Unknown,350 Apartments,,,1,1,1,Connect CRE Atlanta,Developer Duo Adding 350 Apartments to Dunwoody Mixed-Use Project,Atlanta / Georgia,51
2026-07-07,20260707-235900-c117bd3d,2026-07-07 23:59:00,DFP-E369F4D81D,DCL-20260707-045,65,General Project Signal - Dallas / Texas - Trademark Opens The Vickery in Ft. Worth,General Project Signal - General Project Signal - Dallas / Texas - Trademark Opens The Vickery in Ft. Worth,General Project Signal - Unknown - Los Angeles,General Project Signal,Dallas / Texas,Apartment,Unknown,Unknown,307 apartments,,,1,1,1,Connect CRE Texas,Trademark Opens The Vickery in Ft. Worth,Dallas / Texas,51
2026-07-07,20260707-235900-c117bd3d,2026-07-07 23:59:00,DFP-1CC92B04D8,DCL-20260707-055,65,General Project Signal - Other / Unknown - 2026 Resident Experience Management Report,General Project Signal - General Project Signal - Other / Unknown - 2026 Resident Experience Management Report,General Project Signal - Unknown - Other / Unknown,General Project Signal,Other / Unknown,Multifamily,Unknown,Unknown,250 units,$4; $4; $90,,1,1,1,Multifamily Executive,2026 Resident Experience Management Report,Other / Unknown,40
2026-07-07,20260707-235900-c117bd3d,2026-07-07 23:59:00,DFP-22F1CFEBB8,DCL-20260707-044,65,General Project Signal - Southeast - McShane Construction Delivers 262-Unit Apartment Development in Greenville,General Project Signal - General Project Signal - Southeast - McShane Construction Delivers 262-Unit Apartment Development in Greenville,General Project Signal - Unknown - Southeast,General Project Signal,Southeast,Apartment,Unknown,Unknown,,$1; $2,,1,1,1,REBusiness Online,McShane Construction Delivers 262-Unit Apartment Development in Greenville,Southeast,51
2026-07-07,20260707-235900-c117bd3d,2026-07-07 23:59:00,DFP-C771F888AB,DCL-20260707-046,65,General Project Signal - Miami / Florida - Dezer Advancing Plan for 600 N. Miami Apartment Units,General Project Signal - General Project Signal - Miami / Florida - Dezer Advancing Plan for 600 N. Miami Apartment Units,General Project Signal - Unknown - Sun Belt,General Project Signal,Miami / Florida,Apartment,Unknown,Unknown,269 apartments,,,1,1,1,Connect CRE South Florida,Dezer Advancing Plan for 600 N. Miami Apartment Units,Miami / Florida,49
2026-07-07,20260707-235900-c117bd3d,2026-07-07 23:59:00,DFP-29C24D57C3,DCL-20260707-018,65,Office-to-Residential Conversion - Miami / Florida - Keyah Lands $38M to Reposition Miami Beach Hotel Into a Starwood Brand,Office-to-Residential Conversion - Office-to-Residential Conversion - Miami / Florida - Keyah Lands $38M to Reposition Miami Beach Hotel Into a Starwood Brand,Office-to-Residential Conversion - Unknown - Sun Belt,Office-to-Residential Conversion,Miami / Florida,Office-to-Residential Conversion,Unknown,Unknown,,$38M; $38M; $38 million,$38M,1,1,1,Commercial Observer,Keyah Lands $38M to Reposition Miami Beach Hotel Into a Starwood Brand,Miami / Florida,68
2026-07-07,20260707-235900-c117bd3d,2026-07-07 23:59:00,DFP-3A117CD672,DCL-20260707-014,65,Refinancing - California - Slatt Capital Arranges Life Company Loan for Novato Multifamily,Refinancing - Refinancing - California - Slatt Capital Arranges Life Company Loan for Novato Multifamily,Refinancing - Unknown - California,Refinancing,California,Apartment,Unknown,Unknown,,$21; $21,$21,1,1,1,Connect CRE Apartments,Slatt Capital Arranges Life Company Loan for Novato Multifamily,California,73
2026-07-07,20260707-235900-c117bd3d,2026-07-07 23:59:00,DFP-48E08EB561,DCL-20260707-019,65,Refinancing - California - Slatt Capital Arranges $21M Refinance for 213-Unit Multifamily Community in Novato Califor...,Refinancing - Refinancing - California - Slatt Capital Arranges $21M Refinance for 213-Unit Multifamily Community in Novato Califor...,Refinancing - Unknown - California,Refinancing,California,Multifamily,Unknown,Unknown,,$21M; $21; $21m,$21M,1,1,1,Yield PRO,Slatt Capital Arranges $21M Refinance for 213-Unit Multifamily Community in Novato California,California,68
2026-07-07,20260707-235900-c117bd3d,2026-07-07 23:59:00,DFP-311AFEFB6F,DCL-20260707-041,65,Refinancing - National - Gantry Secures $40M for Pair of Oregon Multifamily Properties,Refinancing - Refinancing - National - Gantry Secures $40M for Pair of Oregon Multifamily Properties,Refinancing - Unknown - National,Refinancing,National,Apartment,Unknown,Unknown,,$40M; $20 million; $40m,$40M,1,1,1,Yield PRO,Gantry Secures $40M for Pair of Oregon Multifamily Properties,National,53
