run_date,run_id,run_timestamp,regime,raw_score,normalized_score,final_score,strength_label,supporting_signals,interpretation
2026-07-07,20260707-235900-c117bd3d,2026-07-07 23:59:00,Selective Capital Re-entry,134,89,89,Very Strong,Institutional Flow articles: 19; Deal Size Signal articles: 6; Institutional player mentions: 12,"Institutional flow, deal-size, or major-player activity suggests capital-market re-engagement."
2026-07-07,20260707-235900-c117bd3d,2026-07-07 23:59:00,Financing Stress,121,81,81,Very Strong,Financing Risk articles: 18; Financing/cap-rate market signals: 8; Financing matched-keyword articles: 15,"Debt, rates, refinancing, or cap-rate pressure is visible enough to affect underwriting attention."
2026-07-07,20260707-235900-c117bd3d,2026-07-07 23:59:00,Policy / Entitlement Watch,96,64,64,Strong,Regulation Risk articles: 4; Policy matched-keyword articles: 4; California / Los Angeles focus count: 4,"Policy, zoning, permitting, entitlement, rent-control, or housing-production signals require monitoring."
2026-07-07,20260707-235900-c117bd3d,2026-07-07 23:59:00,Developer Strategy Shift,88,59,59,Moderate,Developer Strategy articles: 31; Developer matched-keyword articles: 16; Must Read articles: 39,"Developer behavior, product strategy, adaptive reuse, BTR, modular, or operating-model signals are visible."
2026-07-07,20260707-235900-c117bd3d,2026-07-07 23:59:00,Supply Pressure,61,41,41,Moderate,Supply Pressure articles: 1; Supply/vacancy/concession signals: 10; Supply matched-keyword articles: 1,"Supply, starts, deliveries, lease-up, vacancy, or concession signals are visible."
2026-07-07,20260707-235900-c117bd3d,2026-07-07 23:59:00,Construction Cost Pressure,4,3,3,Not Detected,Cost Control articles: 0; Construction Cost Signal articles: 0; Cost matched-keyword articles: 1,Construction Cost Pressure is not a meaningful signal in this run.
2026-07-07,20260707-235900-c117bd3d,2026-07-07 23:59:00,Stable Monitoring Environment,0,0,0,Not Detected,Highest active regime score before stable adjustment: 134; Monitor articles: 2,Stable Monitoring Environment is not a meaningful signal in this run.
