run_date,run_id,canonical_project_id,canonical_project_name,project_identity_confidence,run_timestamp,project_or_deal_name,deal_type,asset_type,residential_sector,market,city_or_submarket,state_or_region,gp_or_developer,canonical_gp_or_developer,institutional_partner,lender_or_debt_provider,canonical_lender_or_debt_provider,capital_partner,canonical_capital_partner,canonical_market,unit_count,dollar_amount,loan_amount,acquisition_price,development_cost,cap_rate,rent_growth,vacancy_rate,concession_signal,construction_start_or_delivery_timing,entitlement_or_permitting_stage,deal_signal_score,deal_priority_label,potential_woomi_use,source_article_title,source,url,relevance_score,deal_fingerprint_id,fingerprint_confidence,canonical_deal_name,canonical_event_name,duplicate_cluster_id,duplicate_count
2026-05-19,20260519-021700-3e3a74df,PRJ-20260519-0106,General Project Signal - Other / Unknown - Walker & Dunlop Arranges Equity Syndication for Colorado Affordable Multifamily Community...,80,2026-05-19 02:17:00,Development Start - Other / Unknown - Fourth Quarter 2025 Multifamily Construction Data,Development Start,Multifamily,Multifamily,Other / Unknown,Unknown,Unknown,Unknown,Unknown,Unknown,Unknown,Unknown,Unknown,Unknown,Other / Unknown,,,,,,,,,,,,32,Low Detail Signal,Pipeline / supply signal,Fourth Quarter 2025 Multifamily Construction Data,NAHB Eye on Housing - Multifamily,https://eyeonhousing.org/2026/03/fourth-quarter-2025-multifamily-construction-data/,63,DFP-B90543DC0D,45,Development Start - Development Start - Other / Unknown - Fourth Quarter 2025 Multifamily Construction Data,Development Start - Unknown - Other / Unknown,DCL-20260519-054,1
2026-05-19,20260519-021700-3e3a74df,PRJ-20260519-0106,General Project Signal - Other / Unknown - Walker & Dunlop Arranges Equity Syndication for Colorado Affordable Multifamily Community...,80,2026-05-19 02:17:00,Development Start - Other / Unknown - Major Development Groundbreaking on Landmark Multifamily Mixed-Use Community The Piazza at...,Development Start,Mixed-Use Residential,Mixed-Use Residential,Other / Unknown,Unknown,Unknown,Unknown,Unknown,Unknown,Unknown,Unknown,Unknown,Unknown,Other / Unknown,,,,,,,,,,,,32,Low Detail Signal,Pipeline / supply signal,Major Development Groundbreaking on Landmark Multifamily Mixed-Use Community The Piazza at Ardmore in Philadelphia,Yield PRO,https://yieldpro.com/2026/05/the-piazza-at-ardmore/,64,DFP-6508E5D9F9,45,Development Start - Development Start - Other / Unknown - Major Development Groundbreaking on Landmark Multifamily Mixed-Use Community The Piazza at...,Development Start - Unknown - Other / Unknown,DCL-20260519-055,1
2026-05-19,20260519-021700-3e3a74df,PRJ-20260519-0106,General Project Signal - Other / Unknown - Walker & Dunlop Arranges Equity Syndication for Colorado Affordable Multifamily Community...,80,2026-05-19 02:17:00,Development Start - Other / Unknown - Overall Housing Starts Inch Lower in 2025,Development Start,Multifamily,Multifamily,Other / Unknown,Unknown,Unknown,Unknown,Unknown,Unknown,Unknown,Unknown,Unknown,Unknown,Other / Unknown,,,,,,,,,,,,32,Low Detail Signal,Pipeline / supply signal,Overall Housing Starts Inch Lower in 2025,NAHB Eye on Housing - Multifamily,https://eyeonhousing.org/2026/02/overall-housing-starts-inch-lower-in-2025/,63,DFP-929C698B57,45,Development Start - Development Start - Other / Unknown - Overall Housing Starts Inch Lower in 2025,Development Start - Unknown - Other / Unknown,DCL-20260519-056,1
2026-05-19,20260519-021700-3e3a74df,PRJ-20260519-0106,General Project Signal - Other / Unknown - Walker & Dunlop Arranges Equity Syndication for Colorado Affordable Multifamily Community...,80,2026-05-19 02:17:00,Development Start - Other / Unknown - Third Quarter 2025 Multifamily Construction Data,Development Start,Multifamily,Multifamily,Other / Unknown,Unknown,Unknown,Unknown,Unknown,Unknown,Unknown,Unknown,Unknown,Unknown,Other / Unknown,,,,,,,,,,,,32,Low Detail Signal,Pipeline / supply signal,Third Quarter 2025 Multifamily Construction Data,NAHB Eye on Housing - Multifamily,https://eyeonhousing.org/2026/01/third-quarter-2025-multifamily-construction-data/,63,DFP-9635218EA1,45,Development Start - Development Start - Other / Unknown - Third Quarter 2025 Multifamily Construction Data,Development Start - Unknown - Other / Unknown,DCL-20260519-057,1
2026-05-19,20260519-021700-3e3a74df,PRJ-20260519-0106,General Project Signal - Other / Unknown - Walker & Dunlop Arranges Equity Syndication for Colorado Affordable Multifamily Community...,80,2026-05-19 02:17:00,"Entitlement / Permitting - Other / Unknown - Preliminary Permits Filed For 3350 West Bayshore Road, Palo Alto",Entitlement / Permitting,Apartment,Apartment,Other / Unknown,Unknown,Unknown,Unknown,Unknown,Unknown,Unknown,Unknown,Unknown,Unknown,Other / Unknown,,,,,,,,,,,Permits,32,Low Detail Signal,Entitlement / zoning watch,"Preliminary Permits Filed For 3350 West Bayshore Road, Palo Alto",SF YIMBY,https://sfyimby.com/2026/05/preliminary-permits-filed-for-3350-west-bayshore-road-palo-alto.html,64,DFP-BE4F6DEBA7,45,"Entitlement / Permitting - Entitlement / Permitting - Other / Unknown - Preliminary Permits Filed For 3350 West Bayshore Road, Palo Alto",Entitlement / Permitting - Unknown - Other / Unknown,DCL-20260519-058,1
2026-05-19,20260519-021700-3e3a74df,PRJ-20260519-0106,General Project Signal - Other / Unknown - Walker & Dunlop Arranges Equity Syndication for Colorado Affordable Multifamily Community...,80,2026-05-19 02:17:00,General Project Signal - Other / Unknown - Multifamily Absorption Rate Remains Below 50%,General Project Signal,Apartment,Apartment,Other / Unknown,Unknown,Unknown,Unknown,Unknown,Unknown,Unknown,Unknown,Unknown,Unknown,Other / Unknown,,,,,,,,,,completed,,27,Low Detail Signal,Monitor only,Multifamily Absorption Rate Remains Below 50%,NAHB Eye on Housing - Multifamily,https://eyeonhousing.org/2026/03/multifamily-absorption-rate-remains-below-50/,78,DFP-AE0C2C64AA,45,General Project Signal - General Project Signal - Other / Unknown - Multifamily Absorption Rate Remains Below 50%,General Project Signal - Unknown - Other / Unknown,DCL-20260519-059,1
2026-05-19,20260519-021700-3e3a74df,PRJ-20260519-0106,General Project Signal - Other / Unknown - Walker & Dunlop Arranges Equity Syndication for Colorado Affordable Multifamily Community...,80,2026-05-19 02:17:00,Disposition / Exit - Other / Unknown - NAHB HBGI: Micro Markets Lone Bright Spot for Single-Family Building in Fourth Quarter,Disposition / Exit,Multifamily,Multifamily,Other / Unknown,Unknown,Unknown,Unknown,Unknown,Unknown,Unknown,Unknown,Unknown,Unknown,Other / Unknown,,,,,,,,,,,,26,Low Detail Signal,Monitor only,NAHB HBGI: Micro Markets Lone Bright Spot for Single-Family Building in Fourth Quarter,NAHB Eye on Housing - Multifamily,https://eyeonhousing.org/2026/03/nahb-hbgi-micro-markets-lone-bright-spot-for-single-family-building-in-fourth-quarter/,57,DFP-1563B53CA0,45,Disposition / Exit - Disposition / Exit - Other / Unknown - NAHB HBGI: Micro Markets Lone Bright Spot for Single-Family Building in Fourth Quarter,Disposition / Exit - Unknown - Other / Unknown,DCL-20260519-060,1
2026-05-19,20260519-021700-3e3a74df,PRJ-20260519-0106,General Project Signal - Other / Unknown - Walker & Dunlop Arranges Equity Syndication for Colorado Affordable Multifamily Community...,80,2026-05-19 02:17:00,BTR / Build-to-Rent - Other / Unknown - Build-to-rent sale mandate cut from House’s ROAD to Housing bill,BTR / Build-to-Rent,BTR / Single-Family Rental,BTR / Single-Family Rental,Other / Unknown,Unknown,Unknown,Unknown,Unknown,Unknown,Unknown,Unknown,Unknown,Unknown,Other / Unknown,,,,,,,,,,,,24,Low Detail Signal,Pipeline / supply signal,Build-to-rent sale mandate cut from House’s ROAD to Housing bill,Multifamily Dive,https://www.multifamilydive.com/news/build-to-rent-house-road-to-housing-bill/820391/,50,DFP-428AB2DAAB,45,BTR / Build-to-Rent - BTR / Build-to-Rent - Other / Unknown - Build-to-rent sale mandate cut from House’s ROAD to Housing bill,BTR / Build-to-Rent - Unknown - Other / Unknown,DCL-20260519-061,1
